processed_data,target
đóng gói hàng cẩn_thận son mùi thơm lên màu đẹp mua rất đáng đồng_tiền,2
son nhìn sang lắm nè màu đánh lên môi đẹp nhưng mùi hơi nồng nói_chung 70 k mà dc 1 cây son nv là quá hời,2
được tặng chung với cay mascara của eglips nữa vừa săn đc voucher 10 k vừa được tặng rẻ quá chời,2
son mauf đẹp nhưng không được thơm với giá_như này thì ok rồi giao hàng hơi lâu,2
giá rẻ màu lên rất mượt nhưng mình khuyên các bạn nên dưỡng môi nhé đánh này lâu ngày khô môi lắm ạ,2
son rất đẹp vì săn đc hôm giảm giá nên k mất tiền mùi thơm nhưng màu hơi nhạt xíu nhưng thôi k mâtd tiền nên cx ưng r,2
son thơm socola mà giao hàng lâu hơn bình_thường ấy hic giá săn sale nên khá ok OK_hand mọi người nên mua nhe,2
màu đẹp son mượt với giá này thì quá okie ròi ạ khong đòi_hỏi gì nhiều,2
son hơi bé tại tiền nào son như thế mình thấy nhiều bạn bảo son bị đóng cực các thứ mới đầu mình cũng sợ ai_ngờ mua về quá_sức tưởng tưởng của mình son rất đepj mịn nữa lên môi rất xinh_đẹp thực_sự í sẽ tiếp_tục ủng_hộ shop mọi người nên mua thử có 1 điểm trừ là son về hơi lâu son kh lì lắm,2
son đepj rẻ mình săn sale cả ship có 19 k thôi,2
okok nha nên mua giá rẻ nha,2
shop phục_vụ rất tốt rất đáng tiền chất_lượng sản_phẩm tuyệt_vời,2
son siêu xinh luôn màu 302 siêu đẹp son khá lì đóng_gói sản_phẩm đẹp cẩn_thận khuyên mọi người nên mua em mua đợt sale đc giá 47 k cảm_giác quá là son mịn,2
màu này tớ dùng oki make lên dùng thì hợp hơn nên mua nhé mua sale rẻ vch,2
son đẹp cjats son mịn màu đẹp mà còn thơm nữa moi người nên mua nha rẻ mà đẹp mỗi tội giao hàng chậm,2
màu xinh mà rẻ nhma hơi khô tí,2
son oke giá ok tgian giao hàng hơi lâu nhma màu đẹp mng nên mua nhé,2
mùi thơm lắm ạ săn dc sale nên càng rẻ nà,2
hàng về nhanh giao đúng mẫu son hơi khó tán giá rẻ tạm đc,2
son mịn có mùi thơm cafe tuy_nhiên thì hơi lâu trôi 1 xiu giá này mua được son như vậy là ok rồi,2
son rất oke với giá tiền này thì quá là nên mua luôn ạ cho 10 điểm luôn packing đẹp màu i hình,2
chất_lượng sản_phẩm tuyệt_vời đóng_gói sản_phẩm tốt đáng tiền,2
sp phù_hợp giá tiền son ban_đầu mùi hơi hắc một lúc sau bay_hơi ra một_chút mùi socola,2
rất đẹp hợp với giá tiền nên mua hàng quốc_tế nên giao hơi lâu nhưng sản_phẩm rất đáng_giá tiền và màu lên chuẩn nên mua mọi người à 5 sao tặng cho shop uy_tín chất_lượng gút chóp_shop beaming_face_with_smiling_eyes,2
giao hàng nhanh hỏa tốc lun son màu đẹp lắm săn sale nên được tặng thêm 1 cây son nữa và túi tote nữa,2
chỉ vì thích mẫu thiết_kế mà mình mua á rolling_on_the_floor_laughing mà phải công_nhận đẹp dã_man nha màu v17 tone răng và da mặt lắm mình thuộc tone da lạnh đánh cái màu ai cũng khen săn sale mua được giá quá ngon_lành cành đào face_blowing_a_kiss mùi son thơm nhẹ nói_chung đẹp k chê vào đâu được mng nên mua đừng chần_chừ nhe smiling_face_with_hearts,2
giao hàng hơi lâu nhưng mà đáng lắm lun săn sale rẻ nma son chất_lượng lắm hơi khô môi chút nhưng đc cái lên môi rất đẹp tôn da trắng răng nha,2
bao_bì xinh chất son mịn mượt không bị khô môi quá ổn với giá sale này white_heart black_heart,2
son hơi bết môi mùi nhẹ săn sale nên giá cũng được,2
đóng gói hàng cẩn_thận màu 25 này xinh và quá hot luôn rồi tranh_thủ săn được sale của bia oficial luôn thì chất_lượng khỏi bàn,2
son xinh mà rẻ từ vỏ đến màu từ ngoài vào trong đều xinh lắm mê_li luân,2
trời ơi cái màu 502 phải gọi là siêu siêu đỉnh luôn nha_cam hồng đất hơi nude nhẹ da nào cũng đánh đc luôn í đánh đi học cũng đc luôn chất son khá oke mềm mượt như tên nma k có lớp tint bám lại đâu nha nên tầm 2 3 tiếng nên dặm lại nchung là cực thích 9 k 2 thỏi quá rẻ so vs chất_lượng,2
giao chậm vcđ lần sau thì t cho nghỉ son giá đắt sale r vẫn đắt_giá này mua son romand bia còn hơn,0
giao hàng nhanh chưa tới 7 ngày màu này độc lạ đẹp vỏ các kiểu thì như mẫu rồi thumbs_up đáng tiền video không liên_quan,2
son đẹp lên mịn môi không bị bột vón cục giá_thành rẻ so với chất_lượng,2
hàng rất đẹp nha các bạn nhưng mùi hơi khó_chịu nma với giá tiền này thì ok ạ,2
ui xịn sò lắm ngeng mn màu cũng khá là ok mùi cũng ko thơm lắm nhưng mà với cái giá này thì ko còn gì để chê đâu ạ,2
chất_lượng sản_phẩm tuyệt_vời đóng_gói sản_phẩm tốt rất đáng tiền,2
màu son đẹp ạ cưng xỉu luôn ý chất son mịn_mà ko có mùi ạ ncl rất ưng ạ vừa ưng giá lại vừa ưng chất_lượng,2
siêu ưng luôn giá còn rẻ nữa nên mua nha mọi người hình_ảnh và video chỉ để nhận xu,2
hàng đẹp với xịn lắm nha phù_hợp với giá tiền mọi người nên mua,2
son hơi lỏng nhanh trôi lúc lấy son thì hơi không được đẹp so với giá tiền thì cũng ổn,2
giao hàng nhanh đóng_gói kỹ son lên màu rất đẹp săn sale giá siêu hạt dẻ,2
màu_da mình là da ngăm thì mình thấy rất oke nhé săn sale được giá quá hời luôn chất son của bia thì mình k chê gì cả có ngậm giấy thì k bị ra mấy còn chưa đánh son lúc ăn nên k rõ nha nói_chung là mn nên mua nhé màu lạnh lạnh rất oke luôn,2
màu hơi tối k phù_hợp với mấy bạn da đen nha với giá này mà nhận đc cây son như_vầy thì ok r nha đáng mua,2
rẻ mà đẹp rất đáng tiền mua mùa khá thích nên mua smiling_face_with_hearts smiling_face_with_heart eyes,2
giao hành nhanh đủ đúng mẫu sản_phẩm như mô_tả giá_thành hợp_lí chất_lượng,2
vỏ son thiết_kế đơn_giản mà đẹp cầm nặng_tay màu son lên đúng màu dễ đánh hình mình chụp là màu dưới ánh_sáng tự_nhiên mình mua cây này đợt sale rất rẻ luôn ưng lắm,2
hàng đẹp giá rẻ chất_lượng giao hàng hơi lâu,2
son lên mày đẹp cầm nặng_tay chắc_chắn giá hạt_dẻ mà siêu chim_ưng nha nên mua nha,2
son xinh màu đẹp mua shope mal nên yên_tâm k lo hàng giả lại còn giá rẻ nữa hơi khô nên nhớ dùng son_dưỡng trc khi bôi nhe face_blowing_a_kiss,2
cũng oke mà mùi hơi z z tí với_lại khó tán màu nhưng giá rẻ nên tạm crying_face,2
hàng về đúng mẫu k thiếu giao hàng siêu nhanh luộ ạ săn sale nên đc giá rẻ sẽ ủng_hộ shop lần sau ạ hình_ảnh chỉ mang tính_chất minh_họa thôi ạ rolling_on_the_floor_laughing,2
giao hàng hơi lâu giá giảm sale nhiều màu sáng tươi phù_hợp,2
lên màu cực đỉnh đúng màu hơi khô xíu nma chất son mịn rẻ nữa đáng mua nha mn,2
mình mua sale 2 thỏi 9 k khá rẻ son lên môi mềm mượt nhưng có_vẻ hơi lâu khô trên môi ncl giá rẻ nên ok,2
màu son ok mỗi tội hơi nhanh trôi nói_chung phù_hợp với giá tiền ảnh chỉ mang tc nhận xu ạ,2
son đẹp chất_lượng tốt giá hợp_lý đóng_góp đẹp giao nhanh,2
thơm mùi socola màu đẹp nhưng đánh lên môi bị khô k bám màu với giá tiền như này thì cũng chấp_nhận được,2
đẹp đi_đôi với giá tiền k mong gì nhiều shiper thân_thiện,2
công_dụng son kết_cấu 7 d độ bền_màu 9 d son có mùi kẹo socola thơm màu y hình mình đặt nhầm màu nhưng nhận dc son thấy đẹp ship 12 ngày hơi lâu xíu vì gần tết bao_bì son đẹp đóng_gói hơi sơ_sài nhưng vs giá vậy là oke r,2
màu 403 cưng dã_man kem lót bị lem nhưng mà những sản_phẩm khác đều oke mùi khá dễ_chịu lên tone nhẹ reẻ,2
đẹp lắm rất là ưng nka mà ship hơi lâu cx nữa tháng ms giao mà son đẹp rẻ thơm mùi giống bút nho,2
sản_phẩm phù_hợp với giá tiền ủng_hộ dài_dài hình_ảnh video chỉ mang tính_chất nhận xu,2
màu son siêu đỉnh màu hot luôn ý ạ giá rẻ tuyệt zoi lắm sẽ ủng_hộ lần sau,2
đóng gói đẹp nhưng màu son hơi thất_vọng bôi lên môi k đc tự_nhiên độ bám cũng ko ăn_thua nc là bth tiền nào của đó,2
màu son rất cute luôn nhưng mk thấy chất son ko đc mịn lắm nhưng với số tiền này là rất ưng rùi với cả đc cái là màu khá xinh kissing_face_with_closed_eyes face_blowing_a_kiss sẽ tiếp_tục ủng_hộ shop smiling_face_with_hearts,2
son màu xinh rất tôn da và chất son rất dễ đánh shop đóng_gói rất cẩn_thận red_heart red_heart mua đợt sale nên chỉ 69 k 1 em là quá tuyệt_vời luôn ạ,2
mùa dịch nên hàng giao hơi lâu xíu nhưng không sao màu này xinh đỉnh lắm nha mọi người nhưng không được lì cho lắm nói_chung với giá này thì ổn,2
mình mua này tặng sn b hàng đóng_gói rất kĩ rất đáng tiền,2
son xinh mướt màu đẹp xỉu luôn á giá_cả hợp_lí chất son đã lắm,2
shop chuẩn_bị hàng và giao hàng nhanh gọn chất_lượng sản_phẩm ổn_áp so với giá ạ,2
son đẹp chất son mịn mùi thơm nhưng nhìn màu trên ảnh thì đẹp còn thực_tế thì màu khác quá nói_chung giá rẻ nên cũng khá ưng bụng làm màu nền rồi mix thêm màu son khác thì đẹp giao hàng hơi lâu giao đúng hôm mình hết tiền huhu,2
không có gì để chê với mức giá đó hình_ảnh mang tính_chất nhận xu clapping_hands,2
giao hàng nhanh đóng_gói cẩn_thận sản_phẩm ok giá siêu rẻ hihi,2
giao hàng nhanh đóng_gói cẩn_thận son hơi bột nhưng với giá này thì cũng ok rồi,2
sp khá ok vừa giá học_sinh mùi cũng thơm nhẹ nhưng giao hàng hơi chậm mn mua có_thể mua shop này nhé video và hình_ảnh mang tính_chất nhận shopxu nhé,2
son siêu xinh gói hàng đẹp cẩn mua đc dịp săn sale mà nhận hàng ko hề bị lâu thumbs_up hình_ảnh và vdeo ko lquan cho lắm hihi,2
màu son rất là đẹp luôn mua đi mọi người ơi thích lắm luôn giá lại okela nữa,2
son siêu đẹp m g ạ hơn mình nghĩ rất nhiều lun ấy mùi son thơm rất rất đáng tiền,2
màu 401 như cam đất ko nâu như hình đâu mn màu 403 thì chuẩn nha hơi có mùi hương_liệu so vs giá thì rất ok rồi nha,2
sản_phẩm phù_hợp giá tiền giao hàng nhanh chất_lượng oke giao hàng vui_vẻ nhiệt_tình,2
hàng đẹp đáng mua màu cũng rất đẹp hàng săn sale nên cực rẻ nha,2
mua hai được bar và cả bar đều xinh 3 cây son chưa tới 30 k,2
hàng chuẩn giá xinh giao nhanh chất_lượng tuyệt_vời star struck smiling_face_with_hearts face_blowing_a_kiss smiling_face_with_heart eyes face_blowing_a_kiss smiling_face_with_hearts face_blowing_a_kiss,2
son màu đẹp nhưng k bám vào lòng môi được khó tán nhưng với giá này thì ok,2
màu xinh da ngăm đánh cũng xinh mùi cũng xinh nma mấy son nội_địa trung này giá rẻ làm mình ko iên tâm lắm,1
son thơm đẹp mua 1 tặng 1 với giá 85 k nè,2
shop giao hàng nhanh son lên màu đẹp chất son hơi bột không bám môi cho lắm nhưng mà so với giá tiền thì quá ổn nên mua ạ,2
chất_lượng sản_phẩm ok giao hàng nhanh_chóng phù_hợp với giá tiền hình_ảnh video mang tính nhận,2
công_dụng để son màu lên môi nhìn xinh quá là ok cũng lâu trôi giá rẻ có_vẻ chất_lượng,2
không hiểu shop làm_ăn kiểu gì luôn á bán son chắc vì đam_mê thôi chứ son đẹp quá_trời mà giá lại quá ưng lại còn được mua 1 tặng 1 luôn hic mua của pd quá nhìu goy nên k biết nói gì thêm nữa 10 star,2
son xinh lắm mn ạ 5 màu t mua t đều ưng hết thích nhất màu 402 rẻ mà chất_lượng ghe woman_gesturing_OK,2
đóng gói có túi chống xóc 10 đỉm màu son xinh bám môi mình dùng 302 404 lòng môi ưng lắm ạ hic mua combo có 9 k nên dự là lại mua thêm,2
rẻ xinh màu đẹp date cao hàng quốc_tế nên ship lâu nhưng chất_lượng siêu oke nhé mn ơi son vỏ xinh siêu chất son hơi lỳ bám tốt mùi k thơm tẹo,2
giá rẽ hợp với ví tiền học mình ko ưng cho lắm chất kem kiểu bị vón cục ý hình anh chỉ mang tính nhận su,2
màu xinh mà mướt săn sale 2 cây có 150 k rẻ quá_trời luôn aá,2
vừa nhận đc son phải khui ngay chất son mền mịn trên môi khá là oke nhưng có_vẻ dễ trôi nhưng với giá này thì mình rất ưng nha,2
giao hàng nhanh giá_cả hợp_lí son_chất rất mượt màu lên khá tây mn nên mua nhé,2
mình tháy son màu ok nhưng son lhp môi nha mn giá rẻ khối lương cx ko nhiều nha,2
công_dụng son kết_cấu tạm được màu lên cũng xinh không lì lắm vơid giá này thì ổn mng mua cũng được nha ship cũng nhanh không bị tắc đơn tạm được nha,2
son màu đẹp giá rẻ chưa sử_dụng nên k biết chất_lượng ntn ship quốc_tế lâu ncl ok,2
son mầu đẹp lắm nhé mình rất ưng giá sale hợp túi_tiền ok lắm,2
son lên đúng màu đỏ hồng mình thích giá cũng ok giao hàng lâu khủng_khiếp luôn ạ đóng_gói cẩn_thận xinh_xắn,2
mọi người ơi nên mua nha son ở ngoài xinh hơn đẹp hơn nhá nên mua giá rẻ vậy thôi chật lượng k kém gì son cin đâu nha màu lên chuẩn đẹp và mùi thơm mùi nha,2
kiểu mình bị nghiện em 1 này ấy son rất hợp với mấy đứa da tb sáng như mình chất son cực mịn giá lại quá rẻ mình mua 1 lúc hai cây sài cho lâu sẽ mua lại,2
đóng gói cẩn_thận giao hàng nhanh shiper thân_thiện vì combo giảm_giá nên quất luôn 4 cây son xài k biết bao_giờ mới hết,2
son lì nhưng không check được mã hàng quá_xá là lâu chắc gần nửa tháng do vận_chuyển bên nước_ngoài nhưng giá rẻ,2
mình ít khi nào viết đánh_giá sp lắm vì mình lười vãi đ nhưng mà mình phải quay lại đây viết đánh_giá và gửi shop 5 vì son đẹp mà_còn rẻ nữa màu ăn_tiền hơn cả mấy cây son trên 50 k của mình mình mua hàng của shop nhiều lần rồi son rất xịn nha mấy tình iu red_heart red_heart red_heart,2
chất son oke màu lên chuẩn giá rẻ,2
chất_lượng sản_phẩm ok giao hàng đầy_đủ với giá_như này thì nên mua nha mọi người vì mình lười chụp nên mình chọn đại ảnh nha,2
rất là ok đáng tiền mọi người nên mua y_như hình vậy đó 25 siêu đỉnh nha,2
chất_lượng sản_phẩm tuyệt_vời rất đáng tiền thời_gian giao hàng nhanh,2
sản_phẩm khá ok so với giá tiền,2
son lên màu chuẩn nha săn được giá rẻ đáng để mua nha đóng_gói sản_phẩm chắc_chắn,2
mình giao nhầm địa_chỉ nên không nhận được mà e mình bảo màu khá đẹp giá rẻ nữa,2
son mướt môi lắm nha mới đầu đánh lên_lớp đầu_tiên thì nó ko lên màu đẹp lắm nhg mà mn đánh thêm nhiều lớp nx thì màu lên rất chuẩn da nào cx hợp ạ nói_chung là mn nên mua nhá giá_thành rẻ hợp túi smiling_face_with_hearts,2
shop giao hàng nhanh săn sale được giá rẻ màu lên môi mịn mướt chứ không bị khô lắm,2
son môi đẹp rẻ lâu trôi mùi ko thơm mấy nhưng bỏ_qua đc giao hàng nhanh,2
giao hàng nhanh đóng gói hàng kỹ chất lươngj son ổn so với giá tiền sẽ ủng_hộ shop dài_dài,2
màu ko giống ảnh ảnh thực_tế màu tươi hơn màu nhận tối mà mẫu này giống mẫu rẻ tiên mua 1 sét 5 cái có mấy chục nghìn,2
son đẹp lắm màu siêu xinh đã vậy còn được giá sale rất ưng,2
giao hàng tương_đối nhanh đóng_gói cẩn_thận đáng tiền,2
cây son bé bé nhìn cute xĩu luôn ạ săn sale được giá tốt còn được tặng quà nữa ạ,2
rất đáng_giá tiền màu lên đẹp v,2
son thơm màu đẹp dễ tẩy_rửa phù_hợp với học_sinh ạ tiếc là mua 2 c 9 k mà mình k để_ý mua 1 c 89 k face_with_rolling_eyes person_facepalming,0
màu 907 ko thấy mng mua nhiều tui mua lúc sale 69 k nên hết mấy màu hot màu 907 cũng xinh lắm nhe klq,2
sản_phẩm dùng tốt red_heart red_heart săn dc giá rẻ quá ứng lun sẽ ủng_hộ shop tiếp ạ,2
son màu đẹp chất son hơi khó tán nhưng với giá này thì ok ah,2
combo9k ok son ổn màu lên đẹp ship nhanh,2
chất son ok màu lên đẹp giá rẻ nữa nên mua nha,2
son phải gọi là đỉnh của chóp luôn mọi ngưòi ơi vừa mềm mượt không bón cục màu còn đỉnh đỉnh đỉnh đỉnh vãi còn rẻ nữa son này ko hề kém_cạnh hãng khác đâu mng ạ,2
son nhỏ gọn lên màu đẹp đáng tiền mọi người nên mua nhé giao hàng khá nhanh,2
son ổn mùi dễ_chịu cũng k khô môi lắm đâu giá rẻ v là ổn lắm rồi,2
mua rất nhiểu lần rồi son đẹp đóng_gói cẩn_thận màu xinh săn sale nên được_giá rẻ lại còn được túi tote nữa cảm_ơn shop nhiều,2
giá_cả hợp_lí đóng_gói kĩ màu son đẹp bám môi lâu giao hàng nhanh,2
hàng auth nha mọi người sơn đánh mịn mà thơm nữa giả rẻ nên mua nha,2
giao hàng siêu siêu nhanh luôn ý ngay ngày hôm sau là nhận được rồi đóng_gói kĩ_càng màu 25 cỉa bia là quá nổi_tiếng rồi siêu dễ dùng chất son mịn vỏ cầm chắc tay săn sale 12 12 chỉ còn 12 k thui,2
theo ý_kiến riêng của mình thì son khá bột khô môi và kiểu khá dính á không nên bặm môi quá nhiều lần và đặc_biệt mùi son là điều mình rất khó_chịu nhma được cái son rất lì nha và mình mua chỉ có 62 k thì phải tóm_lại cũng khá ok đây chỉ là ý_kiến riêng của mình thôi nhé,2
quá là đẹp luôn lên màu siêu ưng_ý giá hạt_dẻ mà được lượng cao,2
bị lỗi nhỏ ở vỏ son mềm mịn và mượt ạ lên môi xinh thơm mùi giá rẻ nên mình sẽ mua thêm vài màu khác,2
chất_lượng không chê đc săn sale giá rẻ quá chòi còn đc tặng thêm 1 cây mini nhg giao hàng hơi lâu,2
son đẹp mà hơi nhỏ chất bột bột nói_chung là phù_hợp vs giá tiền hoi màu đậm hơn hình một xíu,2
mua shop này mình rất tin_tưởng luôn chất_lượng khỏi bàn giá_cả phải_chăng ưng quá chòi,2
đã xài đồ của focalure nhiều lần rồi nên chất_lượng và giá_thành thì khỏi phải bàn,2
son thơm lắm mn ạ mùi cam rõ luôn màu như hình chất lì mềm lên môi siêu xinh tuy độ bám dính chưa đc tốt nhưng giá hạt_dẻ nên k đòi_hỏi gì tóm_lại là mn nên mua nhé,2
mình dùng tới cây thứ 2 rồi dù giá rẻ nhưng màu xinh mùi thơm lắm,2
ổn săn sale có hơn 10 k tẹo màu xinh xứng danh quốc_dân mùi ngọt nhưng mình ko thích lắm nên tẩy da chết cho môi trước khi dùng,2
ưng lắm luôn ạ màu lên đẹp chất son khá mịn mùi thơm giá lại rẻ nữa shop quốc_tế nên giao hàng hơi lâu ạ nma k sao lần sau sẽ ủng_hộ tiếp ạ,2
hàng chất_lượng giá rẻ mùi socola rất thơm đags mua nha đóng_gói cản thận,2
son màu xinh lắm giá ngon rẻ_shop đóng_gói cẩn_thận giao hàng hơi lâu do ở xa hài_lòng về sản_phẩm,2
lên màu chuẩn hàng đẹp rất đáng tiền cho shop 5 sao smiling_face_with_hearts,2
màu ổn lì giá rẻ,2
son lên màu ổn lắm nhưng mà nhanh trôi nói_chung vs giá này thì k đòi_hỏi gì nhiều ạ,2
hàng săn sale nên chờ hơi lâu nhưng mà sản phầm dùng cũng ổn k,2
giá_cả chim_ưng mà son xịn lắm lun mùi vỏ hơi khó_chịu tưởng son hỏng không dùng được ai_ngờ đỉnh cmnl thơm vãi luôn lần sau ủng_hộ chục thôi về dùng dần,2
công_dụng màu ok độ bền_màu khá ổn mua sale nên rẻ dùng ok hình_ảnh mang tính_chất minh_họa lấy xu,2
son xinh lắm nha giao lâu nhưng không sao bù lại màu đẹp giá rẻ đặt_hàng ở shop này nhiều rồi ưng lắm,2
màu son rất đẹp k bám màu lắm nhưng mùi thơm rất ok rẻ ạ mn nên mua,2
mình thích son cam trước đó mình dùng màu này rồi h hết nên mua lại quá rẻ mà chất son mịn lắm nên mua nha mn ơi red_heart red_heart,2
màu nhanh trôi quá ăn có tí là trôi rồi mk thấy màu lên môi rất mịn kiểu nó giống black round í nhưng rẻ hơn black round nhiều,2
đồ tốt chất_lượng cao nên mua nhe nhe ship cũng nhanh đồ chất_lượng giá rẻ,2
son lên màu đẹp sáng da chất son mịn giá rẻ nhiều khuyến_mãi,2
sản_phẩm rẻ chưa dùng nên ko biết chất_lượng chỉ có bên giao hàng làm mình hú_vía tại cái bao bị rách nhưng may là vẫn đủ,2
màu son rất đẹp đáng tiền mua nhé,2
son đẹp giá rẽ màu 06 đẹp nha mn ưi ưa quá yỏiwi son lì màu tươi shamrock four_leaf_clover đẹp suất sắc nha mn rabbit_face shamrock,2
đóng gói sản_phẩm ok chất son mịn sài thích lắm nha son thơm màu đẹp tôn da đáng tiền 3,2
hum nay tui mới nhận hàng nè mọi người đóng_gói chắc_chắn nha không ngờ với giá đó mà nhận được sản_phẩm chất_lượng hơn cả mong_đợi luôn á bao_bì thiết_kế đẹp xỉu smiling_face_with_hearts,2
vừa nhận được hàng son xinh hàng nước_ngoài nên lau hơn xíu dang mong_chờ son rẻ ổn ns chung,2
trời ơi màu xinh xĩu á trời ưng lắm luôn giá lại mềm nên mua nha mấy bi kissing_cat,2
giao hàng nhanh bao_bì xinh màu son lên màu khá chuẩn ưng cái bụng nhất trong mấy sp của hãng lun recomend nhìu nhìu rất ngon bổ rẻ sẽ quay lại hốt mấy màu khác,2
dùng nhiều loại nhưng chỉ ưng đc mỗi loại này mua đi mua lại nhiều lần giá rẻ mà dùng thích,2
đặt 2 màu 402 và 404 nhận hàng thấy ưng lắm luôn son có mùi đào nhẹ rất thơm nha 2 màu cux gần same mình thấy hợp với mọi loại da đó rẻ và đẹp mn nên mua nha,2
thiết_kế đẹp giá hạt_dẻ v cũng khá ưng mà lên màu k đc xinh lắm nhìn hồng_hồng sao á face_with_tears_of_joy giao hàng lâu ghia,2
xinh lắm ạ hàng quốc_tế nên giao hơi lâu một_chút mua đúng đợt sale nên rẻ nói_chung là nên mua ạ,2
chất son mịn màu ổn với giá chưa đến 20 k cho 1 cây son như này thì cũng là 1 trải_nghiệm cũng khá ok smiling_face_with_smiling_eyes,2
công_dụng phù_hợp cho da ngâm kết_cấu mềm mịn độ bền_màu bám môi 70 80 giá_cả phù_hợp hsv giao hàng nhanh đặt sale 15 1 là 16 1 đã giao,2
son đẹp chất lì lâu trôi rất xịn rất đáng tiền,2
son xinh ạ mùi socola thơm mỗi_tội là các bạn môi thâm thì ko nên mua màu này nha v tại nó ko lên đúng màu soát ra_tay nói_chung rẻ và xịn,2
mình thấy son lên màu ko giống ảnh lắm màu hơi sáng hơn ảnh 1 tone nhưng cũng ok mua dc giá sale,2
màu xinh xỉu giao hàng nhiệt_tình nói_chung là rất đáng tiền sẽ tiếp_tục ủng_hộ,2
chất_lượng sản_phẩm tuyệt_vời phù_hợp với giá tiền đóng_gói cẩn_thận,2
son mịn màu lên chuẩn mua không uổng tiền rất đáng để được 5 sao,2
đóng gói cẩn_thận sản_phẩm tốt dùng kh bị kích_ứng phù_hợp với giá tiền,2
nhận hàng khá nhanh shop gói hàng cũng cẩn_thận nữa son đánh lên mềm mịn dễ tán cực luôn k có mùi nha đánh lên mịn lì nhưng k hề khô mà giá quá rẻ luôn ý mỗi tội là son khi test lên tay sẽ đẹp hơn khi lên môi mình và màu trên hình cũng đẹp hơn so vs ngoài nữa dù_sao cũng cực ưng nha,2
kết_cấu chất nhung mịn độ bền_màu hơi làm khô môi thoa tầm 2 tiếng là môi khá khô r rẻ đẹp gần tết nên ship lâu 301 mình mua lần 2 r vẫn đẹp 302 màu hơi sến hồng cánh sen ngả tím khá sáng đáng nhẽ mình phải xem review của lio trc khi đặt nh 0 sao chắc mix với son đậm hơn là đc,2
độ bền_màu k lì lắm thơm mùi socola lắm luôn muốn ăn luôn quá vỏ rất chắc_chắn mãi ms mở đc giá rẻ,2
công_dụng son lên màu đẹp kết_cấu đặc son đẹp cả về hình_thức lẫn_màu son giá_cả phải_chăng mà được như vậy là quá ổn_áp mn nên mua nhé hàng quốc_tế giao hơi lâu thôi,2
