processed_data,target
son đẹp lắm nha mn tuy là son nội_địa giá rẻ nhưng chất son mịn dễ tán ko bị bón cục mùi son thơm nhẹ nhẹ ko quá nồng,2
son đẹp lắm ạ đóng_gói chưa tốt lắm nm với số tiền này là ok OK_hand,2
son rẻ nên đánh chơi thôi mà cũng đẹpgfgfg,2
mình kh ngờ với 20 k có_thể oder được chiếc son sịn sò như vậy màu khá ưng chất son mịn và lì sẽ tiếp_tục ủng_hộ shop lâu_dài broken_heart,2
son khá bột và sẽ có độ xê_dịch nhiều khi bặm môi nhất là với những màu nude thế này mình mua màu này để làm màu base thôi với giá này thì mình cũng k kì_vọng chất son cho lắm ngoài chuyện bị giam hàng ở hải_quan từ 12 12 tới nay thì cái gì cũng ok may_mà shop gói hàng chắc_chắn,2
son xinh rẻ màu yêu lắm xa nên giao hơi lâu recomend mọi ng nên mua,2
màu hơi nhạt so với mình tưởng và cũng và trôi hơi nhanh nhưng đang hết tiền mua cây này là chính_đáng á mng ơi kakak two_hearts video và hình_ảnh mang t c lấy xu thoi ạ,2
công_dụng son kết_cấu xốp độ bền_màu kém son màu khá đẹp thích_hợp làm base hoặc sử_dụng bình_thường phù_hợp với da trắng son thơm mùi socola ngọt nhẹ chất son khá bột k bám môi nên dễ trôi và bị lợn_cợn nhưng do giá rẻ nên không đòi_hỏi gì nhiều,2
giao hàng hơi lâu nhưng đồ đẹp mà_còn giá hạt_dẻ nên oki rùi sẽ ủng_hộ tiếp,2
son lipstick nhỏ nhỏ xinh_xinh đánh lên màu đẹp hợp với da giá rẻ mua 2 cây chỉ có 75 k đáng để mua nha mọi người giao hàng thì 10 ngày mình mới nhận được,2
công_dụng cho môi xinh_xẻo lên nữa kết_cấu k biết tả độ bền_màu màu đẹp mà chạm đâu dính đó son thơm vl luôn tưởng đâu trét lên môi màu đẹp vl biết z sắm 2 thỏi này gòi mà bay_màu lẹ lắm cũng k đòi_hỏi vì đúng giá thôi,2
màu đẹp giá_thành phù_hợp với hsv chất son_ổn phù_hợp với mọi tone da,2
son rẻ lên mua giao hàng khá nhanh sau lại quay lại ủng_hộ shop ạ,2
màu đẹp với lại thơm mùi kiểu mùi kẹo nữa đáng tiền mua lắm a smiling_face_with_heart eyes,2
vid mang tính_chất nhận xu son màu đẹp swatch lên như ảnh thơm giá rẻ chưa dùng lên môi nên chưa biết,2
màu son rất đẹp ngon bổ rẻ phù_hợp với túi_tiền học_sinh sinh_viên giá rẻ nên son cũng nhỏ thôi nhưng ko sao đáng để trải_nghiệm,2
chất son ko như mong_đợi màu cũng ko xinh nữa mùi cứ bị kiểu dổm dổm sao đó mình mua sale nên có mấy nghìn th nên coi như hên_xui v,2
mua của shope mal nên khá an_tâm giá siêu rẻ mà son siêu lì nha bao ăn bao uống luôn mình xài nay không biết cây thứ mấy rồi nhưng vẫn rất hài_lòng,2
son giao nhanh lắm ạ giá rẻ tốt cho shop 5 sao ạ lần sau sẽ ung hộ nữa ạ,2
đồ xinh lắm luôn giao hàng cũng nhanh nữa phù_hợp với giá tiền lúc trước mua hai ba lần giá cao hơn nhưng chất_lượng cũng chỉ thế này sẽ ủng_hộ shop nhiều lần nưão,2
son xinh tương_xứng giá tiền mềm mịn lắm nha có mùi socola mình thấy k hắc đâu,2
em này lì nhưng khá là bột nha khi tô lên tay có_vẻ là em khá dễ dùng nhưng lên môi thì có_thể thấy em này sẽ bị nhả ra một_chút vì có silicon không bay_hơi tô lòng môi không đc tô ful môi thì màu này sẽ bị già quá nếu kh makeup nói_chung với giá này thì kh đòi_hỏi gì hơn,2
màu đẹp vì dịch nên shop giao hàng hơi lâu vừa giá tiền,2
son lên môi rất mịn mịn như nhung ấy thơm nx mà màu xinh dễ dùng lại rẻ còn chính hãng nx nên yên_tâm_giao hàng cx nhanh đóng gọi cẩn_thận chỉnh chu,2
son kem mịn siêu xịn xò luon nka 3 màu đẹp rất đáng tiền anh shiper đz wa chời,2
son đẹp màu xinh son lên mềm môi nhưg dễ trôi thơm giá nv à ốn ạ,2
son đẹp vỏ ngoài đáng yêu lì mịn đáng đồng_tiền bát gạo nhưng k thơm,2
giao hàng khá nhanh son rẻ đẹp shiper khác đã mua đc vài lần cơ_mà lần này có_vẻ đóng_gói hong đc kĩ lắm son chỉ đc 1 lớp bọc chống shock và 2 đầu kh bọc lại nghiên 1 cái là son rớt ra liền cơ_mà son kh bị trầy hay gì hết nên vẫn đánh_giá 5 sao sẽ ủng_hộ thêm nhiều lần nữa ạ heart_suit,2
đẹp chất_lượng rẻ ạ vì hàng nước_ngoài nên giao hơi lâu,2
rẻ đẹp,2
son khó tán màu xinh hơi mùi nhựa á nhưng hợp giá tiền nên ok giao hơi lâu,2
công_dụng lên màu đẹp kết_cấu tốt chất son mượt độ bền_màu lâu trôi giá rẻ hàng tốt sài rất thích,2
son ở đây xinh lắm giá hạt rẻ giao hàng nhanh video mang tính_chất nhận xu nè hihi,2
màu sơn đẹp lắm nha cũng không lì và giữ màu lâu ăn sẽ trôi nhưng được_cái kg bị khô môi đâu mua 2 cây 9 k quá rẻ luôn nước_ngoài nên ship về hơi lâu,2
son xinh màu son lên cũng oke phù_hợp giá tiền giao hàng hơi lâu vì là hàng qte,2
đánh mịn lên đúng màu mùi siu thơm giá lại rẻ siu ưng luôn,2
son rẻ đẹp hợp giá tiền hình_ảnh trên chỉ mang tính chấty nhận xu,2
sản_phẩm đóng_gói chắc_chắn săn sale nên được giá rẻ smiling_face_with_open_hands rainbow,2
mua nhiều lần lắm lun í tại vì thích cái cách bọc hàng của shop chắc_chắn mà đẹp lắm lun tại mua nhiều nên mình k check vì mình biết auth rùi nchung 10 đỉm lun nha mua đi mua lại mãi vẫn chọn chỗ này thui giá_cả cũng rẻ nữa nên mua nha mọi ngừi,2
son đẹp cực màu_sắc đúng đỉnh mùi thơm rất đáng tiền đóng_gói cẩn_thận shiper nhiệt_tình nhất_định sẽ ủng_hộ shop tiếp trong tương_lai,2
màu k giống ảnh đâu tươi lắm tuy_nhiên gias này nên k đòi_hỏi shrghdhj cbmhm mbmb,2
mình mua trúng đợt sale nên giá khá rẻ đc_shop tặng 1 cây son eglips màu 04 gần giống với 2 tone màu mình mua son cảm_ơn shop rất nhiều,2
son đẹp hơi khô tí nhưng mà với giá như vạy thì xứng_đáng rồi growing_heart giao hàng hơi lâu chắc do vận_chuyển nên hộp son hơi bị méo ảnh vid mang tính_chất lấy xu,2
công_dụng son môi kết_cấu kem lì độ bền_màu tốt lên màu chuẩn lắm mng ơi không bị sỉn men răng hay kén da đâu da ngăm hay da_trắng đều dùng được đáng đồng_tiền ghê lun mình được tặng thêm gương lì_xì cute lắm mng nên thoa một lớp son_dưỡng trước khi dùng nhe nên mua nha mng,2
chất lg sp tuyệt_vời giao hàng khá lâu phục_vụ tốt đáng tiền,2
son lên màu rất đẹp chất cx đẹp mùi k thơm lắm nhưng vs số tiền đó thì rất được luôn,2
son rẻ mà đánh lên như màu môi tự_nhiên vậy rất hợp vs những ai thích màu môi đẹp tự_nhiên những ng k thích quá đậm,2
độ bền_màu nice công_dụng nice kết_cấu nice son thơm màu đẹp xỉu giá rẻ cực thích mấy mẫu son nội_địa trung,2
chất son mịn màu son lên đều săn đc sale nên giá rất mềm được tặng thêm 1 cây con nhỏ,2
son khi thử lên trên t rất mướt nhưng khi dùng trên môi thì không đi nhưng tiền nào của đấy thôi,2
son xinh từ vỏ đến màu son á ncl giá rẻ nhma ưng giao hàng nhanh,2
màu 402 với màu 502 mình thấy khá giống nhau cam gạch 402 đậm hơn màu đẹp son hơi dễ trôi nhưng với giá này không yêu_cầu gì nữa,2
xinh lắm nha nên mua nha mn quá rẻ lun son mùi cũng thơm mùi hơi giống mùi dâu_tây ý,2
công_dụng son bôi lên môi khá đẹp có mùi dễ_chịu chất son êm lắm nha dễ tán kết_cấu ổn độ bền_màu chưa đánh_giá được giá cũng rẻ chất_lượng ổn khâu chuẩn_bị hàng của shop khá lâu phải nhắn_tin shop mới đi hàng cho khách mong_shop có_thể cải_thiện,2
sản_phẩm rất tốt so với giá tiền lên màu đẹp lắm nha thumbs_up,2
săn sale 24 k cho 1 thỏi son quá ưng_ý chất son mịn đánh lên môi chuẩn màu,2
trời ơi săn được sale quá_ư rẻ luôn ý mà shop gói rất cẩn_thận trông thỏi son sang xịn mịn luôn mình mua tặng bạn nên chưa thử được chất son,2
son thơm màu xinh vỏ cũng sang xịn mịn giá cũng rẻ hahahaha,2
son đẹp lắm luôn ý còn giao hàng nhanh nữa đáng tiền mua lắm nha kissing_face_with_closed_eyes,2
cây son đẹp chất son ok giá quá rẻ sẽ ủng_hộ thêm màu lên môi chuẩn,2
son đẹp đáng tiền mua lần sau sẽ ủng_hộ hình_ảnh mang tc nhận xu,2
god nên mua ạ đáng tiền màu siu xinh ạ,2
màu ở ngoài đậm hơn trong video nha mn chất son khá ok mùi son ko quá nồng chấp_nhận đc giá_thành ổn_áp đối vs sv hs mua nha mua nha,2
son đẹp sang xịn mịn giao hàng cũng nhanh đóng_gói cẩn_thận hơn rồi đáng tiền chất_lượng sản_phẩm tuyệt_vời,2
son đẹp xĩu màu lên môi chuẩn giao hàng hơi lâu giá_cả phù_hợp mấy bạn học_sinh nói_chung là sẽ ủng_hộ shop growing_heart,2
vì nó rẻ nên k_thể đòi_hỏi đc nhưng nà mùi nó hắc á dùng nhiều bị thâm môi mn cân_nhắc trc k mua nha,2
son xịn với đẹp thật_sự săn sale nên giá hời lắm hình_ảnh mang tính_chất săn xu,2
mình thấy son ổn mịn nhưng nó ko có gữi màu tốt lắm kiểu thử tay chùi phát là màu đi rất nhiều so với giá và chất_lượng thì ok mùa đẹp,2
công_dụng đẹp nha gói hàng cẩn_thận kết_cấu ok độ bền_màu ok nên mua nha mn vừa rẻ vừa đẹp ok lắm,2
chất son bột bột không thíhc lắm nma giá rẻ nên cx k đòi_hỏi nhiều màu ôk,2
màu đẹp son đánh lên xinh cực rất vừa với giá tiền giao hàng còn nhanh nữa,2
công_dụng dep kết_cấu dep độ bền_màu 10 chất_lượng sản_phẩm tuyệt_vời đóng_gói sản_phẩm đẹp và chắc_chắn rất đáng tiền,2
sản_phẩm chất_lượng giá_thành rẻ son màu đẹp nhưng mau trôi kẻ mắt xinh nên thử kcm hơi nhạt màu,2
son đẹp mua sale 9 9 nên được tặng thêm thỏi eglips dù ship hơi lâu,2
chất_lượng sản_phẩm tuyệt_vời có mùi thơm như kẹo giá_thành rẻ,2
son xinh hơi khó tán nhưng với giá này là quá ổn rồi mọi người nên mua,2
son màu đẹp vỏ cute_shop giao hàng nhanh giá rẻ xài rất ok luôn,2
son mỏng nhẹ rất đẹp nhưng trôi nhanh ko lì như thông_tin sp để giao hàng rất mua sale giá hời nên ko sao,2
đã nhận hàng nhanh son đánh lỳ mua đúng màu iu thích giá rẻ nữa ne smiling_face_with_hearts,2
son đậm đẹp tươi sịn rẻ nữa nên mua nha,2
săn sale giá iu mua tặng nên chưa biết ra_sao mong sẽ ổn_áp vì phấn mắt khá okla,2
màu son khác_hình sơn rất bột tô lên môi bị lộ vân môi giao hàng siêu chậm được mỗi cái là mình mua đc với giá sale với giá này thì ko đòi_hỏi nhiều,2
với giá hơn 4 chục thì chất son đúng mịn như nhung mùi thơm lòng cảm_ơn shop màu 202 203 có_vẻ hợp_lý nên mình chọn thumbs_up,2
độ bền_màu được tầm 5 6 h ý hàng giao hơi lâu vì do dịch chất cũng khá oki với giá này được son như z là ok r,2
son ok sài ổn màu lên đẹp son mướt mềm nhưng ko lì lắm rẻ nên ko đòi_hỏi j,2
hình_ảnh mang tính_chất nhận xu son xinh lẳn giá rẻ hợp_lý nm ship lâu quá nói_chung là nên mua nha,2
xinh lắm luôn nên mua nhé mn mua 2 cây 9 k quá là bèo mùi thơm thơm kiểu mùi kẹo rất dễ đánh và tán giao hàng cx khá nhanh ncl mn nên mua hsvd d đặn dksjeirv sa quào dje vs ánh đặn a kw nfs lười d âm bđ,2
son ổn màu y hình ưng hết_ý giá rẻ nói_chung là cực ưng luôn ýy ảnh và video không liên_quan chủ_yếu là lấy xu nhưng mà mọi người nên mua son nheé sẽ ủng_hộ shop nhiều hơn,2
son lên màu đẹp lắm ạ mịn môi nhưng nhanh trôi phù_hợp với giá,2
son lên màu khá ok nma hơi ít son xíu th với giá này thì quá đẹp luôn,2
sản_phẩm rất đẹp lên màu chuẩn son có mùi thơm vỏ đựng cũng chất_lượng nhưng giá thì rất phải_chăng,2
giao hàng lâu nhưng màu khá ưng son không lỳ lắm so với giá_thành thế là ok nên cân_nhắc trước khi mua,2
màu rất đẹp giống trong hình chất son thì hơi bột nhưng với giá này là ok lắm rồi,2
test lên tay là màu cam nhưng lên môi lại là màu khác chất son hơi bột nói_chung tiền như_vậy cũng là ổn r,2
son rẻ quá mua về ko dám đập lên mồm nhưng thử tí trên môi thì thấy chất son cũng ok ko biết để lâu sẽ như nào màu 402 đẹp nhưng 505 ko đúng màu ý đừng mua nha mng son có in thành_phần trên bao_bì khá rõ_ràng với đẹp hehe,2
son lên màu hơi đậm so vs mình tưởng_tượng chất son lỳ đặc_trưng của bia và cái mùi đặc_trưng dù mình ko thích lắm giá_cả đáng tiền,2
mua 2 màu tựa nhau nma đẹp nha 403 đỏ nhìu hơn 401 mua sale 8 k 2 cây quá hời d,2
săn sale nên giá khá ổn nhưng bôi hơi bị khô môi k đc mịn lắm,2
sản_phẩm_giá rẻ cực_kì chất_lượng lại ok ưng lắm luôn,2
nhận được đầy_đủ hàng mua combo được giảm_giá chưa đánh thử nhưng thấy mẫu_mã khá đẹp mùi son hơi nồng chút nhưng giá vậy quá là ok,2
son rất rất xinh luôn nha smiling_face_with_hearts nắp nhung sờ sướng_tay dã_man smiling_cat_with_heart eyes chất son xịn đẹp hơn mình tưởng giá okela sẽ ủng_hộ dài_dài anh shiper đẹp_trai kissing_cat,2
vỏ nhìn sang chảnh màu nhìn ngoài khác trong hình nhưng chung_quy giá_thành rẻ so với cây son quá chất_lượng vậy smiling_face_with_hearts đây là cây thứ 5 merzy mình có,2
mua 2 lần rồi ưng giá rẻ chất son ổn nhưng nhanh trôi màu tươi hơn trong ảnh của shop,2
với giá_thành này thì không mong_đợi gì nhiều sản_phẩm dùng rất tốt so với giá,2
màu đẹp mua shop mal săn sale có 130 k cả ship ko còn gì để chê mọi ng nên mua nha mua nha,2
sản_phẩm rất đẹp như hình giao hàng rất phẩm rất vừa tiền với túi tiền của học_sinh,2
son màu đẹp vì giá rẻ nên cũng không kì_vọng nhìu mng cũng nên xài thử face_with_tears_of_joy,2
giao đủ hàng còn dc tặng thêm quà chờ hơi lâu nhưng rất vui với giá rẻ bao_bì đẹp thì cũng khá thích,2
k tiện chụp hình sản căn được sale giá rẻ giao hàng shop 5 sao,2
gói hàng bình thg giá ổn_áp màu lên đẹp lắm nên mua nhé quá_ư là ổn_áp so với giá này r chắc_chắn sẽ quay lại và thâu đủ các em về vì màu nào cũng đỉnh chóp,2
son với kính xinh lám mọi người ạ màu đỏ nâu ấy siu xinh rẻ mà xinh hjc vid với ảnh hong liên_quan smiling_face_with_tear,2
mình ưng dã_man màu đẹp lâu trôi mùi thơm kiểu mình thích săn sale nữa nên là qua tuyệt,2
son đẹp lắm ạ giao hàng nhanh rất đáng tiền mn nên mua nha,2
nhận được hàng là test ngay trời_ơi quá là sang xịn mịn lại còn sale 2 cây 9 k quá_ư là rẻ luôn mình có rất nhiều cây son nhưng 2 cây focalure này bây_giờ chiếm top 1 lòng mình luôn rất recomend mn nha màu mình mua là 302 và 501,2
son lên màu đẹp chất siêu lì cầm chắc tay thiết_kế chắc_chắn mẫu_mã cute mùi 1 _ như mùi xà_bông nhưng bay nhanh nhưng với cái giá hạt rẻ kia thì nên mua nếu bỏ_qua được mùi son,2
công_dụng tô son_độ bền_màu 6 10 sản_phẩm đẹp giá rẻ,2
chất_lượng sp tốt giữ hương_lâu rất oki_hợp vs giá tiền hs nha,2
son đẹp lắm nha mọi người mua ủng_hộ shop đi ạ rẻ bèo đặc_biệt là lâu trôi nữa red_heart,2
mk thấy sp quá_ư oke lun với giá_như này mà được mí sp ổn_áp ghia,2
son màu đẹp thơm với giá 37 cành thì như vậy là đc rồi không đòi_hỏi thêm gì nữa,2
son đẹp mịn môi lắm luôn ạ giá lại rẻ nữa nói_chung là quá ok,2
giao hàng nhanh đóng_gói cẩn_thận chưa mở nên chưa biết nhưng với giá này cũng khá ổn rồi,2
son lên màu đẹp mà_còn rẻ nên mua nha mọi người,2
son siêu siêu đẹp màu son lên màu đều mịn có mùn thơm giá lại rẻ hình_ảnh chỉ mang tính_chất nhận xu,2
chim_ưng nhé mình mua 3 lần rồi vừa rẻ lên màu lại rất mướt và đẹp mọi người nên mua smiling_face_with_hearts,2
hàng đẹp lắm ạ chất_lượng tuyệt_vời rất đáng tiền nên mua nha,2
son xinh lên màu chuẩn mướt minh hơn với kì_vọng so với giá tiền này,2
độ bền_màu son dễ trôi đóng_gói sp 10 đ giao hàng 20 ngày mới nhận dc vif cấm biên nên bỏ_qua chất son không mềm mịn và đánh lên môi có bột lamf khô môi màu trên hình và ở ngoài khác nhau hàng sale nên chấp_nhận,2
kết_cấu o sản_phẩm có mùi thơm nhẹ khá là mịn lên màu đẹp giá rẻ chất_lượng phù_hợp,2
son thơm và đẹp lại rẻ mua đi chờ gì nữa kakaka,2
mua hàng mal nên khá yên_tâm nhưng vừa mua về thì chỗ bán mĩ_phẩm gần nhà còn sale rẻ hơn smiling_face_with_tear,0
đóng gói sản_phẩm khá tốt chất son thì đúng tiền nào của đấy chất khá bột không ăn vào môi cứ bón cục tầm giá này thì cũng tạm được,2
công_dụng son cũng ok với giá tiền kết_cấu shop gói cẩn_thận đẹp độ bền_màu ok,2
son bóng lọ nhỏ giao hàng hơi lâu nhưng giá_như này là ok rồi,2
hàng đẹp nha thử lên môi mình cũng rất ổn thích màu này lắm giá quá mát luôn shop trả_lời cũng rất tận_tình nữa,2
shop làm_ăn kì_cục ghê á son j mà rẻ mà đẹp ri rồi_sao ai mà chịu nổi nhưng có cái trôi hơi nhanh nha mà màu son đỉnh lắm lun,2
không tin nổi em này 9 cành luôn ấy thứ nhất là đóng_gói rất ổn thứ hai là em này đánh lên màu xinh muốn xĩu chất son mịn mượt mà thơm nữa nên mua nhá mọi người ơi,2
đẹp nên mua giúp bạn lần 2 săn sale đc giá rẻ nên rất ok,2
chất son đẹp mướt không ngờ son rẻ mà đẹp vậy luôn màu son ở ngoài đẹp hơn trong ảnh,2
sản_phẩm chất_lượng so với giá_thành giao nhanh combo hời nữa,2
màu son lên được thôi chứ cũng không xịn lắm tiền nào của nấy thôi,2
xịn lắm đáng đồng_tiền ship nhanh màu lên đẹp mịn 3,2
son thơm màu cũng đẹp chất tươi tươi nhưng mà k hợp da mình crying_face vs bôi lên để chừng 2 tiếng là môi khô lắm chứ k có ẩm đâu được cái giao rất nhanh hâha săn sale 12 12 mà 15 12 có hàng rồi,2
son mùi hơi nồng và hắc lên màu không chuẩn lắm base hồng hơi sến nhưng nói_chung với tầm giá này thì ok,2
son đẹp shop gói hàng cẩn_thận giá_cả quá ok chất_lượng sản_phẩm tốt,2
ngon bổ rẻ giao hàng cũng nhanh lại còn có voucher giảm giá cho lần sau,2
màu đẹp chất son mịn nhưng nhanh trôi với giá_thành như này là hợp_lý,2
giao hàng nhanh son 25 giao đúng đủ nữa nch giá ổn nên mua nhé mn,2
màu kh đẹp kh bền chả ưng tí nào nhưng với giá này thì k đòi_hỏi thêm,2
màu đẹp son xinh chưa thử nhưng mức giá ổn chất son nếu ok thì sẽ mua lại,2
chuẩn_bị hàng nhanh nhưng gia hàng lâu quá nhưng sp thì quá_sức tưởng_tượng quá rẻ quá xịn mẫu_mã đẹp,2
màu 302 hơi ngả đỏ nhiều hơn so với hình ạ son khó tán nhưng mà với giá này rất ổn rồi ạ,2
chất son khá tôn da ship hàng nhanh rất đáng đồng_tiền,2
hàng quốc_tế nên giao hơi chậm chút_xíu đúng mẫu rẻ nhưng mà đẹp,2
mua khá nhiều son bên shop rồi màu ổn chất_lượng ok giá lại rẻ so với mặt_bằng chung,2
trời ơi son mịn vãi lì săn sale nên có 10 k thoi đó các bác chờ son về lâu quá tới lúc son về rồi hồi_hộp mở ra nên quên chụp cái giá màu đẹp lắm nên mua 2 3 luôn nha mình sợ mua dùng son dỏm nên mua 1 cây thử sài chơi thui ai_dè đẹp thật_sự luôn á ảnh đó là mình chụp đúng màu son ở ngoài luôn á,2
đúng là ham son rẻ chất son miệng nhưng mà bị bết nó cứ dính một cục không bao_giờ được mọi người nên rút kinh_nghiệm đừng nên mua son rẻ tiền,2
màu son rất đẹp lì thơm sản_phẩm như hình đúng màu đóng_gói đẹp hợp túi tiền,2
son đẹp lắn lun á mua lần 2 ưng cực_kì chất mịn bôi lên_hơi nặng nhưng ok giá 34 k thì ko đòi_hỏi nhìu màu đỏ đất này có_vẻ đỏ hơi nhìu nhưng ok nên mua nha mn face_blowing_a_kiss,2
màu son đánh lên môi khá ưng mùi nhẹ_nhàng mua flash sale nên rất cám_ơn shop,2
tuyệt dzoi mn nên mua nhá săn sale vừa rẻ giá_cả lại hợp_lí nữa nà,2
mua cây son đáng đồng_tiền bát gạo star struck bản này đẹp xịn với lên màu chuẩn hơn bản cũ nhiều,2
đánh hơi khô môi nhma màu trend lắm nhó giá rẻ nên ko yêu_cầu nhiều grinning_squinting_face,2
hàng quốc_tế nên phải chờ hơi lâu mình có test son thì lên màu không chuẩn lắm nhưng với giá tiền như này thì ok,2
màu son rất đẹp nha thơm nữa rẻ nữa mềm môi nhưg k lì đâu nha ai thích son lì thì k nên mua giao hàng lâu ạ,2
son thì đẹp khỏi chê rồi mà giá siêu ưng mình mua son của shop là lần thứ 2 rồi rất đẹp,2
shop đóng_gói cẩn_thận giao đúng màu chuẩn_bị hàng hơi lâu may vẫn kịp về trước tết son rẻ mà xịn thực_sự face_with_rolling_eyes lên màu xinh lắm shop 10 điểm son 10 điểm red_heart,2
son siêu rẻ và chất_lượng cũng xịn màu đánh lên khá giống hình quảng_cáo son thơm ship nhanh nói_chung là ưng ạ,2
màu đẹp nhất trong 6 màu đáng tiền đóng_gói ổn dùng hai lần rồi vẫn mê màu này,2
kết_cấu son lì màu đẹp độ bền_màu dễ trôi nhưng với giá tiền này thì ko đòi_hỏi gì nữa,2
son thơm lắm luôn dùng hết sẽ mua tiếp mặc_dù săn sale nhưng shop đóng_gói vẫn kĩ nha,2
son đẹp màu ưng giá rẻ chất lụonwng thì giống với giá tiền weary_face,2
màu đẹp hộp đẹp giá rẻ nhưng mà nhanh trôi không lì chất son mướt thôi với giá_như này thì cũng ok,2
son đẹp lắm mn ơi có mấy chục là lên môi mịn mướt màu đẹp xỉu ý mua nhanh đi,2
son đẹp giá rẻ giao hàng khá nhanh tận_dụng đánh má_hồng lun,2
chất_lượng tuyệt_vời xịn lắm luôn quét mã ok luôn nha giá lại quá rẻ nên mua,2
bao ngày mong_ngóng chân ái đã về với mình hihi red_heart red_heart kiss_mark smiling_face_with_heart eyes face_blowing_a_kiss woman_dancing chất son siêu xịn y_như son hàn musical_notes revolving_hearts beating_heart hàng mal mua 1 tặng 1 siêu chất_lượng đẹp sang từ package đến vỏ son grinning_squinting_face star struck face_blowing_a_kiss smiling_face_with_hearts focalure không phụ lòng chị_em khó_tính nhé smiling_face_with_open_hands chúc shop mua may bán_đắt,2
vòng_cổ xinh son lên màu đẹp nhưng có mùi hơi khó_chịu tí ạ giá shop bán rẻ hợp_lí nhưng shiper như c lần nào cũng lấy lên 2 k so với số tiền cần trả cho đơn hàng từ_chối hiểu luôn mn nên mua ủng_hộ shop nha,2
sale 1 1 đến 18 thì nhận đc với qte và dịch n là nhanh r nha đc_shop tặng 1 mặt_nạ son thì có mùi kiểu cafe hơi trôi và màu nhẹ k đc đậm như hình nhưng với giá đó và hàng của mal thì cx yên_tâm,2
đóng gói hàng cẩn_thận giá_thành phù_hợp cảm_ơn dhop nha,2
giao hàng nhanh lắm nha mn mặc_dù đang dịch hàng giống hình chất_lượng phù_hợp với giá tiền,2
giao hàng khá nhanh gói hàng kĩ màu 402 với 501 mình mua tuy hơi khác so với ảnh nhưng vẫn dễ đánh son nhanh trôi nhưng với giá sale thì vậy là ok r,2
son ko lì lau phát hết phải 70 son trên môi lau thêm 1 2 lần nữa là ko còn tý gì nhưng ncl với giá_thành như_vậy là oke rồi chính hãng hay ko thì ko biết nhưng mua shop mal cũng yên_tâm hơn xíu thôi mua đi mọi ng suy_nghĩ gì nhiều mệt người khuyên đừng nên yêu_đương nha mệt người expressionless_face,2
