processed_data,target
thấy giảm_giá nên mình mua thôi chứ mình cũn rất ít khi dùng nhưng mà nhìn xịn xò lắm nha mọi người,2
ko rõ màu lắm nhưng ok rùi tiền nào của nấy,2
rẻ đẹp mà có vài cái kính lúc vận_chuyển nó bị lệch đeo lên khó_chịu vl cái cài tóc gấu cũng bị lệch mất trom nhưng vẫn cho shop 5 sao crying_cat,2
son màu đo_đỏ sản_phẩm chất_lượng và giá_cả sản_phẩm cũng vô_cùng hợp_lý,2
son gì mà đẹp xĩu săn sale nên mua giá siêu rẻ giao nhanh lắm nè,2
hàng giao nhanh đóng_gói cản thận màu son cam lên màu khá chuẩn và tự_nhiên giá rất sinh_viên sẽ tiếp_tục ủng_hộ shop,2
mua toàn son romand luôn ưng chất son và màu son quá_trời smiling_face_with_hearts lại còn rẻ nữa,2
chưa dùng thử son nên ko biết chất_lượng ntn nhưng son này giá 250 k thì đắt nha nhg mua 1 tặng 1 màu này thì cũng dx,0
công_dụng bt kết_cấu bt độ bền_màu bt tạm ổn ok hơi lâu khô 1 tí chất_lượng ổn giá rẻ nên không đòi_hỏi gì thêm,2
son chất velvet tint thơm mềm môi và mướt có điều ko tán nhanh sẽ bị đọng thành vệt nma giá_cả so với chất_lượng là quá ok smiling_face_with_hearts do cam mình chụp hơi sáng son ở ngoài trầm hơn 1 tông,2
hàng tầm 7 ngày về đến nơi shiper thân_thiện son mùi thơm nhẹ chất son khá mềm hơi bột lên màu hơi nhạt không lì lắm nói_chung là với giá tiền này mình không mong_mỏi gì hơn các bạn hsinh có_thể tham_khảo,2
màu lên ổn đẹp chất son mịn nhưng hơi nặng môi á chán 1 cái là son k lì mình đánh lên môi xong lấy bông tẩy_trang khô lau nhẹ cái là bay luôn loudly_crying_face mà thôi 2 cây 9 k giá v thì quá ổn r_shop đóng_gói chán làm méo cả hộp son,2
son đẹp rẻ màu xinh xỉu luôn mùi thì k thơm nhưng mê lắm trùi ui,2
giao hàng nhanh màu lên chuẩn cầm rất chắc_tay rất đáng tiền chất_lượng so với giá_cả quá tuyệt_vời,2
son rẻ mà chất son mềm mượt đánh cũng tạm ổn so với giá tiền nhgnj,2
rẻ mà fai công_nhận dùng ưng kp m ham rẻ đâu vì dùng lên môi nhưng mất_công đợi hơi lâu mà m k ngĩ son này dùng thích đến thế khô luôn mềm môi thơm dịu quay lại mua l2 của shop r tại ưng_ý lắm nên mua mn ạ đánh lên xinh vaiz,2
giao hàng nhanh đóng_gói kĩ giá ổn,2
son đẹp phù_hợp giá tiền,2
son màu khá xinh không lì lắm nma so vs giá thì điểm 10 cho chất_lượng ảnh chỉ mang tính lấy xu,2
giao hàng khá lâu nhưng son lên màu trên tay khá chuẩn màu son đẹp lắm vỏ son cũng cực_kì cực_kì câmd đã tay mua đc giá rẻ hihi sẽ mua lại ạ,2
sản_phẩm quá ok xài cũng sướng lắm nên mn mua đi k hề uổng tiền đâu nha,2
mua màu 201 tươi hơn trong anhe mùi rất quen nhưng ko nhớ mùi gì mua chơi thôi vì rẻ chứ cũng ko lì dễ lau dễ trôi,2
công_dụng làm đẹp kết_cấu tạm oke độ bền_màu cũng được rẻ cx khá chất_lượng màu son đẹp,2
màu này miễn chê rồi đẹp lắm luôn giá hợp_lí nên nhé mọi người,2
màu đẹp nhé nhưng hơi bột với giá này nên cũng k đòi_hỏi nhiều hình_ảnh và video mang tính_chất nhận xu,2
màu son đẹp giá_cả hợp_lí rất phù_hợp mua giao hàng nhanh,2
son gì màu ở ngoài khác ở trong ảnh rất nhiều mình thấy đánh_giá tích_cực nhiều nên mua test thử dù biết là giá rẻ nhưng cũng hơi thất_vọng,2
ưng lắm luôn ạ đóng_gói rất chắc_chắn giao hàng rất nhanh son thì rất mịn rất thơm rất đáng tiền mua nha mọi người chốt câu này là nên mua nên mua nên mua ạ,2
màu son xuất_sắc lắm kiểu thiên về hồng đất đánh đi học rất ok nè khuyên mn cực_kỳ nên thử chất son hơi bột nhưng vẫn tốt so vs giá 9 k 2 thỏi son hơi khô nên bạn nào đánh thì nên dưỡng môi kỹ,2
màu son đẹp rất ưng giao hàbg nhanh giá rẻ thấy mn bảo shope mal chính hãng nên mới mua,2
mình dưỡng ẩm trước khi đánh rồi mà vẫn bị khô và lộ vân môi nói_chung là mua với giá 69 k 1 thỏi cũng k nên đòi hổ nhiều nhưng hơi thất_vọng shop gói hàng rất kĩ,2
shop giao hàng nhanh son rất xinh mua đc với giá quá hời luôn cảm_ơn shop,2
son thơm lắm màu đẹp đóng_gói chắc_chắn săn sale khá reẻ,2
son đẹp thơm rẻ kẻ mắt lì đáng để mua,2
kết_cấu nhung mịn độ bền_màu nhanh trôi son nội_địa nên rẻ mình thấy mấy màu này để làm base thì ok nè,2
mình sale được giá hời thỏi son đẹp như minh_tinh về tay có 70 k sướng gì đây á màu siêu đỉnh luôn lên màu đẹp bám môi tuy ko bền lắm,2
công_dụng son môi kết_cấu chất kem xốp mỏng nhẹ mịn lên màu dễ độ bền_màu kém dễ trôi và không để lại lớp tint vỏ xinh nhưng cũng dễ dơ mùi thơm màu đẹp lên môi chuẩn nhỏ gọn dễ mang theo giá thì quá là okela cho chất và màu son,2
ui son màu xinh lắm chất ẩm nhiều dưỡng thumbs_up duyệt duyệt mua 1 đc 1 rẻ mà ưng quá lun,2
chất_lượng phù_hợp với giá hàng gói cẩn_thận,2
bia màu 25 thì quá chuẩn đẹp rồi canh được sale nên giá khá êm túi_tiền nữa love you_gesture_light_skin_tone nên mua nha mng,2
sp đẹp và đáng tiền giao hàng nhanh shop phục_vụ nhiệt_tình sẽ ủng_hộ shop dài_dài,2
son đẹp mịn giá rẻ nói_chung là tuyệt_vời luông màu xinh lắm nha chúc_shop buôn may bán_đắt nhé,2
hàng ổn giá_thành rerdr,2
son thơm chất son mịn với giá này mà dc son chất_lượng vậy là quá ổn luôn nên mua,2
vì là hàng quốc_tế nên giao hàng hơi lâu với giá_thành nhu vậy thì sản_phẩm đáng tiền,2
sản_phẩm rất tốt hàng chính hãng rất đáng tiền mua dù dịch nhưng vẫn giao hàng nhanh,2
giá rẻ ko nói nhiều vỏ đẹp ship hơi,2
son đẹp màu son như hình chất_lượng đóng_gói cẩn_thận rất đáng tiền mua,2
hàng về nhanh màu son lên rất chuẩn giá_thành thì rấc okila,2
son mịn và đẹp lắm ạ mua lúc đang sale nữa nên quá là hời luôn nhưng vì nên giao hàng hơi lâu mà chất_lượng khá ổn_áp,2
giao hàng nhanh shop phục_vụ rất tốt rất đáng đônhf tiển,2
hộp đựng son rất xinh màu ưng nè còn mịn nữa mình mua có 17 đ tính luôn tiền ship nha cho shop 5 sao quá tuyệt dời,2
chất_lượng sản_phẩm tốt đóng_gói sản_phẩm chắc_chắn giống hình rất đáng tiền,2
son đẹp rẻ ghê á lên màu ôkla,2
son đúng màu nhưng thiên về đỏ hơn mình thấy giống ma_u đỏ ánh cam hơn là đỏ đất khá thất_vọng vì màu k đc ưng_ý cho lắm giá_thành rẻ nên cx ok,2
son lên màu cũng khá ổn nhưng dễ trôi giá tiền thì phải chăng,2
hàng đẹp y hàng nhanh săn sale nên giá rẻ bất_ngờ vote 5 sao luôn,2
công_dụng kết_cấu dac độ bền_màu k ly giao hàng khá lâu đóng_gói chắc_chắn săn sale giá rẻ nên k kỳ_vọng nhiều,2
công_dụng màu đẹp uýnh lên trông xinh mà giá cũng ok kết_cấu lọ trắng độ bền_màu 86 chất_lượng hợp giá_cả,2
son đánh lên môi mướt mềm mịn biết thế mua mấy màu liền đang sale,2
màu 914 siêu đẹp dùng mùa đông best luôn không có gì để chê màu 939 lên môi mình thành hồng dâu xỉn hết cả da cả răng hơi buồn tí nhưng canh đc flash sale nên cg kệ vậy nhìn_chung thì rẻ chất oke,2
son vừa rẻ vừa xinh mỗi tội hàng nước_ngoài lên chờ hơi lâu thôi nên mua nha mn,2
mình mua lại lần 2 r vẫn thấy ưng săn sale nên thấy rẻ cực giống a12 mà lúc đầu hơi bóng tý nhưng xinh,2
hàng đẹp mình ưng sản_phẩm này giá rẻ nữa mà hàng về shop chắc là lỡ giao nhầm màu,2
màu ổn thôi nhưng mà nó kiểu dạng nhờn nhờn như có có dầu_ăn bên trong ý đánh ko tệp vào môi mà khi bặm môi nó kiểu trôi linh_tinh khó mà đều đc lòng môi nhưng vs giá quá rẻ như này thì ko_thể đòi_hỏi thêm đc tiền nào của nấy thôi nói_chung là vẫn đáng tiền,2
giao hàng nhanh đóng_gói cẩn_thận mẫu_mã đẹp chất_lượng ổn với giá tiền shop phục_vụ tốt nên mua nhé mọi người giao hàng nhanh đóng_gói cẩn_thận mẫu_mã đẹp chất_lượng ổn với giá tiền shop phục_vụ tốt nên mua nhé mọi người,2
hàng oke lên màu cũng depj mà ko hẳn là lì nha cho ce nào muốn biết mà rẻ ghê á,2
son chất_lượng ổn phù_hợp với giá tiền chất son mềm mịn,2
son không giống hình cho lắm nhưng với 2 cây son mà giá 89 k thì quá là oki r,2
son rất rẻ màu siêu đẹp rất ưng_ý cho shop 5 sao đều giao hơi lâu nha,2
son rẻ nhìn xịn xò lên môi không được đúng màu chất kem thơm mùi socola,2
giao hàng khá nhanh màu son đẹp chất ổn phù_hợp với giá tiền,2
giao hàng siu nhanh shop phục_vụ rất tốt màu đẹp rất đáng tiền,2
giao hàng hơi lâu hơn 1 tuần mới nhận đc son có mùi như gỗ ướt nhưng vs giá như vậy là ok,2
sớm đẹp lắm luôn ạ mua sale nên giá oke mua mấy lần ở shop vẫn rất hài_lòng smiling_face_with_hearts,2
son xịn với đẹp thật_sự săn sale nên giá hời lắm hình_ảnh mang tính_chất săn xu,2
đồ từ trung_quốc nên vận chuyện tận 10 ngày ms lấy đc được cái màu son nhìn đẹp cũng mịn nữa điểm trừ là nó không thơm với giá rẻ vậy thì quá oke rồi cảm_ơn shop nhiều nhé,2
son rất oke phù_hợp túi_tiền lên màu chuẩn nên có 1 cây ạ strawberry,2
son siêu xinh giá lại hạt rẻ 3 yew_shop ribbon anh shiper cũn thân_thiện nữa grinning_face_with_smiling_eyes mỗi tội hàng quốc_tế nên giao hơi lâu thui còn lại ok cả nka winking_face_with_tongue,2
lên màu siêu đỉnh hơi bị xịn rẻ nx á tr hình_ảnh chỉ mag tc nhận xu,2
đóng gói sản_phẩm rất đẹp và chắc_chắn chất_lượng sản_phẩm tuyệt_vời shop phục_vụ rất tốt shiper khá thân_thiện rất đáng tiền thời_gian giao hàng rất nhanh,2
chất_lượng sản_phẩm tuyệt_vời giá_thành hợp_lí nên sắm đủ bộ sưu_tập ạ,2
son màu xinh lắm luôn và rẻ nữa ạh chờ hơi lâu nhưng mà đáng lắm nha,2
son rất chi_là xinh_xắn lên màu đẹp mùi dễ_chịu chỉ có điều nhanh trôi nhưng với giá này thì rất ok rồi smiling_face_with_smiling_eyes,2
chất son bám lâu dễ tán k bị bết dính rất đáng tiền ship giao hàng rất dễ_tính,2
son giá rẻ mà chất_lượng quá_trời luôn huhu lại còn có mùi như socola nữa ưng cái bụng quá,2
shop giao hàng nhanh màu son đẹp gói hàng chắc_chắn giá_cả phù_hợp hàg chính hãg nên yên_tân,2
hàng đẹp mùi thơm giao hơi lâu giá rẻ cr ơn_shop âu sẽ ủng_hộ thêm ạ,2
son mịn_shop đóng_gói kĩ_càng chất_lượng cũng ổn_áp lắm giao đúng màu mình săn được giá sale 40 k nên rất hài_lòng luôn,2
cũng oke với cái giá này có điều tán son khó với chất son cũng k mịn lắm,2
hàng được gói kĩ_lưỡng trong 1 bọc nilon mỏng nhưng được đặt trong 1 túi khí nên rất an_toàn nha_shop còn tặng thêm 1 túi bông tẩy_trang mềm nhỏ xinh_xinh với 1 bịch mặt_nạ dưỡng mắt vàng 24 k nữa tuyệt_vời lắm shop ạ à lưu_ý là son hơi nhỏ nha nhưng mà với số tiền ntn thì v là đc r,2
màu xinh thơm kinh_khủng săn đc giá hời quá mua vỏ cute nhám nhám,2
công_dụng son moi o kết_cấu mềm_mại độ bền_màu đỉnh_cao r xuất_sắc nha mọi người oie nên mua ak gí quá hạt rẻ đi,2
ship hàng về bao nhanh màu son bao đẹp đáng tiền red_heart red_heart red_heart,2
son chuẩn màu xịn xò nma hơi khô khi tô tuy nhien với giá này là tuyetzoi lắm rùi,2
chất son mịn đẹp ship nhanh đóng_gói rất kỉ giá lại rất rẻ,2
giao hàng hơi lâu mua giá sale nên khá ok son_xinh phù_hợp với giá tiền thumbs_up,2
son rẻ mà bao_bì xinh quá là xinh lun màu son tone đất nhẹ_nhàng,2
hình_ảnh mang tính_chất nhận xu nhưng mà son thì màu khá xinh không lì mấy nói_chung với giá như vậy thì cũng okela,2
tiền nào của đấy thôi các bn,1
khi xem review thấy nói em này là son kem mình đã 3 4 năm gì đó rồi ko sd son kem lì mình hơi do_dự khi mua nhưng mà mình lại thấy giá rẻ nhiều màu đẹp nên mình khá mong_chờ thật_sự không làm mình thấy vọng chất son kem đã đc cải_tiến nhiều không còn khô như ngày_xưa nữa màu rất đẹp rất ưng,2
màu son ưng dã_man ý đánh thử cảm_giác mềm mịn k bị vón cục mua được giá rẻ nên sẽ ủng_hộ tiếp,2
shop đóng_gói cẩn_thận ạ chất son mướt màu lên cũng xinh lắm mình săn sale nên giá khá rẻ mình swatch son không chuyên_nghiệp nhưng nói thật là chất son rất đẹp đáng mua lắm đó,2
công_dụng khong lì kết_cấu bột độ bền_màu k bênf khá thơm k lì k bền_màu cũng xinh rẻ nên cũng ok,2
son chất lỳ mướt mùi có chút vị cam lẫn mùi rượu mua với giá 16 k kh đòi_hỏi nhiều,2
son đánh khả_mượt khô nhanh đầu son miềm mướt giao nhanh rẻ 2_cay mà có 9 k à màu đẹp red_heart lần sau sẽ ủng_hộ shop mik đã quét mã son chính hãng nha red_heart,2
màu đậm hơn so với trên mẫu đánh một xíu đỏ_chót luôn trong hơi sợ săn sale giá rẻ,2
son đánh thích lắm nhé phù_hợp và giá tiền cơ_mà thổ kia là thỏi mình đánh hết r đó kaka nên mua nha mn,2
mình mua lần thứ 2 chất son thấy mịn á lên màu chuẩn có mùi hương nhẹ mua 2 màu v17 18 nhưng mình thấy màu v17 dễ xài hơn v18 nâu có ánh cam hợp da trắng mình tone da lạnh nhưng đánh màu v18 lợt thấy đẹp còn đậm thấy dừ sao đó nói_chung cũng nên thử ne rẻ mà thiết_kế đẹp chất son okela nhe 5 star,2
đã nhận được hàng shop giao đúng và đủ mẫu đặt_hàng quốc_tế nên từ 12 2 mới nhận dc hàng nè màu son hơi sáng so với ảnh mẫu đánh thì phải chất son mùa đông này hơi khô phải có thêm lớp dưỡng ở dưới ms chịu dc nha mn nchung vs giá tiền như vậy so vs chất_lượng son thì oke cho shop 5 sao,2
đã nhận được hàng shop giao hàng đầy_đủ giá rẻ mà khá xinh nên thử,2
son rất xịn sò rất ưng cái bụng có cả thư cảm_ơn mua sale nên càng ưng red_heart,2
son màu oke lắm mùi khá thơm đánh lên rất mịn luôn smiling_face_with_hearts rất đáng tiền mua luôn see no evil_monkey,2
thích sờ vỏ son cực min lắm màu đỏ nâu đẹp lắm màu ảnh như trên giá như vầy thì trôi nhanh rồi và tô phải tán ngay nhé k là k tán đuoc ý,2
sản_phẩm_giá rẻ chất_lượng ổn son không được như mn review đâu ạ,2
son lên màu xinh nha mn nhưng chất thì mình k thích lắm vs giá tiền này thì quá ok r ạ,2
sp đóng_gói đẹp giao hàng nhanh màu ổn thơm mùi kẹo còn kẹo gì thì đầu mình chưa load ra woman_facepalming lói chung là với giá_thành này thì ổn nha relieved_face,2
giao hàng hơi lâu nhưng do dịch nên ko sao đóng_gói cẩn_thận mùi như socola đồng xu hồi bé ăn_ý màu đẹp hợp cho da trầm như mình chất son ko mướt hẳn vẫn hơi bị bột li_ti lúc đánh lên môi và một_số chỗ chưa đều màu ncl với giá thì ntn là ok r,2
giao hàng nhanh màu son đẹp giá_cả phù_hợp túi_tiền nên mua,2
màu siêu xinh nha hàng quốc_tế mà giao nhanh lắm nch là siêu_ưng mà giá rẻ nữa,2
quá rẻ mà lại xịn xò vô_cùng chất kem mịn và khá lì hàng chính hãng nội_địa trung_quét được qr code check ra đúng hàng của hãng nha,2
giao hàng tầm chưa đến 1 tuần màu xinh mượt có mùi thơm nhẹ của socola woman_in_steamy_room đắt tiền lắm mng ưi,0
gói hàng sơ_sài quá luôn son thì k chuẩn như ảnh phấn phủ dùng tốt sp che khuyết_điểm thì có mùi nhìn_chung giá rẻ nên mua thì chỉ có phấn phủ và cái tệ nhất là màu nền như của u60 vậy,2
giao hàng tầm 7 ngày là nhận được hàng sản_phẩm như mẫu giá ok,2
son đẹp cực luôn mình ko nghĩ là giá rẻ mà son lại đc chất_lượng như thế,2
chất son khá mướt môi k bị khô mùi k thơm hơi khó_chịu tí nhưng bù lại màu đẹp xuất_sắc với giá tiền ý thì trên cả mong_đợi,2
son săn sale rẻ hơn tí 140 k màu bám lâu trôi ngon hơn hẳn,2
màu son đẹp chất son dễ tán hơi khô dung_tích son 2 mấy gr đó bằng nửa son bth giá rẻ khi uống nước cà_phê son trôi đi trông khá lem_nhem cần mang theo son để dặm lại,2
giao hàng lâu thiệt sự son màu rất xinh nma hơi khô với giá này thì ok ạ,2
chất son so với giá tiền là quá ok thỏi o5 có mùi như mùi socola luôn vỏ son siêu cute,2
thiết_kế ưng chất son cũng khá là mướt không hẳn là lì nhưng không quá dễ trôi màu hơi tối so với màu ở ảnh vẫn ưng bụng với son và mức giá này rồi,2
hàng bia thì chuẩn xịn rồi hợp giá_cả với học_sinh sinh_viên lại chất_lượng nữa,2
màu xinh dã_man luôn ạ chất son xịn mịn hộp xinh dã_man gói cẩn_thận cầm chắc tay không bị lỏng_lẻo như 1 số son rẻ_tiền rất đáng tiền,2
son giao đúng màu đóng_gói kỹ săn sale 2 cây chưa tới 30 k chưa xài thử nên chưa biết chất son như nào giá này thì nên mua nha,2
mình có sẵn các loại belt này ai cần ib mình hoặc đr ig nhóe chất son lì sờ rất thích và rất nhẹ môi thỏi hơi nhẹ_tay và cảm_giác hơi ít nhưng so vs giá thì ok,2
công_dụng màu lên ko chuẩn mùi socola nhưng mk thấy hơi hóa_chất sao ý kết_cấu nhìn khá ngắn tầm như son thỏi ý que đánh thì bề_mặt to nhưng lỏng_lẻo khó đánh độ bền_màu ko bền đâu nha nhanh trôi dữ lắm thất_vọng vô_cùng thấy son mal nên cũng nghĩ ổn nhưng hàng về đúng buồn luôn thôi thì giá này cũng chả dám đòi_hỏi thêm,2
giao đúng màu bôi lên thấy mềm mịn giữ đc khá ko thích mùi cho lắm dùng đc phù_hợp vs giá tiền,2
son rẻ mà ưng lắm luôn màu son thì toẹt vời nói_chung chất_lượng hơn cả mong_đợi đáng mua lắm nhé mình hình_ảnh và vid chỉ mang tính_chất nhận xu,2
đóng gói sản_phẩm đẹp chắn chắn sản_phẩm vẫn còn nguyên sản_phẩm rẻ tốt,2
màu son đẹp giao hàng nhanh_shop đóng_gói kĩ chắc_chắn màu lên môi hơi bị tối nhưng là ok màu son mềm thơm mịn lắm rất đáng tiền nha mn,2
công_dụng làm đẹp kết_cấu hơi khô nhưng mịn màu đẹp độ bền_màu khá bền son xinh xỉu giá cũng rẻ vì săn sale ba màu đều đẹp,2
oke các bạn xinh nhé 12 12 săn sales giá rẻ hio,2
tuyệt_vời ông mặt_trời luôn ạ xinh xịn mà_còn rẻ nưẫa,2
công_dụng son xinh lắm nha giá rẻ nên mua,2
giá gốc hay flash sale thì cũng rẻ mình mua vì muốn xả stres thui ah cảm_giác unbox sẽ giải_tỏa buồn_phiền dù chỉ trong chốc_lát hong biết có ai_cảm_giác như z hong grinning_squinting_face còn dùng thường_xuyên thì ko nên nhé bạn xem thành_phần son trong video trên để thấy backhand_index_pointing_up_light_skin_tone backhand_index_pointing_up_light_skin_tone,2
son dù nước_ngoài nhưng giao hàng siêu nhanh đóng_gói bắt_mắt đáng đồng_tiền lắm lun ý cả nhà,2
son mẫu_mã đẹp mùi thơm nhưng chất son hơi bột k tệp vào môi màu lên cũng k như_ý lắm giao hàng hơi lâu giá rẻ nên cũng k_thể kì_vọng quá nhiều vào chất_lượng mình vẫn đánh_giá 5 sao cho đóng_gói hình_thức và mùi thơm,2
son mùi thơm lâu trôi màu như hình sản_phẩm tốt giá rẻ mọi người nên mua nha,2
son màu rất đẹp hợp với giá tiền đáng để mua nha,2
sản_phẩm đẹp chất_lượng với giá tiền như vậy mình hoàn_toàn ưng luôn,2
công_dụng màu lên tay cx oke kết_cấu son mịn hộp mỏng nhẹ độ bền_màu như mình thấy thì nó không có lì cho lắm vừa_mới xoa_tay là đã mất màu rồi chì mắt cx vậy nchung với giá này như vậy là cx ổn rồi giao lâu,2
chất son_đẹp phù_hợp với giá tiền sẽ mua thêm vào lần sau nữa,2
son đẹp bôi mịn nhưng cái nắp trong cứ bị dính vào nắm son ý với giá này thì quá ổn mọi người nên mua ạ,2
hàng màu siêu đẹp luôn mùi thì thơm kinh_khủng mùi thơm kểu hoa_quả ý rất đáng tiền nha,2
son gọn_nhẹ thơm màu mịn nhanh trôi nhìn_chung phù_hợp với giá tiền,2
son vừa rẻ thơm lại càng nha cả nhà nên mua lắm nha,2
son kem rẻ chất son hơi bột và không dính môi mình chắc tại môi mình không hợp nhưng săn sale với giá này thì quá hợp_lí,2
giao hàng siêu nhanh đóng_gói chắc_chắn chất_lượng ok giá rẻ,2
đóng gói sản_phẩm cẩn_thận giao hàng nhanh săn được nên giá rẻ,2
son màu đẹp giá rẻ nhưng đánh lên rất mịn mượt thơm nhẹ_nhàng tôi rất ưng_ý với sản_phẩm này,2
chất_lượng son giá học_sinh hehe mn rảnh qua tường e mua trị mụn và dưỡng da nạ smiling_face_with_hearts,2
son màu rất đẹp chất lì oke lắm giá rẻ đáng mua lắm nhé smiling_face_with_hearts sản_phẩm quá chất_lượng,2
mua 2 cây son vỏ ngoài nhìn ưng n khi mở thì 1 cây ôk cây còn lại lèm lèm tại nó bị mất cái vỏ trắng ở đầu đựng son khá buồn n thôi tiền nào của đấy mua rẻ pải chấp_nhận ld mua hàng ở shop vẫn đánh_giá 5,1
son mình thấy lên màu cũng được khô nhanh lắm luôn ấy nên phải bặm môi nhanh chứ ko nó khô thành một cục luôn nhưng mà với giá_thành nay thì quá oke luôn rồi,2
mùi socola thơm lắm ạ sản_phẩm phù_hợp với giá tiền chất son ko tốt lắm mn cân_nhắc trước khi mua na,2
son mịn và màu đẹp nhưng dễ trôi với giá này thì nói_chung là hợp_lý,2
son màu đẹp được giảm_giá nên rất rẻ chất son ok giao hàng nhanh,2
giao hàng hơi lâu mua với giá ntn mà màu siêu đẹp ạ mọi người nên mua nha hình_ảnh klq,2
son đẹp nha màu rất xinh giao hàng đúng_hẹn mà giá còn rẻ nên mua nha,2
nhỏ nhỏ xinh_xinh dùng thích lắm nhé giá lai rẻ nữa,2
sản_phẩm nhận được rất ưng lắm màu rượu_vang mình chọn lên môi màu rất đẹp sản_phẩm vừa rẻ vừa ko đẹp,2
màu đẹp cực_kỳ mình thấy son bám khá lâu trên môi mình kể_cả khi ăn_uống với giá tiền này thì sản_phẩm phải nói là chất_lượng ạ,2
vỏ son xịn mùi socola rất thơm tuy_nhiên son hơi bột khô môi và màu 204 lên môi mình giống hồng cánh sen hơn là hồng đất mình săn sale có 23 k thôi nên giá này chấp_nhận đc ổn nhé mn,2
hình_ảnh và video chỉ mang tính_chất nhận xu thoi ạ áp đc mã 30 k mua được em này 0 đ ưng quá_chừng,2
chất_lượng sản_phẩm oke mua được giá sale nên hợp lýy,2
đóng gói cẩn_thận gọn_gàng bao_bì đẹp được tặng thêm card nhìn rất xinh cute giá bình_dân màu nhìn xinh nhưng k biết đánh lên môi có đẹp như ảnh k,2
chất son đẹp mịn màu lên giống hình chất_lượng sản_phẩm tuyệt_vời so với giá tiền mỗi tội vỏ hơi bị méo một tẹo,2
với giá tiền như này thì quá là ưng_ý,2
công_dụng màu này hợp làm lớp lót kết_cấu không mịn lắm để lại vân môi độ bền_màu tốt son có mùi thơm hàng đóng_gói cẩn_thận chắc_chắn giá rẻ chất_lượng phù_hợp với học_sinh,2
hàng quốc_tế nên giao hơi lâu nhưng màu son lên rất đẹp săn sale nên mua đc giá rẻ,2
chất son mịn kiểu như bột ạ mịn và không lì lắm đâu nha mọi người săn sale nên không đòi_hỏi 3 chỉ có giao hàng hơi lâu,2
giá rẻ hàng giao k bị móp hay gì hết son màu xinh cực hàng quốc_tế nên giao hơi lâu tí thôi,2
son của nhà focalure thì quá đỉnh r k còn z phải bàn còn rẻ nữa mình mua 4 cây rùi í đơn mình mua nhiều còn được tặng thêm cây son nữa,2
