processed_data,target
sản_phẩm đẹp chất_lượng như giá tiền hình_ảnh chỉ mang tính_chất nhận xu,2
màu ở ngoài khá đẹp red_heart thơm mùi socola đóng_gói hàng kĩ_càng với chắc_chắn màu vừa đẹp vừa thơm vừa mịn nữa vì là hàng từ nước_ngoài nên ship cũng hơi lâu nhưng nhận hàng rồi thì rất đáng đồng_tiền bát gạo nên mua nha mn smiling_face_with_open_hands,2
màu siu đẹp giá bằng một nữa bên shop khác thui ấy mùi cam thơm nhưng chất này khá khoi môi nên tẩy da chết trc khi bôi là lung_linh,2
hình_ảnh mang tính_chất nhận xu thôi nhưng theo đánh_giá của mình thì son giá rẻ nhưng chất_lượng miễn bàn chất son mịn bám đánh lên xinh xỉu í,2
kết_cấu dep jd độ bền_màu tốt chất_lượng sản_phẩm phù_hợp với giá tiền ship nhanh đóng gói hàng cẩn_thận hình_ảnh mang tính_chất nhận xu,2
19 k nhưng nhìn xịn xò v lên màu đẹp nhưng chất son ko đẹp bị bột bột dễ trôi,2
giao hàng nhanh son bám lâu màu son đẹp giá rẻ 154 k sẽ tiếp_tục ủng_hộ shop,2
kết_cấu so mem muontw chinh chan lam siu re son mem lam mau dep,2
đóng_gói kĩ_càng lắm giá_cả phù_hợp màu thì xinh khỏi phải bàn nữa mua 2 cây nên đc khuyến_mãi sẽ ủng_hộ shop nhiều,2
son đẹp đáng tiền trừ 1 sao vì nhắn_tin cho shop rất lâu mới trả_lời nhưng kiểu cho có chứ không làm,2
sản_phẩm tốt màu son khá đẹp phù_hợp với giá tiền nhận hàng từ mấy hôm trước rồi mà giờ mới đánh_giá được a,2
son đáng_giá với số tiền ạ màu này xinh lắm nhưng mà có điều là son dễ trôi làm khô môi hàng đóng thơm lắm ạ,2
chất_lượng sản_phẩm tuyệt_vời đóng_gói chắc_chắn son săn sale nên cũng k đẹp lắm,2
hình_ảnh mang tính minh_họa vì lười chụp chất_lượng son thì ok lên màu đẹp giá_cả phải_chăng mẫu_mã đẹp,2
giao hàng hơi lâu do bên nước_ngoài đóng_gói cẩn_thận son lên màu cũng xinh son rẻ nên là cũng k có đòi_hỏi gì nhiều smiling_face smiling_face,2
công_dụng đi học đi chơi kissing_face_with_closed_eyes kết_cấu nhỏ gọn xinh_xẻo iu thích độ bền_màu đúng màu thơm mình đọc thấy nhiều coment là son mùi hắc nhưng theo mik thấy là son ko có mùi hắc đâu_đó là do các bạn dùng chưa quen với_lại là son đang còn mới í nên là smiling_face_with_heart eyes nói_chung với giá tiền này thì qua xuất_sắc roiui,2
mùi son là mùi cam nhưng hắc quá shop ạ chất son thì khô ai môi khô quá thì không hợp nha tiền nào của đấy ạ,1
son đẹp mê luôn mng giá quá rẻ cho 1 em chất_lượng như vậy màu 01 chuẩn đỏ nâu giống blr a12 và bia25 chỉ là ko biết có hại môi hay ko nhưng màu đẹp 5 cho shop,2
màu nào cũng xinh_xẻo hết giá rẻ mà chất_lượng đỉnh đỉnh,2
sản_phẩm tạm được phù_hợp so với giá tiền nhưng mà nói_chung là vẫn nice lắm mn,2
màu son xinh cực dễ phối shop giao hàng nhanh giá rẻ nên mua,2
chất_lượng hàng phù_hợp vs giá tiền nhưng mk quá thất_vọng với thái_độ của shiper,2
shop đóng gói hàng cẩn_thận giao nhanh son nhìn xịn xò phết nha đợt đấy săn sale nên rẻ mình chưa test thử nên không biết hợp không đợi mình test thử quay lại đánh_giá tiếp beaming_face_with_smiling_eyes,2
màu son xinh lắm chất mịn cũng khá lì so vs giá thì ok r okmk,2
tuy là hàng quốc_tế nhưng giao cũng khá nhanh trong tình_hình dịch_bệnh như này chin cảm ưn kissing_face_with_smiling_eyes son màu khá xinh ạ giá_thành rẻ,2
giao hàng hơi lâu do dịch nhưng bù lại được em này dễ đánh lên mỗi lắm nha màu đẹp mà còn thơm nữa eo ơi cái mùi scl chỉ muốn ăn luôn ýy nch với giá tiền ntn thì mình thấy quá là ok nên mua nha,2
giao hàng nhanh hơn dự_kiến son thơm mùi cam lắm giá_cả phải chăng,2
giá_cả hợp_lý lại còn được săn sale giá quá hời mỹ_phẩm xài khá ổn,2
son giá rẻ nên ko mong_đợi chất lg son hơi ghê màu cam ko đẹp như hình,2
son ok giao hơi lâu tí đánh_hơi nặng môi mg rồi hoàn xu các thứ còn 70 k 2 thỏi,2
hàng giao khá nhanh đóng gói kỹ hàng còn nguyên tem nhãn có mã qr để check nên khá yên_tâm hàng săn sale mà ổn lắm,2
son xinh xỉu màu chuẩn đáng tiền lắm nha mn_shop cute thân_thiện hay rep tin nhắn khách là thích rồi ship từ nam ra bắc mất 2 tuần xa nên ship lâu thông_cảm đc,2
màu xinh dã_man giao hàng cũng khá nhanh đặt được hàng lúc sale nên khá rẻ nhưng màu thì k_thể chê nổi nó quá tuyệt_vời,2
mình đặt 402_shop giao 404 mà cái màu 404 nó đúng nâu đất rất ít cam nên nhìn khá già nhưng đc cái k xỉn da vẫn trôi son bt nha mng mua trải_nghiệm thui chứ thực_ra mức giá này k trông_đợi nhiều,2
son màu xinh lắm nha mn nên mua nhé giá hs nha đặc_biệt son k bị vón lại,2
giao hàng nhanh son rẻ mà xinh nha mọi người ưng ạ hihihi,2
công_dụng son màu nude đẹp kết_cấu chất kem xốp dễ đánh_hơi khô môi độ bền_màu rất dễ trôi với giá_thành như_vậy thì chất_lượng vầy là quá ổn mặc_dù dễ trôi với hơi khô môi nhưng màu lên giống với hình,2
mua đúng dịp sale nên cx rẻ mua lúc 12 12 mà bh 20 12 nhận đc hàng r giao nhanh giá rẻ,2
giao hàng nhanh đóng_gói khá kĩ mua dịp sale còn được tặng quà son mùi thơm chưa xài nên hok biết màu ra sao,2
chưa mở ra coi mà check mã có ra trang wed chính hãng luôn nha nói_chung với giá này rất là đáng mua,2
giao hàng nhanh săn được giá hạt sale mua của shop nhiều lần rồi nên mua nha mọi người,2
son chất mịn ko phải son lì nên lau xíu là trôi hết nhưng giá này đc cây son vậy thì tuyệt_vời red_heart,2
màu son khá xinh độ bám màu cũng lâu giá_cả lại hợp_lý very god thumbs_up,2
vừa tiền với sản_phẩm đóng_gói kĩ_càng bên ngoài rất đẹp hình_ảnh chỉ mang tính minh,2
đẹp lắm nha màu đẹp mà rẻ nữa son k lì lắm giao hàng hơi lâu xíu,2
bia 25 thì mình đã rất nhiều rồi nên ganh đợt sale để rinh thêm về thôi mình canh sale đc 3 thỏi á rolling_on_the_floor_laughing cùng ngày mà mới 1 thỏi về thôi các bạn sẽ thấy 2 đánh_giá tiếp của tôy,2
vì hàng quốc_tế nên giao khá lâu đóng_gói hàng okela cực_kỳ khá xinh và rẻ 10 điểm,2
hơi bột bám màu kém nhưng màu đẹp giá này,2
shop đóng_gói hàng oki sp khá tốt mỏng nhẹ thơm giá tốt khá ưng,2
son thơm mùi socola đánh lên ưng lắm rẻ nữa sẽ ủng_hộ shop dài_lâu,2
mua hôm dịp sale bây_giờ mới nhận dc hàng đã mua với giá rẻ còn dc tặng kèm theo 2 chai tẩy_trang phải nói là quá hời lun mng lai,2
son thơm lên màu đẹp mướt giá_thành hợp_lý phù_hợp với túi_tiền học ảnh chỉ mang tính_chất nhận xu,2
em này xinh xỉu mng ơi đáng tiền mua lắm không còn gì để chê cho 1 em son quá chất_lượng quá rẻ phù_hợp với túi tiền của các bạn hsv mùi siêu thơm giao hàng cũng khá nhanh mặc_dù là shop nước_ngoài hợp với những bạn da ngăm nữa nha,2
rẻ và đẹp quốc_tế mà giao cũng nhanh ghê mà đóng_gói không an_toàn lắm không có gì để chống sốc cả hình_ảnh và video mang tính nhận xu,2
canh sale nên tui tậu 4 cây luôn mùi thơm lắm ạ nên mua nha mọi người,2
son mùi nhẹ đánh lên mịn nhưng m tháy k lì lắm hợp vs giá tiền nha mọi người red_heart,2
son đẹp đây là thỏi t2 mình dùng rùi chất mịn lắm thơm mùi cafe rẻ nữa,2
chất đỉnh vcl í mng ko ngờ rẻ mà chất mịn xịn sang ultr má đáng mua,2
son rất là mịn luôn á mà lên màu còn đẹp xĩu nữa không ngờ giá rẻ mà chất_lượng ok vậy luôn á,2
công_dụng son mịn đẹp kết_cấu vỏ chắc_chắn rất là xịn luôn nha độ bền_màu bám màu rất ok son mướt săn sale giá quá hời luôn,2
công_dụng trang_điểm kết_cấu đẹp độ bền_màu tôtd với giá tiền siêu uư đãi này mà có_thể có cây son chất_lượng đáng chú_ý như vậy đồ bền_màu lâu màu lên rất đẹp dễ đánh lên môi,2
màu xinh rất rất đệp ạ lọ nhỏ nhưng sang sịn đánh lên môi thì nghe mùi thơm thoảng của socola gất bền_màu và lâu trôi mua ở shop mail nên cũng an_tâm nói_chung là đáng tiền thích lắm ạ,2
hàng rất ok cứ tưởng nội_địa trung sẽ ko ổn nhg ổn cực luôn lại săn đc sale nữa,2
son lên màu đẹp lỳ lâu trôi nói_chung là rất đáng tiền thích lắm,2
son lên màu đẹp chuẩn rất đáng đống tiền mọi người nên dùng thử để trải_nghiệm,2
màu rất đẹp mùi thơm giống a26 đặc_biệt màu 404 tuyệt đẹp nha đánh lên nhìn da trắng bật tông chất son ẩm nhưng không cố_định nên đánh rất khó và đặc_biệt ko ăn lòng môi chút nào với giá tiền như vậy cũng ko đòi_hỏi nhiều đẹp,2
son mình thấy màu này đánh 1 ít thì trông sẽ rất nhẹ_nhàng và xinh luôn với giá này thì quá rẻ,2
màu son lên đẹp lắm đẹp rẻ chất mua nha mn,2
giao hàng nhanh lắm ạ chất son khá ổn với giá này thì quá rẻ rồi,2
son lên màu đẹp chất đẹp mà giá siêu rẻ rất đáng mua mua của shop rất nhiều lần kh thất_vọng lần nào,2
ta nói nó đẹp sx lun aạ chất k khô lắm đâu mng ui săn sale có 30 ka mà ưng bụng màu này tựa bia 38 mng nhé nên mua ạ,2
son xinh chuẩn màu giá rẻ vỏ cũng đẹp nữa mỗi tội là mùi nó không được thơm lắm,2
chất_lượng sản_phẩm ổn giá_thành hợp_lí giao hàng quốc_tế khá nhanh luông,2
chất velvet bông mịn không làm lộ vân môi son có mùi đào thơm nhẹ_nhàng giá quá rẻ cho 1 em son xịn như này,2
hình_ảnh chỉ mang tính_chất nhận xu giao hàng nhanh chất_lượng tốt đáng tiền lần sau sẽ ủng_hộ shop,2
son lì màu đẹp mua thì mua không phí tiền đâu mà lo hehe,2
lần đầu mua hàng mà ưng lắm mọi ng ui ưng bụng lắm nè lại còn giảm_giá nữa red_heart red_heart red_heart,2
son siêu xinh luôn smiling_face_with_heart eyes không ngờ giá rẻ vậy_mà cũng khá lì và lên màu cũng đẹp lắm luôn,2
sp khá ok dùng mùi khá thơm sp phù_hợp với giá tiền học_sinh cho shop 5 sao ạ sẽ quay lại mua hàng thêm nhiều lần nữa,2
màu đẹp mịn k lỳ mấy nc giá rẻ thì đi đôi vs chất_lượng,2
son mua lúc sale có 51 k cả ship ship hàng lâu 10 ngày mới tới son hàng nhái fake với giá 51 k con đắt í lau cái hết luôn k nên mua nha buồn giao k đúng màu son crying_face,0
son xinh lắm nha vì là mua tặng sn nên ko xem đc màu nói_chung là rất ok nên mua nha rất đáng tiền,2
son siu xịn đúng gói cẩn_thận,2
giao hàng hơi lâu vì dịch hàng đóng_gói cẩn_thận son mùi rất thơm vừa với giá tiền nên mua,2
màu son đẹp đánh lên mềm mịn môi 79 k 1 thỏi son thì khá xịn nên mua hình_ảnh klq vì mình lười chụp ảnh smiling_face smiling_face,2
đóng túi chống sốc chắc_chắn còn có quà tặng kèm là dây cột tóc lần đầu_tiên mua mỹ_phẩm nội_địa tq chưa xài thử n mua ngay đợt sale 9 9 giá tốt hi_vọng xài ổn,2
đánh ưng nhắm giá săn dc siêu hời lun í có 5 k disappointed_face OK_hand mình thích đánh kiểu mịn mịn vầy nề,2
sang xịn mịn lắm luôn nha nhưng chỉ mỗi cái giao siêu lâu đặt từ hơn tháng và bh ms nhận đc hàng nhưng đk cái là mk mua 2 thỏi vs giá rẻ lúc đag sale cn về chất_lượng khỏi pải bàn,2
son khô môi màu chuẩn tươi xinh k bị vàng răng da ai cực trắng càng hợp hơn nữa mẹ mình đánh trẻ ra vài tuổi chất son khá lỏng k có mùi thơm nhưng cũng k hôi nồng quá vỏ đẹp cầm chắc_chắn bao_bì chuẩn hàng_hiệu giá ok so với cây son như này đầu son khá to nên lấy ra khỏi thỏi hơi khó,2
son này này giống hình nhưng chất kem bột quá mùi cũng k thơm lộ vân môi nếu mix với son khác thì cũng được chứ bảo xài không thì xấu lắm nha đc cái hãng này giá rẻ nhìn sịn xò nhưng chỉ phù_hợp với giá tiền thôi nha k đòi_hỏi gì đcthêm,2
son đẹp mềm như nhung nhưng màu ko giữ đc lâu giá rẻ thỏi son cầm chắc_chắn sang chảnh màu xinh,2
son xinh lắm luôn còn nói đến chất_lượng thì khỏi bàn săn sale nên giá không công bao_nhiêu hết á,2
hơi nhỏ hơn mong_đợi sản_phẩm phù_hợp giá tiền nói_chung là được tế giao tầm 10 ngày,2
son đẹp lắm lại rẻ nữa giao hàng hơilâu nhưng đẹp là được,2
son màu đẹp tôn da_da ngâm hay da_trắng đều sài ok giá ổn tui chụp hình thì màu hơi nhạt chứ ngoài son lên môi xinh lắm son mềm mịn kh khô môi nói_chung là nên mua nhoe red_heart red_heart,2
son ok theo giá tiền nhé da mình hơi đen nên chọn màu trầm xíu đánh lên xinh_xinh mỗi tội giao hàng lâu quá lâu,2
siêu xinh siêu rẻ nói_chung là với gái tiền như v mà chất_lượng của son như thế là ổn lắm rồi,2
giá rẻ son mịn môi không lì lâu màu son sáng da hợp trend hàng giao cẩn_thận,2
giao hàng trong thời_gian covid nhưng cg k quá chậm chất son hơi lỳ m thấy son khá thơm hơi giống mùi bánh_trung_thu dẻo ấy màu lên chuẩn xinh lắm ấy sẽ mua lại lần nữa mua hôm sale nên giá rẻ cực đóng_gói cg rất kỹ và hộp k bị móp méo,2
son màu xinh xỉu lun mua đợt sale nên giá rẻ rvm mn nên mua nhâ,2
chất son mềm mịn lên màu đóng_gói kỉ và giao hàng tiền nha còn được tặng thêm thỏi son nhỏ nhỏ xinh_xinh nữa hình_ảnh chỉ mang tính_chất nhận xu,2
công_dụng làm đẹp kết_cấu đẹp độ bền_màu khá nhanh trôi chất son hơi bột đi nhma son thơm mùi socola lắm nch với giá này thì đáng mua nha,2
son oke lắm nè vỏ ngoài xinh son hơi bé xíu màu như trên hình chụp í chất mịn cũng dễ xóa trái là 403 phải là 402 á giao hơi lâu do là hàng qte nma phù_hợp với giá tiền lắm nè màu lên môi xinh á vid ngoài lề nhận xu thui hõng liên_quan tới son uwu,2
màu son giống với hình minh_họa giá rẻ nhưng chất_lượng son tốt,2
son đẹp khá lì màu ok giá rẻ mà chất_lượng giao hàng hơi lâu xíu,2
với cái giá 50 k cho 1 thỏi son nhe này thì rất là tuyệt vòi ảnh mẫu với màu son ở ngoài thì màu ngoài nhạt hơn nhé mn chất mượt như nhung hơi khó tán thoi nói_chung là 10,2
hàng cực_kỳ chất_lượng màu lên cực đẹp luôn ạ giao hàng hơi lâu nhưng rất đáng tiền,2
đẹp xịn chất_lượng nha tuy ở nước_ngoài nhưng vẫn chất_lượng và rẻ,2
màu chuẩn đẹp bao_bì đóng_gói kĩ quấn xốp khá giày hộp không bị móp méo giao hàng khá nhanh khá ưng săn sale có 97 k nên thấy chất_lượng vưowjt xa túi_tiền haha nên mua nha,2
son lên màu rất đẹp rất đáng tiền mua giao hàng đóng_gói nhanh_chóng,2
thời_gian giao hơi lâu giá hợp_lý màu son đẹp tuy ko lì lắm,2
giao hàng hơi lâu hơn so với các shop quốc_tế khác nhưng hàng khá chất_lượng rẻ đẹp oke,2
săn sale nên được giá rẻ hàng quốc_tế nhưng giao nhanh chất son mượt màu son lên hình đẹp,2
son ok so với giá màu lên đẹpop,2
son bia rất ổn so với mức giá màu son đẹp ưng xỉu shopmal nên yên_tâm,2
son siu đẹp và thơm rẻ nữa màu đẹp và chất son như mấy son bi ý thích nhắm,2
son đẹp lắm mọi người ơi son rất mềm mịn còn có mùi socola nữa săn sale nên giá 2 thỏi còn 74 k,2
son đánh lên mịn thơm rẻ mà chất_lượng ghê xứng_đáng 5 nha,2
son mua đc giá sale nên siêu rẻ đóng_gói hàng kĩ giao hàng nhanh,2
son cực lì và màu đẹp giá rẻ,2
chất son mịn có điều màu trong ảnh với ngoài hơi khác nhưng với giá tiền này cũng ko đòi_hỏi được,2
đóng gói cẩn_thận sản_phẩm rất ok so với giá tiền son môi nhanh ko sao,2
nhờ bạn nhận giúp nên k có hình thấy son sale khá rẻ nên mua thử sau nhận đc son sẽ review chi_tiết,2
mua lúc sale 2 sp giảm 50 nên hời lắm tôi mua hẳn 2 cây 2 màu luôn v17 với v18 thề là màu xịn cực_kì mỗi tội mình k thích mùi lắm chất son mịn nhẹ,2
son cực_kì xinh nha mà shop giao hàng hơi lâu chút á mua đc lúc sale nên giá còn rẻ nữa,2
công_dụng phù_hợp với son hàng ngày không make up kết_cấu chất kem mịn tuy_nhiên dễ lem độ bền_màu ổn son lên màu đẹp sáng da thiên cam mềm mịn không bị khô gây bong_da lúc đánh lên dễ lem nhưng mà lấy giấy bặm sơ để lấy bớt son ra là được ổn với mức giá,2
son đẹp rẻ nói_chung oke nên uho ảnh vid mang tính_chất nhận xu,2
chất_lượng quá là xuất_sắc luôn ạ ngon bổ rẻ mại dô mọi người ơi,2
theo cảm_nhận của mình thì son khá lâu khô đánh rất dễ bị dính răng với giá_như này thì cũng không đòi_hỏi gì thêm vận_chuyển khá lâu,2
giao hàng hơi lâu ạ nhm giá rẻ với nhiều người sài đc nên cungz ok nhé 3,2
hàng siêu đẹp đóng_góp đồ siêu chất_lượng luôn đó ạ rất đáng tiền,2
son lên màu hồng_hồng rất xinh ship nhanh lắm luôn á son hơi bé nhưng phù_hợp giá tiền đánh lên xinh lắm lắm luôn hơi bị khô môi xíu tóm_lại phù_hợp giá tiền,2
chất son tạm được màu cũng xinh săn sale giá rẻ nên nhìn_chung cũng okela,2
son đẹp mịn môi khá lì giá quá iu hihihi sẽ ủng_hộ lâu_dài,2
theo mình thấy thì son hơi nhỏ trên ảnh là màu đỏ nâu nma đánh lên thấy hơi tông cam cam 1 chút k giữ dc màu lâu và son hơi bóng với giá này thì cũng ổn mỗi tội giao hàng siêu lâu tầm 9 ngày mới có,2
hàng đẹp gói kĩ chính hãng mua đc đợt sale nhiều nên nua quá_trời lun,2
hàng đẹp lắm mọi người giá rẻ mà ok lắm luôn á nên mua nha mọi người,2
băng đô cài tóc gấu nâu cute lại mua được giá sale nữa hihi son màu đẹp giá cũng rẻ kính màu ngầu vãi ra nói_chung là ok hết á giao hàng tầm 10 15 ngày á mn nên mua ủng_hộ shop nha smiling_face_with_open_hands,2
son rẻ mua tặng nên không biết chất_lượng như thế_nào đóng_gói hơi sơ_sài,2
giao hàng đúng đủ nhanh hơn mh nghĩ son xinh giá rẻ hehe winking_face nên mua nha mng chất đẹp nửa smiling_face_with_hearts,2
xinh phù_hợp túi_tiền đẹp giao hàng nhanh dù dịch nên mua nhé ạ,2
đẹp son thơm đóng_gói cẩn_thận và đẹp rất đáng tiền trong mùa dịch giãn cách nhưng giao rất nhanh nha mng,2
săn sale thì giá khá hời so với mua các shop bên ngoài shope mal nữa nên cũng yên_tâm thấy mn rv em này nhiều nên mua thử để giành tết mới sài nên kh có ảnh swatch em nghĩ shop nên đổi đvc smiling_face_with_tear,2
oke nè son rẻ mà mướt nhưng không đúng màu cho lắm,2
chất_lượng sản_phẩm tuyệt_vời đóng hàng đẹp nhanh gọn hàng mua 17 k nên dùng cũng chỉ tương_xứng thôi,2
giao hàng khá nhanh với giá này son ok lắm luôn không hiểu sai rẻ vaạyj kakakak,2
son rất đẹp nha mng mình mua đc với giá 1 k quá đỉnh luôn mng nên mua mha,2
son xinh xỉu huhu màu 01 đỉnh lắm mí bà ui mà giá siu rẻ lun,2
chịu nói_chung rẻ nên chất_lượng như_thế hm zậy đó,2
cảm_quan mọi thứ nhìn đều rất xịn xò mặc_dù giá rất mềm tuy_nhiên son khá hôi và mùi rất khó_chịu,2
chất_lượng khỏi bàn quá xịn đáng đồng_tiền nên mua mặc_dù còn một_vài lỗi,2
son lên màu khá rõ nhưng ko đc lì giao hàng khá chậm ko biết son lần này ntn nhưng lần trc mik mua là son mẹ hỏng hết bên trong màu đánh mãi ms lên vẫn phải chấp_nhận vì giá rẻ chỉ đc v thui,2
màu ổn đánh khô môi giao hàng nhanh giá hợp,2
chất son kem nhẹ rất dễ sử_dụng hằng ngày 2 cây 9 k thiết_kế cũng dễ_thương đáng mua,2
chất_lượng sản_phẩm tuyệt_vời rất đáng tiền có điều giao hàng hơi lâu,2
son màu i như hình không khác gì luôn í mịn nữa không bị nặng môi như mấy son kem khác mình dùng mình mua thử làm son base thôi mà với giá với chất_lượng như này lần sau mình sẽ thử màu khác son thơm mùi socola v,2
đẹp lắm nha đóng_gói kĩ_càng sản_phẩm chất_lượng tốt giá_cả hợp_lý nên mua nha các bạn ghost beating_heart,2
son rẻ mà thơm lắm í nên mua thử dùng nha bảng_màu đẹpo,2
săn sale được giá này rất okela luôn hàng quốc_tế nên giao hành hơi lâu thôi à,2
rất đáng tiền shop phục_vụ rất tốt đóng_gói sản_phẩm rất đẹp và chắc_chắn,2
hàng giao khá nhanh đóng_gói cẩn_thận và chắc_chắn khi check mã_vạch thì_ra 160 k và chưa được kiểm_chứng,1
son mềm môi màu đẹp chuẩn chất_lượng tốt phù_hợp giá tiền hợp_lý,2
giao hàng ok chất son cũg ok giá ổn nói_chung hàng chất lượg,2
son xinh kinh_khủng ý vỏ đẹp giá rẻ ở nước_ngoài mà giao hàng rất nhanh màu son cũng siêu xinh lun đc dịp mua sale quá hời,2
son thơm mùi socola mặc_dù hơi khô nhưng chất vẫn mịn và xứng_đáng với giá tiền,2
màu đẹp xỉu luôn ấy mng nhất là màu 942 son một lần lấy ra khá là nhiều đủ tô cả môi chất son mướt không gây nặng môi với giá sale mình mua được thì quá ổn luôn,2
săn dc sale kiki màu này lúc đỏ lúc đỏ hồng lúc có tí tím lúc màu mận mận chả biết nao nma thích chất son_dưỡng môi bôi okela nma son tràn lên quá nhiều với 1 đứa thích son sạch như m thì đây là sự đau_đớn smiling_face_with_tear,2
chất son mịn màu đẹp giá rẻ ship hơi lâu thui ncl rcm mua ha 2 màu này tây xỉu i laik it,2
son hơi khô chất_lượng so vs giá_thành sale nên ko đòi_hỏi nhiều,2
son đẹp mà giao nhanh lắm săn sale 12 12 mà 3 ngày sau đã về rùi chất son đẹp và thơm lắm lun,2
ui rẻ mà đẹp lắm mn ơi son mịn dã_man luôn í_shop mãi đỉnh hihi,2
giao hàng nhanh so với quốc_tế tầm 1 tuần là có canh sale nên giá mềm sẽ ủng_hộ tiếp,2
cây son nhỏ hơn mình nghĩ mùi son hơi hắc nhưng cững_hợp với giá tiền giap đúng hàng vì là hàng quốc_tế nên về hơi lâu nói_chung là được son mịn mượt,2
son xinh lắm nha mua tận 4 cây là chỉ 157 k mà chất mịn son mùi thơm nữa winking_face,2
son rất chi là khô môi ạ son lên sẽ thấy rất rõ các nếp nhăn của môi khó tán cho đều màu son cầm nhẹ_tay nè nên làm ta cảm_giác rất là rẻ_tiền mà đúng là nó rẻ thiệt đóng_gói thì rất chi là sơ_sài ai thích tốn tiền thì mua nha,2
chưa đến 10 k 1 e son nghe bạn review dùng đẹp và lì lắm ạ,2
giao hàng nhanh gói hàng kĩ son chất_lượng và rẻ có deal nên đc giảm nhiều 3,2
shop giao hàng khá lâu shiper không nhiệt_tình cho lắm ạ sản_phẩm lên màu đẹp phù_hợp giá tiền đánh lên môi hơi khô,2
son thơm chất son mịn lắm ạ đóng_gói cực_kì chắc_chắn giao hàng nhanh rất đáng đồng_tiền,2
giao hàng hơi lâu chút còn lại thì rất ok siêu đẹp và phù_hợp giá tiền,2
kết_cấu xịn xò độ bền_màu màu lên chuẩn công_dụng mềm mịn hình_ảnh không liên_quan màu son mềm mịn so với giá,2
công_dụng son màu xinh phù_hợp nhiều loại da hén giá ổn_áp kết_cấu mềm mượt đánh son_dưỡng gồi thêm son này thì môi mềm mịn lắm hen độ bền_màu 6 5 10 nhưng mình thích vì nó hông quá lì mùi son thơm nhẹ mlem mlem,2
ảnh và video tính_chất nhận xu son giao đúng mẩu màu đẹp giao nhanh giá hop lí lần sau se ủng_hộ shop,2
công_dụng son kết_cấu thỏi độ bền_màu thumbs_up quá là thích so với số tiền mà mình bỏ ra hài_lòng lắm luôn í purple_heart,2
