processed_data,target
đây là màu son của hãng nha cả nhà mịn không khô đâu nma k lì huhu hun cái là bay hết,0
son xinh vl mùi gần giống mùi cam son lì màu son đẹp ưng lắm lun,2
độ bền_màu độ bền cx rất oki nha son chất_lượng rất oki luôn lại còn có mùi thơm nx nên mua nha mọi người,2
son mềm mịn mà lì lắm nha đã mua và nghiện luôn màu son đẹp rất nên mua,2
vỏ son đẹp chất son quá tuyệt mịn có độ_ẩm cho môi lên màu đẹp trôi son sẽ có lớp son lì cho shop 5 sao,0
chất son mềm màu lên chuẩn đều màu độ bám k lâu lắm nói_chung khá thích,0
mình đặt 402_shop giao 404 mà cái màu 404 nó đúng nâu đất rất ít cam nên nhìn khá già nhưng đc cái k xỉn da vẫn trôi son bt nha mng mua trải_nghiệm thui chứ thực_ra mức giá này k trông_đợi nhiều,0
cũng đc chất son ko lì lắm nhanh trôi,0
công_dụng de son dep nha mn mua ik mua ik ahihi kết_cấu min độ bền_màu bam mau lau sắp tết r mn mua đi nha,2
shop giao hàng nhanh chất_lượng lắm mọi ng ạ son thì theo mình ko lì lắm nhưng màu rất ok còn được tặng quà sẽ ủng_hộ dài_dài,0
công_dụng son màu nude đẹp kết_cấu chất kem xốp dễ đánh_hơi khô môi độ bền_màu rất dễ trôi với giá_thành như_vậy thì chất_lượng vầy là quá ổn mặc_dù dễ trôi với hơi khô môi nhưng màu lên giống với hình,0
màu siêu siêu xinh mình dùng thấy tương_đối lì nhưng mà vẫn bị lộ vân môi nhé màu 502 giống màu cam hồng_đào ấy phù_hợp make nhẹ_nhàng hoặc đi học cũng oke về mùi thì mình nhận_xét giống gói trà đào,2
công_dụng làm đẹp kết_cấu dạng thỏi độ bền_màu cũng được,2
công_dụng sáng da độ bền_màu rất ok nghe mùi dễ_chịu mùa son đẹp dùng rất thích nên mua nha mn,2
công_dụng tô son nha kết_cấu đẹp độ bền_màu dễ trôi tông màu ổn g giao hàng nhanh đúng sản_phẩm,0
giao hàng quá nhanh luôn á chất son mình thấy cũng không lì cho mấy mà màu thì đỉnh,0
công_dụng son môi kết cấu dạng kem độ bền_màu 1 2 h màu son đẹp ko bị khô môi video mang tính_chất lấy xu,1
son đã thêm nhiều dưỡng hơn rồi nè lên môi mịn mướt hơn hẳn những đợt trước mùi thơm nhẹ trôi khá nhanh,0
son chất mịn ko phải son lì nên lau xíu là trôi hết nhưng giá này đc cây son vậy thì tuyệt_vời red_heart,0
màu son khá xinh độ bám màu cũng lâu giá_cả lại hợp_lý very god thumbs_up,2
26 ngày mới nhận được hàng đợt trước đặt thì nhanh lắm màu đỏ thì sài đc còn loại cam mua về cũng vứt sài màu xấu quá son nhanh trôi,0
đẹp lắm nha màu đẹp mà rẻ nữa son k lì lắm giao hàng hơi lâu xíu,0
công_dụng rất xinh độ bền_màu rất tốt lần sau sẽ tiếp_tục ủng_hộ shop son rất xinh màu rất đẹp,2
hơi bột bám màu kém nhưng màu đẹp giá này,0
độ bền_màu bthg công_dụng đẹp kết_cấu mịn son lên môi đẹp mềm mịn chất_lượng sản_phẩm tuyệt_vời,1
chat luong san pham tot mùi son thơm khá lỳ ủng_hộ shop,2
công_dụng thơm kiểu sôcôla á kết_cấu mịn độ bền_màu không bền,0
chất_lượng tốt chất son nhẹ lâu trôi không khô nứt môi rấ đáng mua,2
son thơm chất son mềm lì môi đánh rất thích giao hàng nhanh,2
ở ngoài màu đậm hơn cam đất_son thơm chất dùng mượt ok hơi lì,2
son mùi nhẹ đánh lên mịn nhưng m tháy k lì lắm hợp vs giá tiền nha mọi người red_heart,0
shop giao hàng nhanh chất son rất lỳ lâu trôi mình lấy nước rửa rửa cũng mãi mới sạch nên mua nhé mọi ng,2
công_dụng đẹp kết_cấu mịn độ bền_màu chưa biết vận_chuyển nhanh sang xịn mịn lắm ạ sẽ ủng_hộ dài_dài,1
giao hàng nhanh đóng gói đẹp màu son k hợp bằng thỏi cũ màu 24 mà thỏi son lần này cảm_giác k lì lắm nhanh trôi hơn hẳn thổ cũ từ năm_ngoái đeo khẩu_trang bỏ ra trôi gần hết,0
công_dụng len mau dep kết_cấu kem độ bền_màu lau troi son cầm chắc tay màu lên đẹp lâu trôi nên mua,2
son đẹp mềm min có điều không lì nha son lên cái là bay liền à,0
son nhung lỳ lên màu đẹp giao hàng nhanh chất_lượng tuyệt_vời mẫu đẹp jzjshsh jshshdb,2
công_dụng làm đẹp kết_cấu hoàn_chỉnh độ bền_màu khá tốt mình thích nhất mùi son rất là thơm luôn ý,2
công_dụng son mịn đẹp kết_cấu vỏ chắc_chắn rất là xịn luôn nha độ bền_màu bám màu rất ok son mướt săn sale giá quá hời luôn,2
công_dụng trang_điểm kết_cấu đẹp độ bền_màu tôtd với giá tiền siêu uư đãi này mà có_thể có cây son chất_lượng đáng chú_ý như vậy đồ bền_màu lâu màu lên rất đẹp dễ đánh lên môi,2
công_dụng ok kết_cấu nhìn cute độ bền_màu 90 sản_phẩm oki hơi đậm giao hàng siu nhanh_shop dễ_thương nhiệt_tình,2
son lên màu đẹp nhưng mà rất dễ trôi làm nền thjf được xong phải dặm lại lớp son sáp hoặc son kem lì chứ k là nó bị trôi hết chì ok nma màu,0
màu xinh rất rất đệp ạ lọ nhỏ nhưng sang sịn đánh lên môi thì nghe mùi thơm thoảng của socola gất bền_màu và lâu trôi mua ở shop mail nên cũng an_tâm nói_chung là đáng tiền thích lắm ạ,2
son xinh lắm ạ màu đẹp xỉu luon theo mình thì son không được lì lắm nói_chung sản_phẩm cũng oke,0
son lên màu đẹp lỳ lâu trôi nói_chung là rất đáng tiền thích lắm,2
son lì màu đẹp giao hàng nhanh rất đang mua đóg gói kỹ ok,2
son xịn hịn lun á màu ưng_ý cực_kì test lên môi ko bị trôi vs cả mềm lắm lắm,2
lần thứ 2 mua lại son rồi chất_lượng ok lắm màu xinh son lì,2
son lì màu đẹp như hình chất kem hơi đặc một xíu hàng gói rất kĩ,2
hình_ảnh không liên_quan đến sản_phẩm nhưng chất_lượng sản_phẩm tốt son đẹp lì giao hàng nhanh,2
son xịn lắm mng ạ màu 25 này xinh xỉu đánh 2 năm rồi không có ý_định đổi thực_sự ý mà cũng khá lâu trôi nữa ncl okla cảm_ơn shop nhiều neè 3 lấy tạm ảnh thui nha mng,2
kết_cấu ok độ bền_màu tot màu son đẹp mãi đỉnh giao hàng rất nhanh shop trả_lời nhiệt_tình sẽ còn ủng_hộ,2
son lì mịn màu đẹp ạ smiling_face_with_heart eyes aw,2
công_dụng son la de danh chu lam gi kết_cấu son kem độ bền_màu dc son lì nhẹ dễ dùng mùi ổn tuy_nhiên nó tươi hơn mình tưởng kiểu trên anh cam đất vè cam cháy,2
hàng rất là đẹp son lỳ mua chơi chơi nhưng mà đẹp quá mọi người nên ủng_hộ shop nha_shop rất dễ_thương xinh xỉu luôn á mình sẽ ủng_hộ shop dài_lâu vì sản_phẩm rất tốt lần nào đặt cũng như ý hết smiling_face_with_heart eyes,2
giao hàng nhanh son cực xinh_xẻo không bị khô môi có mã check nói_chung là nên mua nha cả nhà son không lì lắm nhưng vẫn cứ là ok la mua 2 cây được tặng 1 mặt_nạ nữa nè 3,2
son khá đẹp lâu troiship nhanh đóng_gói cẩn_thận,2
son lì màu đẹp mua thì mua không phí tiền đâu mà lo hehe,2
công_dụng ad kết_cấu li_độ bền_màu xinh,1
son siêu xinh luôn smiling_face_with_heart eyes không ngờ giá rẻ vậy_mà cũng khá lì và lên màu cũng đẹp lắm luôn,2
công_dụng son môi kết cấu dạng son kem màu 25_độ bền_màu 3 4 tiếng mùi thơm giao hàng nhanh rất ok màu đúng theo yêu_cầu oki sẽ ủng_hộ lần sau,2
màu đẹp mịn k lỳ mấy nc giá rẻ thì đi đôi vs chất_lượng,0
son mịn đẹp khá lỳ thơm chất khá ổn nên mua hihiji,2
son y hình nhưng ko lì_shop đóng hàng cẩn_thận anh shiper thân_thiện,0
mua lần 2 roi lần đầu son chất ko lì lần này cũng hơi lì nói_chung chất son ok ưng nhé,2
son đánh lên ok chất nhanh trôi nha ảnh minh_họa thui âj tạo khối ok nhưng hàng bị lỗi,0
công_dụng khá đẹp kết_cấu son nhẹ môi nhưng khá khô độ bền_màu mình thấy son k bám mấy khá dễ trôi không giống tượng hổ_mang vẻ hững_hờ ở bạc_liêu cũng không giống những chú hổ trông có_vẻ ốm đói ở phú thọ gần đây cộng_đồng mạng đang hết lời khen_ngợi cho tượng hổ tại thái_nguyên tượng hai linh vật hổ một con đứng một con nằm với dáng_điệu khoan_thai hiền_hòa nhưng cũng không mất sự oa,0
độ bền_màu tuong doisdw sản_phẩm sao cũng khá nhanh mình nhỏ thái_bình đặt từ 1 1 đến 7 1 là nhận được hàng như vậy cũng nhanh rồi sản_phẩm đóng_gói khá là chắc_chắn có tem mác đầy_đủ son cầm khá nặng_tay bôi lên môi thì không còn được như ý thích mi muốn nữa nhưng khá là đẹp son chắc là hàng chính hãng đặc_biệt mùi rất thơm,1
đẹp lắm không lem không chôi nên mua mọi người ạ grinning_squinting_face,2
son đẹp mềm như nhung nhưng màu ko giữ đc lâu giá rẻ thỏi son cầm chắc_chắn sang chảnh màu xinh,0
son xinh lắm mn ơi có điều giao hàng hơi lâu chút thơm nữa son k đc lì lắm bao h mk sẽ ghé shop mua số hình_ảnh k liên_quan lắm mang tính_chất nhận su grinning_face_with_sweat red_heart,0
son mới cảm_nhân thì mình thấy son lỏng cực đánh lên thì màu hơi đậm mặc_dù mình chỉ đánh 1 lớp mỏng son rất lì lun hợp cho mấy dịp đi tiệc thui nha còn mấy bạn hs sv thì nên chọn màu trông đỏ tươi hơn xíu để khi nhận hàng thì màu lên sẽ đẹp hơn nhìu,2
công_dụng son kết_cấu ok độ bền_màu ok màu này hơi ngả cảm vỏ ngoài ọp_ẹp nhưng cũng ok mùi hơi khó_chịu nhưng chất son ổn hơi khó tán,2
công_dụng sang moi kết_cấu dep độ bền_màu ben độ lì của son thích màu son thơm lắm mình thích màu này và hàng chuẩn,2
công_dụng tốt kết_cấu tốt độ bền_màu tốt ok giao đủ hàng đóng_gói cẩn_thận nhưng về hơi lâu,2
giá rẻ son mịn môi không lì lâu màu son sáng da hợp trend hàng giao cẩn_thận,0
giao hàng trong thời_gian covid nhưng cg k quá chậm chất son hơi lỳ m thấy son khá thơm hơi giống mùi bánh_trung_thu dẻo ấy màu lên chuẩn xinh lắm ấy sẽ mua lại lần nữa mua hôm sale nên giá rẻ cực đóng_gói cg rất kỹ và hộp k bị móp méo,2
công_dụng mau len dung voi hinh kết_cấu chat son min khong qua kho hay li_độ bền_màu binh thuong,1
công_dụng làm đẹp kết_cấu son lỳ độ bền_màu 8 10 mình chưa test cây này nên mình cho nhiu đây điểm vì vỏ đẹp son có mùi thơm kiểu gì ấy hơi khó tả nhưng chất son mịn mượt dễ tán bặm bặm 2 lần là oki đẹp,2
công_dụng làm đẹp kết_cấu đẹp độ bền_màu khá nhanh trôi chất son hơi bột đi nhma son thơm mùi socola lắm nch với giá này thì đáng mua nha,0
son đẹp khá lì màu ok giá rẻ mà chất_lượng giao hàng hơi lâu xíu,2
son bám rất chắc,2
son lì đánh lên môi ok nhưng cũng mau trôi màu đẹp dính nước lấy tay lau cũng hết,0
son mùi hơi hắc chất vừa hơi đặc khó tán 1 xí màu lên xinh_đẹp son lì bạn nào thích son lì thì mua hợp,2
thời_gian giao hơi lâu giá hợp_lý màu son đẹp tuy ko lì lắm,0
công_dụng son moi kết_cấu kem độ bền_màu ok chất_lượng tuyệt_vời son mịn,2
mình thích màu này cực luôn ấy chưa thấy dòng nào có màu giống vậy màu kiểu cam cam nâu_nâu í mọi người không cam quá đâu nha mlb hợp đi học kinh luôn í mỗi tội nhanh trôi hơi chán ew nhưng mà thích là nhích đi mọi người ơi partying_face,0
son đẹp nhưng dễ trôi đúng màu ㅋ,0
độ bền_màu lâu trôi son màu hơi bị đỉnh luôn hihi gần tết nên giao hàng hơi lâu,2
công_dụng tốt kết_cấu đẹp độ bền_màu tốt star struck birthday_cake star struck,2
công_dụng ok kết_cấu đẹp độ bền_màu ok mùi thơm chất son mịn,2
màu thì giống hình nhưng cảm_giác chất son k dc mướt lắm hơi khô môi son bám màu lâu,2
công_dụng làm đẹp son lì lắm luôn bóc hộp ra cũng sang phết mỗi tội giao hàng hơi lâu còn đâu chất_lượng thì tuyệt_vời,2
vỏ hơi bé màu xinh lên môi cũng xinh sau khi test lên tay mình tẩy_trang chà mạnh mới sạch,2
son xinh đợi hàng khá lâu chất son lì mùi thơm,2
son cực lì và màu đẹp giá rẻ,2
đóng gói cẩn_thận sản_phẩm rất ok so với giá tiền son môi nhanh ko sao,0
công_dụng phù_hợp với son hàng ngày không make up kết_cấu chất kem mịn tuy_nhiên dễ lem độ bền_màu ổn son lên màu đẹp sáng da thiên cam mềm mịn không bị khô gây bong_da lúc đánh lên dễ lem nhưng mà lấy giấy bặm sơ để lấy bớt son ra là được ổn với mức giá,2
son đẹp mịn môi khá lì giá quá iu hihihi sẽ ủng_hộ lâu_dài,2
độ bền_màu ăn đồ dầu_mỡ thì trôi nhanh k là giữ đc 4 5 tiếng,1
theo mình thấy thì son hơi nhỏ trên ảnh là màu đỏ nâu nma đánh lên thấy hơi tông cam cam 1 chút k giữ dc màu lâu và son hơi bóng với giá này thì cũng ổn mỗi tội giao hàng siêu lâu tầm 9 ngày mới có,0
dùng thích màu lên lì đẹp hương hơi kén 1 xíu xíu tạm,2
độ bền_màu 2 4 h công_dụng son kết_cấu kem son oke lắm luôn ạ mềm môi giữ màu cũm tạm ổn nha,2
hình_ảnh mang tính_chất nhận xu son hơi hắc k đc thơm nhưng màu đẹp lì,2
màu này đẹp nhé vỏ đẹp nó k phải son lì nên k có độ bám đâu ăn ún xong trôi hết nhưng mà lên môi màu đẹp xs OK_hand son k mùi sẽ quay lại ủng_hộ shop tiếp lần sau,0
son bị trôi ok,0
son bôi lên ko bị khô môi màu dịu ko có mùi khó_chịu như mn nhận_xét tuy_nhiên trôi nhanh với ko tán đều màu đc,0
son oke mn nên mua màu đẹp mê_li son lì bình_thường nhưnh nhấn_mạnh là màu rất đẹp nha,2
son thơm mùi dễ_chịu mịn và lén màu rất đẹp son lì thật_sự kh thấm nước mình đặt 1 cây mà shop giao về 2 cây luôn,2
kết_cấu cx duoc độ bền_màu màu đẹp lắm íum này tui mua giùm bạn nênko biết đánh_giá sao cho hợp_lí nhma màu xinh vs đẹp lắm ấy ko đậm quá,1
son đẹp ạ lì lâu trôi lắm luôn nhưng kh có mùi thơm đâu ạ ai thích son mùi thơm thì nên cân_nhắc nha,2
son nhỏ gọn xinh lắm màu lên đều và mịn chất kem đặc có mùi giống socola_shop k lì lắm chùi thì vẫn ra bthuong lớp base xinh lắm nha,0
màu đẹp màu ở ngoài nâu hơn trên ảnh thích_hợp makeup hơn mặt mộc vỏ son nhám son khá lì mịn môi tùy theo sắc môi sẽ lên nâu nhiều hay ít giao hàng nhanh,2
công_dụng màu_sắc ok lên đúng màu hợp vs da trắng hơn kết_cấu mịn độ bền_màu khá là trôi,0
kết_cấu son bia last velvet lip tint là chất son tint kết_hợp son kem bền_màu bám chặt lên môi lên màu chuẩn sắc khi thoa lên môi mướt mịn như nhung không bị vón cục và dễ_dàng tán đều sau khi ăn_uống nhẹ sẽ để lại lớp tint màu trên môi,2
công_dụng son môi kết_cấu chất son mau trôi cảm_giác như fake vậy độ bền_màu màu lên tay đẹp mà lên môi xấu chắc tùy cơ_địa môi nữa giao hàng lâu chắc do dịch màu son lển môi k đẹp như hình,1
màu son giống với màu mà hãng giới_thiệu smiling_face_with_hearts chất son lì không quá khô môi nhưng mà mỗi lần lấy son thì lượng son dính trên cọ hơi nhiều mong hãng sẽ khắc_phục,2
son lên màu khá rõ nhưng ko đc lì giao hàng khá chậm ko biết son lần này ntn nhưng lần trc mik mua là son mẹ hỏng hết bên trong màu đánh mãi ms lên vẫn phải chấp_nhận vì giá rẻ chỉ đc v thui,0
đóng gói cẩn_thận thời_gian giao hàng lâu màu son đẹp mềm mịn môi nhưng k lì,0
công_dụng son moi kết_cấu tốt độ bền_màu 5 tieng sản_phẩm chính hãng giao hàng nhanhn lắm luôn dzj,2
chất bia đẹp khỏi bàn òi cũng lâu trôi nữa hihi nên mua lắm nha,2
son xinh màu xinh dễ đánh lâu trôi hình_ảnh chỉ mang tính_chất nhận xu,2
giao hàng nhanh đóng_gói cẩn_thận vỏ sơn xinh_xắn nhưng cầm khá nhẹ_tay màu son đẹp và sáng hơn trong ảnh k biết có nhanh trôi k nữa,1
kết_cấu chất son hơi lỏng hơn mình nghĩ độ bền_màu màu lên đẹp không bị rít môi nên mua nha mọi người,1
son nhỏ xinh giao hàng hơi lâu chất son mềm mịn k giữ đc màu lâu,0
công_dụng son môi kết_cấu son kem độ bền_màu tạm ổn 6 10 màu đẹp thơm mùi trái_cây giao hàng nhanh_shop tư_vấn nhiệt_tình,2
son hot lâu rồi mà h mới biết và mua đây cũng là lần đầu mua shope mal lun nhưng tin_tưởng lắm giao hàng nhanh son đẹp thật mền mịn chỉ là buồn vì ko đc lì nhưng review ko biết tại môi mình hay_sao relieved_face thinking_face,0
công_dụng hsw kết_cấu bkd độ bền_màu 8 10 đóng_gói tốt chất_lượng tốt màu đẹp rất tôn da mấy bạn da ngăm nên thử mình mua màu 905,2
hình_ảnh mang tính_chất nhận xu son đẹp dễ dánh bền_màu nhé mn,2
công_dụng tốt kết_cấu mịn độ bền_màu tốt son lên màu rất đẹp son mịn hơi dễ trôi_shop nhiệt_tình giao hàng nhanh,1
son cầm chắc tay hơi lì thôi chứ k lì lắm màu đẹp uống nc k bị dính son ra ly tách đóng gói đẹp và kỹ có túi chống sốc nói_chung là ổn,1
giao hàng nhanh vỏ cực đẹp nha nhìn sang lắm luôn màu lên ưng_ý quá tr độ lì thì thôi khỏi bàn r,2
son lên màu đẹp k bị khô bền_màu hình_ảnh và video chỉ mang tính_chất nhận xu,2
công_dụng ok kết_cấu ok độ bền_màu ok nha ok nha mọi ngươ i mă c du lâ n đâ u mua ơ shop,2
công_dụng son môi kết_cấu chưa sử_dụng độ bền_màu chưa sử_dụng đóng_gói cẩn_thận chắc chắc có giấy_bóng chống xốc,1
công_dụng 10 10 kết_cấu 10 10 độ bền_màu 9 10 hàng xinh đóng_gói chắc_chắn ukla nè thumbs_up_light_skin_tone,2
son thơm chất son lì nhưng cũng để lại vân môi hình_ảnh mang tính tượng_trưng,2
son màu đẹp thơm mùi socola nó cx lì lắm luôn á son đẹp nhma giao hàng lâu quá đặt từ mùng 1 mà mãi 14 ms đc nhận hàng,2
chưa đến 10 k 1 e son nghe bạn review dùng đẹp và lì lắm ạ,2
công_dụng gút chóp kết_cấu mượt độ bền_màu chưa rõ lắm giao hàng nhanh màu god mịn xịn,1
dịch nên đặt_hàng cả tháng mới nhận đc lúc đánh lên môi thì k đc như kỳ_vọng chất son lỳ nhưng màu đánh lên_hơi xỉn da base hồng nhiều bạn nào da ngăm nên cân_nhắc nha,2
màu son khá ổn có_vẻ dễ trôi được tặng kèm chiếc lip brush nhỏ xinh red_heart,0
son thơm giao hàng nhanh màu đẹp đánh mịn hơi dễ trôi nma nchung 10 đ pleading_face,0
công_dụng lam dep moi độ bền_màu lau son thơm xỉu dùng rất thích mỗi tội hơi đậm ạ,2
kết_cấu xịn xò độ bền_màu màu lên chuẩn công_dụng mềm mịn hình_ảnh không liên_quan màu son mềm mịn so với giá,1
màu son đẹp mùi thơm lắm chùi khó ra nhm uống nước thì bị dính son xíu th chứ khó trôi,2
công_dụng son màu xinh phù_hợp nhiều loại da hén giá ổn_áp kết_cấu mềm mượt đánh son_dưỡng gồi thêm son này thì môi mềm mịn lắm hen độ bền_màu 6 5 10 nhưng mình thích vì nó hông quá lì mùi son thơm nhẹ mlem mlem,2
màu son khá đẹp son rất thơm và rất dễ tán nhưng không được lì cho lắm,0
video không liên_quan nhưng son xinh lắm chất lỳ lâu trôi,2
công_dụng son kết_cấu thỏi độ bền_màu thumbs_up quá là thích so với số tiền mà mình bỏ ra hài_lòng lắm luôn í purple_heart,2
màu đẹp nhưng mà chất son cảm_giác bị bột bột nhanh trôi vỏ son dễ bị bám bẩn cây son cầm nhẹ quá nên cảm_giác không chắc_chắn lắm nhưng so với giá tiền thì cũng okeoke,0
giao hàng nhanh đóng_gói chắc_chắn lên màu đẹp nhưng chưa kiểm_tra được độ lỳ của sản_phẩm,1
công_dụng đẹp kết_cấu khom bic độ bền_màu lâu trôi son đẹp đánh lên ok lắm nha dễ tán không bị khô môi,2
dễ trôi màu không giống lắm giao hàng hơi lâu hơn bình_thường,0
sản_phẩm xinh_xắn son thơm nhưng nhanh trôi màu giao hàng nhanh đóng_gói cẩn_thận,0
sp đẹp phù_hợp với giá tiền màu đẹp lì giao hàng nhanh mọi người nên mua ạ,2
son smoth lắm nhưng không lì cho lắm nhìn thỏi son nó sang chảnh làm_sao star struck,0
màu đỏ cam cực_kì hợp với mình son kem nên dễ thoa khá bền_màu ăn bất_chấp ko trồi,2
màu siu đẹp luôn í đánh bám môi lắm ncl nên mua nha mng ơi,2
kết_cấu mịn độ bền_màu 1 5 2 tiếng chất_lượng tuyệt_vời hình_ảnh ko liên_quan,1
độ bền_màu 03 son mèm mịn lắm ạ quốc_tế nhưng giao hàng rất nhanh săn sale nên giá cũn rẻ lắm nhé mn nên mua 1 em xài,1
công_dụng đẹp môi kết_cấu lỏng độ bền_màu tốt lên màu khá đẹp giao không nhanh lắm được cái shiper thân_thiện mùi không thơm nhưng hàng chuẩn,2
sản_phẩm đẹp nha mọi người chất_lượng đe0j và đúng hàng nha rất mướt môi và ko lỳ đâu nha,0
công_dụng rất tuyệt kết_cấu đặt thơm độ bền_màu màu đẹp son đẹp thơm mùi kẹo_nha giao lâu xĩu lun,1
công_dụng tốt kết_cấu mềm mịn độ bền_màu ổn màu lên ổn nha mn đán mua d d d d d f f f r rjr v,2
công_dụng danh len moi kết_cấu dep độ bền_màu dep iaisnw ậnkan,2
rất thất_vọng màu hồng đất nhưng lên môi mình lại là hồng cánh sen ánh tím chắc do sắc_tố môi của mình coi như bỏ luôn cây son bạn nào muốn mua thì mình pas lại nhé chất son mịn thơm dễ trôi không hề lỳ miếng nào luôn vỏ hộp có tem chống giả vỏ son đẹp bóng bóng giao hàng hơi lâu,0
son lì màu lắm á ý là chưa có lên môi thử chỉ lên tay thoi mà chùi rửa nước vẫn còn luôn á màu đẹp lắm hình_ảnh mang tính_chất nhận xu hoi nha,2
độ bền_màu khá lâu công_dụng son kem kết_cấu dạng lỏng son kem màu rất xinh bao_bì son nhìn cute lắm rất phù_hợp với giá tiền shiper thì cute mình đặt sát tết sợ không về kịp ai_ngờ gần 10 ngày là về ncl rất ưng nên mua nha,2
chất son đẹp cầm tay rất chắc_chắn lên màu mịn_màng và không bị trôi,2
đóng gói đẹp son hơi lỏng nhanh trôi,0
màu siêu đẹp nha chất son oke dưỡng môi đầy_đủ sẽ bám rất lâu khg làm khô môi rất đáng để thử ạ,2
công_dụng đánh môi kết cấu đẹp độ bền_màu god sp rất tuyệt_vời son rất mịn mùi giá là đc lm winking_face_with_tongue là t bỏ t cx thế_giới_hạn là đc r chiều cao hơn ai hết r đấy là chuyện của mai koa có_thể là có nhưng sợ ế mà không cần phải có người gọi là t bỏ t đi ngủ đây mãi à ko biết có phải là do người,2
săn sale nên giá rẻ son nhỏ hơn mình nghĩ chất son mềm nhẹ môi nhưng lâu trôi lắm tẩy_trang muốn lên cơ_mà k hết,2
son nhỏ chất kem tạm ổn nhanh trôi màu hồng hơi kén da phù_hợp với giá tiền,0
công_dụng kết_cấu độ bền_màu x màu lên cũng tươi chất_lượng ổn_áp chưa dùng nên cũng chưa đánh_giá được nhiều,1
mê từ vỏ son màu son đến chất son lun á chất son mềm lâu trôi nhưng nên chăm dưỡng môi nha mng màu đỏ cam nâu best seler của bia rùi hem còn gì để chê mùi mình nghĩ là k khó_ngửi chút nào quá là ưng thời_gian giao cx k lâu chút nào mà mình ở ngoài bắc,2
độ bền_màu,1
son gi mà rẻ mà đẹp test thử lên tay thì thấy lì lau mãi không sạch son hơi khô nên dưỡng môi thật căng_mọng rồi hẵn đánh son nhe mn,2
mua lại thỏi thứ 2 dùng rất ok nha son mịn và lì rất đáng mua nha,2
công_dụng môi không bị khô kết_cấu đẹp độ bền_màu lâu son đẹp lắm mọi người tôi mua lần đầu nhưng ưng lắm luôn,2
mùi thơm mướt môi cũng khá lì không ăn_uống chuẩn ok lun,2
