processed_data,target
công_dụng rất đẹp kết_cấu tốt độ bền_màu tốt chất son mịn nhưng không bị khô lâu trôi mình thích mầu số 25 lâu trôi,2
màu lên khá ok son mịn không lì mùi hơi hắc nhưng kh sao nha,0
mình kh ngờ với 20 k có_thể oder được chiếc son sịn sò như vậy màu khá ưng chất son mịn và lì sẽ tiếp_tục ủng_hộ shop lâu_dài broken_heart,2
công_dụng làm đẹp kết_cấu mịn dễ tán độ bền_màu chắc tốt,2
son môi mới nhất của focalure sắp ra_mắt đôi môi quyến_rũ mềm và mịn như nhung son kem dạng nhung lì mới giúp môi bạn trông mơ_màng và mềm như coton khi mới thoa sẽ cảm_giác giống như đất_sét lướt nhẹ sau đó sẽ trở thà giao hàng khá lâu,2
son lì lắm nha son lên cảm_thấy mền môi son thơm oke son thì thơm mùi socola nha money_with_wings,2
đẹp son lì a,2
màu hơi nhạt so với mình tưởng và cũng và trôi hơi nhanh nhưng đang hết tiền mua cây này là chính_đáng á mng ơi kakak two_hearts video và hình_ảnh mang t c lấy xu thoi ạ,0
công_dụng son kết_cấu xốp độ bền_màu kém son màu khá đẹp thích_hợp làm base hoặc sử_dụng bình_thường phù_hợp với da trắng son thơm mùi socola ngọt nhẹ chất son khá bột k bám môi nên dễ trôi và bị lợn_cợn nhưng do giá rẻ nên không đòi_hỏi gì nhiều,0
độ bền_màu ko be đánh nhanh trôi lên màu k đẹp dg thấy bthg,0
đẹp lì nhưng mình mua nhầm thành 2 thỏi huhu nhưng cảm_ơn shop nh,2
son lên màu khá là oce nha kh lì đâu black_heart giao hàng nhanh,0
công_dụng cho môi xinh_xẻo lên nữa kết_cấu k biết tả độ bền_màu màu đẹp mà chạm đâu dính đó son thơm vl luôn tưởng đâu trét lên môi màu đẹp vl biết z sắm 2 thỏi này gòi mà bay_màu lẹ lắm cũng k đòi_hỏi vì đúng giá thôi,0
son đẹp lém lì mịn_màng,2
son màu đẹp dễ trôik,0
dù dịch nhưng giao hàng rất nhanh 2 màu con 502 và 403 mình có test cho bạn nào tham_khảo độ bám màu k được cao mùi cam giác giống mùi cồn 1 chút nói_chung với giá tiền này mà màu son cũng như chất son thì k chê vào đâu đc hồng đất và cam cháy nhé mn,0
mua của shope mal nên khá an_tâm giá siêu rẻ mà son siêu lì nha bao ăn bao uống luôn mình xài nay không biết cây thứ mấy rồi nhưng vẫn rất hài_lòng,2
em này lì nhưng khá là bột nha khi tô lên tay có_vẻ là em khá dễ dùng nhưng lên môi thì có_thể thấy em này sẽ bị nhả ra một_chút vì có silicon không bay_hơi tô lòng môi không đc tô ful môi thì màu này sẽ bị già quá nếu kh makeup nói_chung với giá này thì kh đòi_hỏi gì hơn,2
công_dụng màu son tây kết_cấu son không lì nhiều độ bền_màu nhanh trôi màu son đẹp nhưng ăn_uống rất dễ trôi,0
son đẹp màu xinh son lên mềm môi nhưg dễ trôi thơm giá nv à ốn ạ,0
lì màu xinh lắm,2
son không lì lên màu xấu khó đánh các bạn không nên mua,0
chọn màu lạ nhất mình chưa có nhìn ảnh review là một tone nâu lạnh không pha đỏ hay cam nhưng đánh lên môi mình có chút đỏ nói_chung các tone trầm đều dễ đánh trắng răng và trắng da chất son velvet xốp mịn bám màu tương_đối thơm nhẹ mùi bơ,1
son bột quá hic tô nhạt cũng khá xinh giao hàng nhanh_chóng shiper nhiệt_tình đóng_gói cẩn_thận mỗi tội son bay_màu nhanh quá,0
mình có mua của bạn giá gấp đôi thì cảm_thấy son mua của bạn màu cam hơn khó trôi hơn nhưng vẫn vote 5 sao,2
công_dụng lên màu đẹp kết_cấu tốt chất son mượt độ bền_màu lâu trôi giá rẻ hàng tốt sài rất thích,2
hàng quốc_tế nên giao hơi lâu màu son giống hình có mùi xà khá lì,2
công_dụng son lên màu đẹp kết_cấu khá li_độ bền_màu khá dep d giao hàng nhanh đóng gói hàng cẩn_thận chất_lượng sẽ ủng_hộ nữa ạ,2
công_dụng son môi kết_cấu đóng_gói bao_bì đẹp son lên màu đẹp độ bền_màu son lên màu đẹp đánh son để khô bám lâu,2
sản_phẩm ok lắm nha lì lắm nhưng hơi sai khi chọn màu màu này lên môi tươi lắm nha,2
son đóng_gói kỹ bên ngoài thì xinh_xắn chất thì mềm mịn siêu ưng chỉ là hơi mau trôi xíu thôi,0
màu son không hợp da mình cho lắm mình tông da cũng khá trắng son siêu lì tưởng son nhẹ nhẹ dạng nước mà nó tệp hẳn vào da ngay_lập_tức,2
màu sơn đẹp lắm nha cũng không lì và giữ màu lâu ăn sẽ trôi nhưng được_cái kg bị khô môi đâu mua 2 cây 9 k quá rẻ luôn nước_ngoài nên ship về hơi lâu,0
mình thấy màu giống hình mà makeup lên xinh lắm đó chất son thì miễn bàn trước giờ rất thích chất son của merzy lâu trôi lớp base k bị hồng sến,2
màu đẹp chất son mướt lì mỗi tội oder nhầm vỏ cũ mọi thứ đều perfect trừ cọ tán quá chán luôn,2
công_dụng depjd kết_cấu ok độ bền_màu ok mascara rấc lè xinh luông son mua thỏi t2 ruìu,2
màu 92 rất đẹp nha chất son lỏng nhg đánh lên môi sẽ lì luôn ko bị dính đâu cảm_giác đánh như ko đánh ấy ship trong vòng 1 tuần lúc lấy cọ son ra hơi kẹt thôi còn đâu mình nghĩ ok hundred_points,2
công_dụng son môi kết_cấu kem lì độ bền_màu tốt lên màu chuẩn lắm mng ơi không bị sỉn men răng hay kén da đâu da ngăm hay da_trắng đều dùng được đáng đồng_tiền ghê lun mình được tặng thêm gương lì_xì cute lắm mng nên thoa một lớp son_dưỡng trước khi dùng nhe nên mua nha mng,2
son rất đẹp lâu trôi thiên cam nha_shop đóng_gói có tâm lắm luôn đáng mua,2
độ bền_màu nice công_dụng nice kết_cấu nice son thơm màu đẹp xỉu giá rẻ cực thích mấy mẫu son nội_địa trung,2
màu đẹp nha mọi người mình đã mua 3 cây của hãng này rồi xài son mịn màu đẹp chỉ có là ăn_uống thì cũng mau bị trôi lắm á,0
son chất đẹp khá lì có lớp màu nhẹ sau khi trôi,2
màu 402 với màu 502 mình thấy khá giống nhau cam gạch 402 đậm hơn màu đẹp son hơi dễ trôi nhưng với giá này không yêu_cầu gì nữa,0
do dịch_bệnh nên giao hàng có chút hơi lâu_shop gói hàng cẩn_thận ok chỉ có điều son nhanh trôi ko để đc lâu,0
công_dụng son bôi lên môi khá đẹp có mùi dễ_chịu chất son êm lắm nha dễ tán kết_cấu ổn độ bền_màu chưa đánh_giá được giá cũng rẻ chất_lượng ổn khâu chuẩn_bị hàng của shop khá lâu phải nhắn_tin shop mới đi hàng cho khách mong_shop có_thể cải_thiện,1
xinh lắm luôn ạ trông màu đẹp cute muốn xỉu lại còn mịn và lì nữa,2
mình thích 302 nhưng mà tán khó vì nó quá lì_lì như màu_nước ấy màu 403 tán dễ cũng đẹp nữa giao đủ và đúng hàng nhưng mà có 2 4 gam thôi hơi bé và nhẹ hơn tưởng_tượng,2
công_dụng son lì nâu trôi giao hàng thì hơi lau hình_ảnh mang tính_chất nhận xu,2
mình chưa thử lên môi nhưng quẹt 1 chút ra_tay thì thấy nó lì lắm á qua 1 lần tắm mà vẫn còn thấy vết son thấy review tốt nên mua về xài thử chứ chưa xài đồ của hãng bao_giờ nếu tốt mình chắc chắc sẽ đặt thêm video mang tính_chất nhận xu ah,2
màu xinh nhá màu này đánh nhạt cũng xinh mua tặng bạn nên ko chụp hình lại đc nói_chung ok ko có gì chê son chất kem ko khô môi bị cái hay dây ra thành ly cốc nhanh bay_màu,0
shop giao hàng nhanh đúng sản_phẩm hàng chất_lượng màu lên môi đẹp lì lâu trôi ok,2
màu đẹp xỉu up xỉu down nha cả nhà nhưng sớm ko lì dễ trôi nha,0
công_dụng đẹp kết_cấu đẹp thơm độ bền_màu son khá lì kh khô môi son test ra_tay thì rõ ánh cam lắm nma lên môi thì xinh xĩu luôn ra cam đất có điều t kh thích mùi son lắm chắc do quen dùng son thơm như merzy với bg r k khá đáng thử,2
mình thấy son ổn mịn nhưng nó ko có gữi màu tốt lắm kiểu thử tay chùi phát là màu đi rất nhiều so với giá và chất_lượng thì ok mùa đẹp,0
công_dụng đẹp nha gói hàng cẩn_thận kết_cấu ok độ bền_màu ok nên mua nha mn vừa rẻ vừa đẹp ok lắm,2
thấy ghi là siêu lì mà mh thấy nó cũng lì bình_thường à nó k có lì luôn á đánh xong ăn_uống tẹo là k còn cái gì rồi,0
giao hàng lâu vì là tết 3 tuần son có mùi như chocolat ngọt son không lì có nhiều dưỡng,0
công_dụng dep kết_cấu dep độ bền_màu 10 chất_lượng sản_phẩm tuyệt_vời đóng_gói sản_phẩm đẹp và chắc_chắn rất đáng tiền,2
cầm được trên tay mẫu son mình thích thì còn gì bằng ạ tuy_nhiên mình thấy nó nhỏ so với các version cùng dòng trước đó còn độ lỳ để mình test đã,1
sản_phẩm chất_lượng giá_thành rẻ son màu đẹp nhưng mau trôi kẻ mắt xinh nên thử kcm hơi nhạt màu,0
công_dụng làm đẹp kết_cấu chưa test độ bền_màu chưa test bao_bì sp đẹp đóng_gói cẩn_thận giao hàng đúng dự_kiến 5 sao cho sự tin_tưởng mal,1
công_dụng djsj kết_cấu 1 cay son_độ bền_màu nhanh troi son khá nhanh trôi mặc_dù mình tô lâu r nhưng chỉ chạm tay vào là dính son luôn k hài_lòng ở điểm đó,0
son mỏng nhẹ rất đẹp nhưng trôi nhanh ko lì như thông_tin sp để giao hàng rất mua sale giá hời nên ko sao,0
màu đẹp lắm luôn nên mua ạ_shop đóng_gói cẩn_thận chất son mịn đẹp lì,2
đã nhận hàng nhanh son đánh lỳ mua đúng màu iu thích giá rẻ nữa ne smiling_face_with_hearts,2
độ bền_màu bình_luận mang tính_chất nhận xu chất_lượng sản_phẩm tuyệt_vời hàng giao nhanh son đẹp lắm nên mua,1
giao hàng nhanh son cũng đẹp í son ra đẹp lắm hơi khô tí nhưng son lì face_with_tears_of_joy,2
độ bền_màu được tầm 5 6 h ý hàng giao hơi lâu vì do dịch chất cũng khá oki với giá này được son như z là ok r,2
son ok sài ổn màu lên đẹp son mướt mềm nhưng ko lì lắm rẻ nên ko đòi_hỏi j,0
son màu rất đẹp lên môi đúng chuẩn màu son mịn và lâu trôi nữa đẹp,2
đóng gói chắc_chắn son cầm chăc tay màu xinh chat son lỏng bám khá chắc,2
công_dụng son kết_cấu vừa tay độ bền_màu nhanh trôi son chất nhung có mùi socola chocolate_bar màu xinh hình_ảnh mang tính_chất minh_họa,0
công_dụng son kết_cấu lỏng tầm 30 s lì lại lên môi_độ bền_màu độ bền tầm 4 tiếng còn lại lớp tint màu xinh lắm mn ơi nhưng đánh đậm thì hơi già nên đánh nhẹ thoi màu ở ngoài trầm hơn hình một_chút,2
màu son đẹp nhưng mau trôi mùi hương nhẹ do shop ở trung_quốc nên giao hàng lâu face_with_tears_of_joy,0
nhận hàng hơi lâu nhưng bù lại đồ xinh xỉu son chuẩn màu nhưng lì lắm nha mng với hơi khó tán,2
son lên màu đẹp lắm ạ mịn môi nhưng nhanh trôi phù_hợp với giá,0
son lên màu đẹp lâu trôi xjnh xẻo lắm,2
công_dụng ổn kết_cấu đẹp độ bền_màu lâu ok,2
giao hàng lâu nhưng màu khá ưng son không lỳ lắm so với giá_thành thế là ok nên cân_nhắc trước khi mua,0
công_dụng ok độ bền_màu ok màu son 908 khá đẹp lên môi mềm mịn giao hàng từ nước_ngoài nên lâu bọc hàng đóng_gói rất cẩn_thận mọi người nên thử màu_sắc sản_phẩm 901 904 905 906 907 908 909 910 920 92,2
công_dụng lam dep moi kết_cấu tronf độ bền_màu 10 đẹp vãi thơm mùi huhu ncl ưng,2
cũng ổn màu được nma nhanh trôi mấm môi phát trôi nửa môi rồi màu thì đẹp hộp sinh,0
son lên màu hơi đậm so vs mình tưởng_tượng chất son lỳ đặc_trưng của bia và cái mùi đặc_trưng dù mình ko thích lắm giá_cả đáng tiền,2
mình vừa vung tiền qua cửa_sổ son này dùng chơi chơi thui nha chứ đi ăn_uống là k được đâu ạ nhìn màu trên tay thì đẹp mà k bám môi gì hết,0
mua hàng mal nên ko có gì để chê chất_lượng tuyệt_vời màu son đẹp lên chuẩn màu lâu trôi,2
hàng giao nhanh son lì đẹp bọc hàng cẩn_thận,2
công_dụng đẹp tốt kết_cấu ok độ bền_màu tốt mình đặt để đem tặng giáng_sinh mà sinh lâu qá nên thành quà năm mới luôn màu đẹp bên nhg mà bị bết và mùi hơi ghê ảnh ở dưới không phải của mẫu này nha màu đấy mình mua mình tặng nên k chụp đc,2
giao hàng nhanh chất son mịn son thơm thơm nhưng thấy màu 203 không lì dễ trôi chất son mịn,0
kết_cấu mịn độ bền_màu nhanh troi không bám màu son không hề lì nha đánh lên môi khá nhẹ và mịn nhưng mà lau 1 cái là hết_sạch luôn,0
giao hàng lâu quá gói hàng đầy_đủ son này mình dùng mấy cây rồi dễ đánh nhưng cũng dễ trôi vẫn thích vì ko gây khô môi,0
công_dụng đánh lên môi rất đẹp và tuyệt_vời kết_cấu gọn_gàng dễ mang đi ra ngoài độ bền_màu đẹp,1
mua 2 lần rồi ưng giá rẻ chất son ổn nhưng nhanh trôi màu tươi hơn trong ảnh của shop,0
chuẩn_bị hàng nhanh mùi đặc_trưng nếu son hai lần thì sẽ lên màu khá chuẩn còn môi mình thì hầu_như thoa son nào cũng thiên về đỏ hơi hồng khi mới son 1 lần nên cũng quen một nhược_điểm là thiết_kế đầu cọ lấy quá nhiều son son dễ lộ vân môi bù lại khá năng bám của son ở mức trung_bình,1
giao hành khá lâu son đẹp mua 3 lần rồi son êm mướt màu ok không lì lắm,0
mua lần nào cũng thích cái bao_bì nhìn rất sang son đánh lên rất mượt màu lâu trôi,2
son khá đẹp chất son mềm mịn son thơm mùi kẹo son bám k đc lâu mỗi tội mk quét qr k ra,0
công_dụng dễ trôi độ bền_màu ko tốt son có mùi rất nặng và khó_chịu chỉ đc cái vỏ ở ngoài đẹp son lên môi màu ko giống hình ngoài_ra còn rất dễ bị trôi,0
chất son mềm mịn hơi nhanh trôi một xíu mùi cũng khá ghê nhưng lên màu cực đẹp lun í expressionless_face,0
công_dụng làm tôn da kết_cấu chất son mịn độ bền_màu tương_đối ổn đóng gói siêu chắc_chắn son mua lần nào cũng thơm và chất siêu ưng shop còn gửi kèm thiệp rất xinh,2
son kiểu hơi nhung nhung chứ k phải lỳ đâu trước khi đánh son dùng che khuyết_điểm môi sẽ xinh hơn 3,0
mình ưng dã_man màu đẹp lâu trôi mùi thơm kiểu mình thích săn sale nữa nên là qua tuyệt,2
son xinh lắm í dùng thơm cực cũng khá lâu trôi nhưng môi người khi ăn ha uống nước sẽ dễ bị trôi í nên mình nghỉ cái này không lì hihi,0
đánh_giá son giao khá nhanh chất son đẹp lắm mà chưa test nên k rõ lì hay k nữa mình có bán thuốc_nhuộm sỉ lẻ chính hãng alo mình nha k,1
son thơm mùi khá mềm môi lì hay không thì chưa biết,1
son lên màu đẹp chất siêu lì cầm chắc tay thiết_kế chắc_chắn mẫu_mã cute mùi 1 _ như mùi xà_bông nhưng bay nhanh nhưng với cái giá hạt rẻ kia thì nên mua nếu bỏ_qua được mùi son,2
công_dụng làm đẹp kết_cấu đẹp độ bền_màu chua ro giao nhanh mùi son kẹo ngọt rất dễ_chịu với đứa bị viêm mũi như mk thì mùi hắc chịu k đc nhưng e lại khác chất son mượt võ chắc_chắn có team chống giả còn về độ lì thì mk chưa biết k rolling_on_the_floor_laughing quá iêm,1
công_dụng tô son_độ bền_màu 6 10 sản_phẩm đẹp giá rẻ,2
màu son khi mới tô lên nhìn xịn lắm nhưng mà bặm qua giấy cái nhìn màu hơi hồng_hồng ấy theo mình thấy thì màu này không lì lắm mùi son dễ_chịu sẽ còn ủng_hộ shop,0
son đẹp lắm nha mọi người mua ủng_hộ shop đi ạ rẻ bèo đặc_biệt là lâu trôi nữa red_heart,2
công_dụng son kết_cấu đẹp độ bền_màu lì,2
kết_cấu chất son mịn thơm độ bền_màu ko lì lắm,0
kem xịn chất nhung mịn nhưng nhanh troi màu lên rất đẹp luôn lsau sẽ ủng_hộ tiếp hihi,0
tên trong shop thì ghi là son lì nhưng đến khi nhận hàng thì chẳng thấy lì đâu pùn,0
độ bền_màu son dễ trôi đóng_gói sp 10 đ giao hàng 20 ngày mới nhận dc vif cấm biên nên bỏ_qua chất son không mềm mịn và đánh lên môi có bột lamf khô môi màu trên hình và ở ngoài khác nhau hàng sale nên chấp_nhận,0
chất son mịn nhưng dễ trôi havcaha,0
lần đầu dùng cảm_thấy cũng khá oke mà mình thấy son cũng dễ trôi,0
son xinh xỉu lần đầu order thử son trên shope mà ưng thế này son mướt ko bị khô lên màu đẹp lâu trôi đúng dạng kem lì nên mua nhé mn sẽ tiếp_tục ủng_hộ shop,2
kết_cấu son mịn độ bền_màu giữ màu lâu màu ok lắm mọi ng nên thử nhe,2
giao hàng nhanh đóng_gói cẩn_thận màu cũng đx độ lì ko bền mùi son giống kẹo socola mình dùng ko hợp loudly_crying_face tks_shop,0
công_dụng son cũng ok với giá tiền kết_cấu shop gói cẩn_thận đẹp độ bền_màu ok,2
kết_cấu giao hàng nhanh son lên môi mình mướt nhưng chắc làm môi hơi khô lấy giấy lau là trôi hết nha,0
shop làm_ăn kì_cục ghê á son j mà rẻ mà đẹp ri rồi_sao ai mà chịu nổi nhưng có cái trôi hơi nhanh nha mà màu son đỉnh lắm lun,0
giao đủ hàng son vỏ màu tím xanh thơm hơn màu hero màu hero nghe mùi mủ nhựa quá son lì móc khóa dễ_thương star,2
son mua lần thứ n rồi nên không có gì để riview nữa son thơm mịn khá lỳ hơi khó tán chút,2
son hơi khô nếu k dưỡng môi lên màu đẹp chuẩn lâu trôi ăn 2 quả xoài mới trôi clown_face,2
công_dụng son dep kết_cấu tot độ bền_màu tot rất đáng mua màu đẹp lì thì thôi rồi luôn ăn_uống tẹt,2
son mịn lên màu đẹp nhưng bị vón cục không lì lắm đóng gói hàng cẩn_thận,0
màu này đẹp ạ nhưng dễ trôi lắm ý màu 06 tối lắm hic nhưng vẫn ổn_áp nhé hi grinning_squinting_face,0
màu đẹp chất son mịn nhưng nhanh trôi với giá_thành như này là hợp_lý,0
giáo hàng lâu đã man đúng một tháng lận son quảng_cáo lì mà tét thử vào tay lau đc hết,0
công_dụng lam dep kết_cấu sang dep độ bền_màu tốt thơm nên mua nhé mọi ngưòi smiling_face_with_hearts,2
màu kh đẹp kh bền chả ưng tí nào nhưng với giá này thì k đòi_hỏi thêm,0
chưa thoa nên k biết có lâu trôi k hình_ảnh lấy xu,1
công_dụng làm đẹp kết_cấu nắp màu đỏ chai màu trong độ bền_màu ok lắm lấy đồ chà nó sẽ ra chút rất lì lúc thoa ra_tay có cảm_giác chút bột lát lấy tay thoa ra thì chất son đúng đẹp đẹp lắm nha mâyd bồ tg giao hàng trc gần tuần ulatr sợ k có đủ tiền,2
son xịn thoa lên thì mướt môi và màu khá đẹp giữ cũng được khá lâu đấy nếu bạn không ăn gì dầu_mỡ,2
trời ơi son mịn vãi lì săn sale nên có 10 k thoi đó các bác chờ son về lâu quá tới lúc son về rồi hồi_hộp mở ra nên quên chụp cái giá màu đẹp lắm nên mua 2 3 luôn nha mình sợ mua dùng son dỏm nên mua 1 cây thử sài chơi thui ai_dè đẹp thật_sự luôn á ảnh đó là mình chụp đúng màu son ở ngoài luôn á,2
màu xiu đẹp luôn í mềm và cũng khá lì nữa ưng lắm luôn red_heart red_heart red_heart red_heart,2
đóng gói cẩn_thận màu xinh xỉu smiling_face_with_heart eyes chất son hơi bột đánh lên môi cảm_giác mướt ko bị khô tuy_nhiên nhanh trôi nhưng được cái màu ưng là ưng hết red_heart red_heart,0
kết cấu 8 10_độ bền_màu 7 10 son có mùi kẹo nho rất rất thơm chất son hơi mỏng_dính răng dính uống hút tint màu bám không mạnh màu v26 chỉ dành cho những ai có niềm đam_mê mãnh_liệt hoặc biết cách xử_lí nếu không rất dễ nhìn thành màu tím mắm_tôm,2
màu son rất đẹp lì thơm sản_phẩm như hình đúng màu đóng_gói đẹp hợp túi tiền,2
sản_phẩm ok độ lì không nhiều chất son nhẹ mịn không dùng để đi chơi ăn_uống được nhưng dùng để makeup chụp ảnh sương sương thì đẹp đóng_gói cẩn_thận,0
son lên màu đẹp lắm ạ chất son khá mịn và lì trước cũng mua loại này nhưng dạng bóng cơ nói_chung là hãng này son rất xinh và xịn luôn sẽ ủng_hộ tiếp ạ,2
son lên màu đẹp có độ lì ở trên môi lần sau sẽ ủng họi tiếp_theo,2
công_dụng bôi môi trét môi kết_cấu mềm mượt như nhung đúng như quảng_cáo độ bền_màu mới bôi thử chưa dùng ful ngày,1
hình_ảnh clip minh_họa giao nhanh khá là màu xinh với lì lắm,2
son đẹp mềm mịn và lâu trôioioi 3,2
màu son rất đẹp nha thơm nữa rẻ nữa mềm môi nhưg k lì đâu nha ai thích son lì thì k nên mua giao hàng lâu ạ,0
giao hàng cực cực lâu luôn màu son đẹp chất mềm mịn bám màu lâu,2
công_dụng makeup kết_cấu mịn độ bền_màu ổn giao hàng nhanh đóng_gói okela mình mua tặng b nên ko biết đánh_giá sao nhưng nhìn có_vẻ xịn,2
đánh_giá mang tính_chất nhận xu son nhận đúng màu đẹp min và lì lên môi rất sáng đóng_gói kĩ_càng,2
màu son khá ổn lên môi không mau trôi nhưng son vô hơi khô môi,2
công_dụng giúp môi đỡ thăm độ bền_màu tốt giao hàng hơi lâu đóng_gói cẩn_thận độ lên màu đẹp chất son mịn thơm mùi socola nha mọi ng nên mua nha,2
kết_cấu son lì màu đẹp độ bền_màu dễ trôi nhưng với giá tiền này thì ko đòi_hỏi gì nữa,0
son xinh màu đẹp rất ưng nhưng lau cái là trôi_shop đóng_gói sản_phẩm chắc_chắn,0
màu đẹp hộp đẹp giá rẻ nhưng mà nhanh trôi không lì chất son mướt thôi với giá_như này thì cũng ok,0
công_dụng jw kết_cấu chan độ bền_màu kem son đánh không giữ được lâu mà nhanh trôi nhiều chì mình check rồi chán lắm,0
sale 1 1 đến 18 thì nhận đc với qte và dịch n là nhanh r nha đc_shop tặng 1 mặt_nạ son thì có mùi kiểu cafe hơi trôi và màu nhẹ k đc đậm như hình nhưng với giá đó và hàng của mal thì cx yên_tâm,0
công_dụng tốt kết_cấu đẹp độ bền_màu xuất_sắc sp tốt son lên màu rất đẹpm mình đã mua 2 lần rồi do tình_hình dịch_bệnh nên giao 1 th mới tới nơi còn lại tất_cả đều ok,2
giao hàng khá nhanh gói hàng kĩ màu 402 với 501 mình mua tuy hơi khác so với ảnh nhưng vẫn dễ đánh son nhanh trôi nhưng với giá sale thì vậy là ok r,0
công_dụng 10 kết_cấu jd độ bền_màu 5 son lì màu dẹp lắm ạ lần sau ungt hộ_shop dài_dài hj,2
son ko lì lau phát hết phải 70 son trên môi lau thêm 1 2 lần nữa là ko còn tý gì nhưng ncl với giá_thành như_vậy là oke rồi chính hãng hay ko thì ko biết nhưng mua shop mal cũng yên_tâm hơn xíu thôi mua đi mọi ng suy_nghĩ gì nhiều mệt người khuyên đừng nên yêu_đương nha mệt người expressionless_face,0
không nghĩ hàng quốc_tế lại lâu vậy đóng_gói với bao_bì son thì đẹp nhưng son thì khá thất_vọng màu thì tương_đối nhưng chất son quá tệ lem tè le đụng nhẹ đã vây ra_tay tùm_lum không bám cây lấy son đầu bị cong quá lấy cứ bị kẹt phải nhẹ_tay kéo ra sợ gãy mua để biết chắc k mua nưa,0
son này xinh nha có điều là mình dùng hơi khô môi với lại k lì lắm đâu cả nhà nhưng mà màu đẹp với_lại giá v nên k đòi_hỏi cao được nói_chung so với giá thì ổn_áp nha,0
nắp nhung vỏ đẹp mùi vani đánh lên môi có những hạt kim_tuyến chíu_chíu nhgma màu bám nhanh trôi nch là tạm đc,0
công_dụng hsudhdj kết_cấu hdhdj độ bền_màu ududu xjdkjd d sjd sj sjs sjd jd,1
son màu đẹp lắm mọi người ạk son nõ lì mấy chùi một cái đi liền,0
kết_cấu tạm ổn độ bền_màu khá ít màu 915 hơi xấu đỏ nhưng lại thiên về màu hồng hơn đánh lên bị già đóng_gói chắc_chắn date xa nói_chung là khá ổn màu khacd với màu mẫu,0
đóng gói hàng cẩn_thận son cầm chắc tay chất son khô lì,2
