processed_data,target
công_dụng lm đẹp môi kết_cấu mềm mịn độ bền_màu bám tốt lần đầu dùng bia nên khong biết nói như thế_nào cả mình đặt 1 cây son mà shop tặng thêm 1 cây lộc cuối năm cảm_ơn shop ạ giao hàng rất nhanh smiling_face,2
son lì nhưng không check được mã hàng quá_xá là lâu chắc gần nửa tháng do vận_chuyển bên nước_ngoài nhưng giá rẻ,2
sản_phẩm rất ok son lì mịn với thơm nữa giao hàng nhanh hơn dự_kiến,2
hình_ảnh chỉ mang tính_chất nhận xu màu hướng cam hơi nhạt chất mịn giữ màu tầm 2 3 tiếng,1
lên màu đẹp rất tuyệt_vời có dịp sẽ mua tiếp m n nên mua chỉ có điều nhanh trôi,0
son đẹp xinh mùi hơi khó_chịu nhưng mà son lâu trôi chỉ mỗi giao hơi lâu,2
chất son ổn màu nhạt hơn so với hình xinh cầm chắc tay mùi hơi hăng không lỳ lấy khăn giấy lau 1 phát là sạch luôn,0
công_dụng ụ kết_cấu ok độ bền_màu đẹp màu đẹp ok rô xinh,2
giao hàng hơi lâu nhưng do dịch nên như vậy là cố_gắng lắm rồi chất son lì bền_màu nên mua nhé mọi người,2
son môi đẹp rẻ lâu trôi mùi ko thơm mấy nhưng bỏ_qua đc giao hàng nhanh,2
sản_phẩm rất xinh_đẹp tuyệt_vời màu này là màu ưng nhất đỏ cam siêu xinh chất son thì vẫn vậy nhanh trôi chùi cái là sạch,0
test lên tay màu cũng khá lì màu đẹp mà mình không rành về màu son nên cây đỏ rượu_vang không biết có đúng màu mình đặt không mà sao thấy như màu đỏ đất vậy khui kt thì cây đỏ cam trông như đã có ai khui r í tại thấy màu lem lên thành cây vs trong nắp,2
giao đúng hàng màu son và chất son đẹp lì nên mua nha,2
công_dụng son môi kết_cấu lỏng độ bền_màu ổn lên môi ko làm khô môi nha mn hình_ảnh chỉ mang tính_chất nhận xu,2
công_dụng son môi kết cấu đẹp độ bền_màu son màu lì màu lên đúng mẫu nha xinh lắm nên mua,2
màu son lên đẹp chất son lỏng màu lên giống hình khả_năng bám môi khá tốt không bị nhả son quá nhiều môi nên tẩy da chết mới đánh nhé mng,2
công_dụng son môi kết_cấu mịn độ bền_màu khá mình rất hài_lòng về sản_phẩm chất_lượng sản_phẩm rất tốt,2
giá_cả hợp_lí đóng_gói kĩ màu son đẹp bám môi lâu giao hàng nhanh,2
theo ý_kiến riêng của mình thì son khá bột khô môi và kiểu khá dính á không nên bặm môi quá nhiều lần và đặc_biệt mùi son là điều mình rất khó_chịu nhma được cái son rất lì nha và mình mua chỉ có 62 k thì phải tóm_lại cũng khá ok đây chỉ là ý_kiến riêng của mình thôi nhé,2
đóng gói chắc_chắn giao hàng nhanh chất son thì bình_thường theo mình thấy thì hơi khó tán đều khá lì 2 màu 402 và 404 khá giống nhau,2
màu son đẹp tuy_nhiên không ăn môi lắm dễ trôi và dễ bị nhòe màu,0
son đẹp nè giao nhanh và gói hàng chắc_chắn lắm nha xịn mịn luon mà son hơi lỳ h ảnh mang tc lấy xu,2
màu 25 thì khỏi bàn r nhưng chất son hơi khô và nhanh trôi,0
công_dụng dễ đánh lên môi lắm ạ kết_cấu mịn độ bền_màu lâu trôi,2
son thơm lắm mn ạ mùi cam rõ luôn màu như hình chất lì mềm lên môi siêu xinh tuy độ bám dính chưa đc tốt nhưng giá hạt_dẻ nên k đòi_hỏi gì tóm_lại là mn nên mua nhé,0
công_dụng gất là đẹp nhe lên đúng màu mềm môi còn thơm mùi socola nữa nè nên mua nhe kết_cấu gất là ố kề độ bền_màu okela lắm hàng quốc_tế nên hơi lâu nhưng mà hợp_ý mình lắm xài oke lắm nhe,2
đóng gói kỹ càng giao hàng nhanh giao đúng mẫu son khá thơm mùi phấn_son lên tầm 4 5 s là áp vào môi nếu ăn_uống nhiều dầu_mỡ thì son vẫn trôi chấm điểm 8 10,0
son thơm xịn và mịn bám lâu nữa nên mua nha mọi,2
hàng giao nhanh đóng_gói chắc_chắn màu son lên đẹp lâu trôi,2
hình_ảnh k liên_quan nhưng son xinh lắm đánh mướt môi hơi nhanh trôi nhưng màu lewn rất đẹp,0
son khá đẹp mùi hơi kì một xíu hơi nhanh trôi nha,0
shop đóng_gói rất là kĩ luôn nhận hàng nhìn màu thích cực luôn ý bôi lên rất là mịn nhưng mà nó k bền_màu lì cho lắm ncl cũng đẹp ạ,0
son lên môi khá mượt nha màu đẹp nhưng ăn_uống thì vẫn trôi nha,0
giao hàng nhanh chất son lì mềm có dưỡng nên đánh lên môi không sợ khô môi đâu nhé các b nhưng vì_thế mà chất son cũng sẽ dễ trôi chăm dặm lại là đc mùi thỏi 501 thơm mùi đào không nồng tí nào_đâu 2 màu này trôi ra để lại base cam à mà màu 501 thật_sự hợp để mix với 302 đấy ạ,0
màu ổn lì giá rẻ,2
son lên màu ổn lắm nhưng mà nhanh trôi nói_chung vs giá này thì k đòi_hỏi gì nhiều ạ,0
hình_ảnh chỉ mang tính_chất minh_họa chứ son đẹp chất kem mịn lì,2
công_dụng màu ok độ bền_màu khá ổn mua sale nên rẻ dùng ok hình_ảnh mang tính_chất minh_họa lấy xu,2
công_dụng son cái mỏ kết_cấu idk độ bền_màu prety its so god to danh len cai mo cua minh do,2
màu son rất đẹp k bám màu lắm nhưng mùi thơm rất ok rẻ ạ mn nên mua,0
chất son mượt bám cũng ổn mùi son ngửi lâu hơi nhức đầu,2
màu nhanh trôi quá ăn có tí là trôi rồi mk thấy màu lên môi rất mịn kiểu nó giống black round í nhưng rẻ hơn black round nhiều,0
công_dụng cho ai thich mau hoi hong độ bền_màu chat son li min son màu k giống hình lắm,2
công_dụng mau nhat_hon so voi anh danh len bi bot kết_cấu chat dat set de lam bet moi độ bền_màu do ben mau yeu,0
son cũng khá mềm môi nhưng không lì lắm lên màu đẹp new_moon_face smiling_face_with_tear new_moon_face pile_of_poo,0
son lên màu đẹp lì rất ưng,2
son màu đẹp lì nhanh khô rất ưng_shop cbi hàng nhanh nhưng vận_chuyển hơi lâu vẫn ủng_hộ shop 5,2
son lên màu rất đẹp bám màu tốt k dính ra ly lần sau sẽ tiếp_tục ủng_hộ shop,2
son đẹp giá rẽ màu 06 đẹp nha mn ưi ưa quá yỏiwi son lì màu tươi shamrock four_leaf_clover đẹp suất sắc nha mn rabbit_face shamrock,2
điểm cộng cho là màu đẹp và bám màu trên môi rất tốt thumbs_up điểm trừ là son cực_kỳ dễ dây ra ngoài và nếu để môi bình_thường mà son lên thì cực_kì khó tán chỉ dễ tán nếu thoa 1 lớp son_dưỡng ở dưới rồi đánh son ở trên,2
công_dụng rất tốt kết_cấu rất tốt độ bền_màu rất tốt son lên màu rất đẹp giao hàng nhanh đóng_gói cẩn_thận_shop tư_vấn rất nhiệt_tình,2
son lên màu đẹp lâu trôi đóng_gói cẩn_thận sẽ ủng_hộ shop thêm ạ,2
công_dụng son lên môi nhẹ kết_cấu lỏng tán màu đẹp độ bền_màu 10,2
chất son blur tint nên sẽ nhanh trôi uống nước thôi là đủ trôi rồi son thơm mùi socola dịu nhẹ thơm xỉu màu mình mua là màu mlb nên thoa đi học nhìn tự_nhiên mà xinh lắm ý son cầm nhẹ_tay dáng thon và dài nhá cọ son giống cọ romand,0
màu son rất xin giữ trên môi khá lâu hài_lòng vs sản_phẩm dịch nhưng giao hàng_không quá lâu,2
son xinh và lỳ lắm nha mn nên mua ạ shipe nhiệt_tình nữa chứ grinning_face_with_smiling_eyes hihi,2
son đẹp giao nhanh hơi lâu trôi 1 tí mà phải dùg son_dưỡng xài khô môi lém,2
công_dụng phù_hợp cho da ngâm kết_cấu mềm mịn độ bền_màu bám môi 70 80 giá_cả phù_hợp hsv giao hàng nhanh đặt sale 15 1 là 16 1 đã giao,2
son đẹp chất lì lâu trôi rất xịn rất đáng tiền,2
son đẹp lém nha mn chất thíc lắm ạ son lâu trôi i,2
công_dụng giao hàng nhanh kết_cấu son chất_lượng độ bền_màu màu đẹp ok,1
công_dụng làm đẹp kết_cấu mịn lém nhe độ bền_màu lì nha ăn_uống tới_bến mà vẫn còn giữ lớp nhìn cũng không phai đi nhiều đâu nchung màu xinh lắm á,2
kết_cấu chất nhung mịn độ bền_màu hơi làm khô môi thoa tầm 2 tiếng là môi khá khô r rẻ đẹp gần tết nên ship lâu 301 mình mua lần 2 r vẫn đẹp 302 màu hơi sến hồng cánh sen ngả tím khá sáng đáng nhẽ mình phải xem review của lio trc khi đặt nh 0 sao chắc mix với son đậm hơn là đc,1
công_dụng làm đẹp kết_cấu tốt độ bền_màu tốt son xinh màu đẹp giao hàng nhanh_chóng ạ sẽ ủng_hộ shop,2
son thơm mịn màu oke ăn thì sẽ bị trôi phần lòng môi nhé mọi người shop gói hàng cũng oke nha,0
độ bền_màu k lì lắm thơm mùi socola lắm luôn muốn ăn luôn quá vỏ rất chắc_chắn mãi ms mở đc giá rẻ,0
son cũng okie mà không được lì màu hơi lệch so với màu gốc p s ảnh của mình là son khác,0
son màu xinh hàng chính hãng nên yên_tâm tuyệt_đối mk đã dùng bia nhiều r siêu lâu trôi mà k bọ khô môi,2
giao hàng nhanh chất son ok chưa sử_dụng nên chưa biết độ bám,1
son kem lì màu rất đẹp ạ nhưng son lên nhanh trôi rất ưng_ý ạ smiling_face_with_hearts,0
công_dụng đánh lên môi kết_cấu xinh độ bền_màu kh bền nên mua nhá m n nhma nó kh có lì đâu với giao hàng lâu cực,0
son siêu đẹp đánh khá mướt môi đặc_biệt là lâu trôi và ko dây khi ăn_uống dịch giao hàng hơi lâu nhưng vẫn đợi đc thumbs_up,2
công_dụng màu son đẹp kết_cấu đẹp độ bền_màu chưa thử mài son rất đẹp nha ừn ý,1
công_dụng son kết_cấu mềm mịn độ bền_màu tốt shop chuẩn_bị hàng nhanh đóng gói hàng cẩn_thận son đánh lên nhìn màu ưng,2
son khá đẹp đóng_gói sản_phẩm ok chất son không lỳ lắm nhưng mà vẫn ok red_heart red_heart,0
son lên màu đẹp nhưng kg lỳ,0
công_dụng son len mau xinh xiu luon kết_cấu to len moi mau dep lam nha da ngam dung cung khong lo nhe độ bền_màu dung chat son li dung khoang 3 4 tieng moi troi xinh lắm trời_ơi mua ngay đi mn,2
chất son mịn thơm nhưng điểm trừ là dễ trôi vd khi đeo khẩu_trang hay không may bị quệt sẽ bị dính son bao_bì đóng_gói cẩn_thận kèm hộp son khá cute hình_như màu mình mua hơi đậm hay sao nên mấy bạn học_sinh như mình chỉ cần đánh nhẹ là màu nên rất ok rồi giá rất phải_chăng nên mình rất thích,0
công_dụng son môi kết_cấu mịn mượt thơm độ bền_màu 2 3 h nếu ko ăn_uống đẹp two_hearts,1
chất lì mà nhẹ môi lắm nhé thỏi son nhìn thiết_kế cũng iu nữa chứ,2
em son này thì mình rất mê tuy rẻ nhưng chất_lượng đấy ạ chỉ điều vẫn bị trôi trong khi bảo nó là son lì son có mùi thơm mình rất thích đóng_gói cẩn_thận mà hàng giao hơi lâu so với mình nghĩ,0
son màu tươi nhanh trôi k lỳ giao hàng lâu shiper nhiệt_tình đóng gói hàng chắc_chắn bọc nilong chống sốc cẩn_thận,0
đóng gói hàng ok time cx khá nhanh mùi son thơm tuy_nhiên nhanh,0
công_dụng màu nhẹ_nhàng đẹp kết_cấu mềm_mỏng mướt độ bền_màu bthg bám ko lâu lắm son giao khá lâu nhỏ chất đẹp lên môi rất mềm mùi thơm màu 105 này trông rất tự_nhiên lên môi không bị nặng màu finish khá sến,0
kết_cấu hihi độ bền_màu hihi oke lắm mng đúng màu mình thích kiểu thâm_thâm mùi cũng thơm ncl oke,1
công_dụng voi gia nhu vay thi son khong con gi de che kết_cấu lop son min va mem de tan độ bền_màu uong nuoc thi van bi lem tren thanh coc nhung noi chung thi van ung nha,0
son xinh lắm mng ơi với giá này mình kh đòi_hỏi lắm mà về ưng kh tưởng luôn chất son mềm mịn thơm dễ_chịu_cực ý màu đẹp lên môi xinh xỉu luôn á son hơi bóng nhẹ còn tẩy thì trên môi quẹt 1 đường là đi luôn chứ kh như da tay trên video nhé ạ face_with_tears_of_joy,0
đóng gói gì mà xinh_xẻo dữ đến cả cái vorvungx k lỡ vứt nữa nói đến cái hộp thì lại xinh hết kế sang chảnh nữa chứ son thì phải nói đến chất màu v07 cảm_thấy rất ưng cái bụng về sự lên màu chất din đẹp môi mềm độ bám cũng ok nữa ưng,2
công_dụng son kết_cấu bột mịn độ bền_màu lì màu khá đẹp như màu môi vậy đnahs đi học thì rất ok son ny tặng nên không_chê được,2
công_dụng màu đẹp kết_cấu ổn độ bền_màu tuyệt_vời tuy giao hàng hơi lâu nhưng son khá ổn chất son mịn nhỏ nhỏ xinh_xinh,2
màu lên xik lắm nha mn màu y_như socola ý nhưg đánh đậm chỗ lòng môi ms giống chứ đánh nhạt lên màu nâu cam mà thiên về cam hơn í chất son nhung lì nhưg ko mịn lắm đánh_hơi khô môi và bay_màu nhanh ý ăn_uống 1 tí cx dính hết son vào đồ ăn r crying_face,0
kết_cấu mịn độ bền_màu bám lâu trứng note mình mua để tặng nên k biết s nhưng vỏ hộp lấp_lánh đẹp sang nha,2
mình mua màu này đã 3 cây rồi hãng bia mình xài đã 7 cây rồi vẫn bền_bỉ màu lâu trôi lại còn xinh,2
màu đẹp lắm hjhj khó tán với nhanh trôi nhma được cái màu đẹp với vỏ xinh 3,0
độ bám và bền_màu lì khỏi phải nói mua đúng đợt sale nên săn được giá hời ưng cái bụng kinh_khủng,2
mau trôi nhma giao nhanh màu đẹp giá rẻ nên 10 10 đỉm aạ,0
gần như bản dupe của a12 đình_đám tuy sắc cam hơi vàng hơn chút lâu trôi hơn black rouge giá rẻ nên thử,2
hàng quốc_tế giao khá lâu nhưng mà son rẻ cute lắm nha lì thì chắc_chắn là với giá tiền này thì không lì được rồi nên mua trải_nghiệm,0
công_dụng son đỏ kết_cấu khô nhanh hơi khô trên môi độ bền_màu lưu trên môi khá lâu,2
công_dụng son kết_cấu kem độ bền_màu khá đẹp đóng_gói chắc_chắn hàng nước_ngoài nên giao hàng hơi lâu,1
công_dụng son moi kết_cấu kem độ bền_màu khong duoc lau đóng_gói sản_phẩm không được chắc_chắn,0
công_dụng siêu ổn màu đẹp ẩm bám màu tốt kết_cấu son hơi đặc 1 tí khó tán hơn cây 24 h có lớp silicon nên bôi lên môi khad lán mịn giữ ẩm tốt í màu khá bền í mình ăn_uống suốt 3 tiếng mà trên môi vẫn còn màu nhạt nhạt son này dùng lòng môi là đỉnh luôn,2
son môi mướt mà không biết do môi hay do son mà nó không bám vào lòng môi được nhưng màu đẹp đáng mua,0
nhận hàng nhanh ạ màu lên tay đẹp thì y_như e chụp còn màu lên môi nghiêng về màu tối nâu sậm trong khi môi e k thâm ạ nhanh trôi nói_chung lên môi e k thích lắm,0
công_dụng xinh kết_cấu kem độ bền_màu onro màu xjnh hình_ảnh mang tính_chất nhận xu aạ,1
xinh vãi mng ơi huhuhu xinh lắm luôn íi màu 1 lên môi ưng cực giá quá rẻ màu ưng chất son mềm mướt lắm son có hương cam nhè_nhẹ nữa kh hề có mùi khó_chịu nha màu trong ảnh mình chụp y_chang ngoài đời lun mỗi tội nhanh trôi và nhỏ hơn mình nghĩ í chắc giờ mình xài bé này suốt quá pleading_face,0
công_dụng màu đẹp nhanh trôi kết_cấu đặc thơm mùi socola độ bền_màu kém giao hàng nhanh đóng_gói chắc_chắn,0
son sang xịn mịn luôn ạ nhưng rất dễ trôi chắc do dịch nên giao hơi lâu,0
công_dụng lên màu đẹp kết_cấu lì mịn độ bền_màu tốt v6 blue vỏ xanh bom tấn đầu năm 2020 nghe nói trend năm nay là màu xanh cổ_điển clasic blue vẫn tông màu v6 quyến_rũ nay lại khoác lên mình chiếc áo clasic blue lạ_mắt đây chắc_hẳn là siêu_phẩm cực hot trong năm 2020 mà các nàng đang rất mong_chờ,2
công_dụng đi chs đi hội kết_cấu đẹp độ bền_màu bền_màu lâusản phẩm đẹphù hợp giá tiềnlần sau ghé shophaè và vd chỉ mang tính_chất minh_họa,2
giao hàng nhanh gói kỹ son nhanh khô màu chuẩn mùi thơm không quá lì nói_chung là ổn,0
mình mua lần đầu hai cây để xem chất_lượng như nào và quá hài_lòng son lên môi rất dễ tán màu cũng rất đẹp mỗi tội son hong lì lắm nhưng không sao cả màu đẹp và chất khá ok và mình đã mua thêm hai cây nữa rùi với giá này mà sản_phẩm vậy là quá ok,0
son k lì nhanh trôi đem về khác loại đã đặt trước đó màu cũng khác luôn giao hàng chậm đóng_gói cẩn_thận b,0
lâu trôi son nhẹ môi màu dịu nhẹ lên đẹp nên mua nha cac ban,2
chất son mịn nhưng k lì nói_chung giá rẻ nên k đòi_hỏi nhiều vỏ son đẹp,0
sản_phẩm ổn trong tầm giá son kh lì lắm nhanh trôi kẻ mắt khá tốt giao hàng hơi lâu,0
son cưng xỉu nè nhưng son có_vẻ kh bám môi lắm thì phải,0
màu đỏ rượu_vang đánh tôn da cực_kì chất son thì mình thấy mịn nhưng k bám màu lâu đâu nha với giá này thì quá ổn r son có mùi nhẹ n k thơm,0
công_dụng ebdueme dhdiwnd kết_cấu naudke sjdjdh độ bền_màu dncndn hôhi,1
son đẹp nhưng lì quá tán ko được mà 402 với 403 trông giống nhau,2
công_dụng ok kết_cấu ok độ bền_màu ok,2
công_dụng lam moi do kết_cấu mau son hoi bot 1 độ bền_màu mau depjdf son thật đẹp,1
son đánh lên êm lắm nhẹ môi nhưng mình thấy nó ko bám môi lắm nhưng so với giá thì rất ok,0
son màu đẹp nhỏ nhỏ xinh_xinh son không lì lắm mà giao hàng hơi lâu,0
chất_lượng sp tuyệt_vời giao hàng nhanh chất son mềm mịn lâu trôi_shop tư_vấn nhiệt_tình và thân_thiện,2
công_dụng son kết_cấu mịn đẹp độ bền_màu bình_thường,1
công_dụng màu lên cực đẹp lun mình mua màu 01 rất dep nho kết_cấu chất son mịn hơi vốn cục độ bền_màu mình hay liếm mà cũng k trôi lắm nma hơi lem gút chop,2
công_dụng d kết_cấu ko kho moi độ bền_màu son ben mau an uong se de lai lop tint mua thỏi thứ 3 rồi ạ,2
sản_phẩm tốt_đẹp mắt màu_sắc son rất tốt lì lâu trôi sau có dịp e sẽ ủng_hộ tiếp,2
son đẹp bền_màu lên màu vô_cùng yêu hình_ảnh ko liên_quan nhưng nên mua nha mn ok lắm,2
quá ok nhé son mềm mượt son lên đều và mềm môi rửa nước k trôi lau mới trôi tai_nghe cũng ok kẻ mắt thì đẹp mọi người nên mua ok lắm nha,2
công_dụng làm đẹp kết_cấu uki độ bền_màu ukila re ma dong goi xin lam mua tang b nen khum bic dung seo,2
công_dụng son kết_cấu minj độ bền_màu 20 son mượt mịn màu đẹp và nhanh trôi lắm hàng lâu,0
son xinh lắm mn ạ mướt mịn luôn để 1 chút nó set lì lại mn nhé nói_chung 10 đ giao 1 tuần khá là môi mình nha nên mua mình có hỗ_trợ dv fb mọi người nha,2
video mang tính_chất nhận xu_shop giao đúng màu đã đặt son mùi socola thơm thơm nhưng chất giống bột nhanh trôi phù_hợp giá tiền đã sale,0
son này mùi thơm của socola dễ_chịu lắm nhưng nhanh trôi nên thử nha,0
công_dụng làm đẹp kết_cấu nhỏ độ bền_màu bình_thường giao hàng hơi lâu do ở nước_ngoài màu hơi xấu grinning_face,1
công_dụng đe p lắm nha kết_cấu nhi n xinh lắm á độ bền_màu cũng được mua lâu r giờ mới đánh_giá ư m son đẹp nha màu giống hình,2
giao hàng nhanh son thơm lì mịn ok,2
son chất kiểu bột bột k bám môi nói_chung tiền nào của đấy cả thoi ạ bạn nào vào đọc review để mua son thì inbox qua shope cho tặng 2 màu 203 và 402 nhé k dùng để phí,0
son mùi socola thơm chất son ok nhưng son lên k giữ đc lâu đâu chỉ dùng khi chụp ảnh đồ j th,0
kết_cấu nhẹ độ bền_màu ok màu đẹp gửi hàng nhanh thumbs_up,2
chất son ok có điều hơi út nhá nhưng mua đợt sale 2 cây 75 lại đc hoàn xu nên cũng khá là ok chất son nhung í nhưng dễ trôi theo riêng mình thấy thì lên màu nhạt hơn trên ảnh 1 tông nhá nhưng phối hai màu thì ok cũng rất nên mua nha,0
công_dụng không mịn kết_cấu tệ độ bền_màu dễ trôi bé khẩu_trang duyên_dáng dành cho hội bạn thích làm_trò con bò clown_face bé khẩu_trang duyên_dáng dành cho hội bạn thích làm_trò con bò clown_face ta nói nó nhây gì đâu đeo cùng hội ce chắc cười sái quai_hàm mất,0
công_dụng ok kết_cấu ok độ bền_màu ok sản_phẩm ok màu hơi thiên_cam đất hình_ảnh mang tc minh_họa để nhận xu,2
son săn sale và mã giảm còn 40 k thôi màu son đẹp chất son hơi lỏng nhưng son set lại khá lì hơi nặng môi,2
son đẹp lắm nha mn màu xinh xĩu sơn chỉ cs giá 19 k mà lì lắm ạ màu 01 rất xinh nên mua smiling_face_with_heart eyes,2
son đúng hàng thumbs_up độ lì khá ok hợp với giá tiền đánh_giá shop 5 sao,2
dùng ưng lắm nhé lên màu tốt lâu trôi k khô môi ncl thích_hợp cho các bạn nữ,2
shop giao nhanh đc tặng kèm mặt_nạ son bóng lên màu chuẩn nhưng khá dễ trôi,0
lần đầu mình dùng son của hãng chất son không đặc quá k lỏng quá đầu cọ mềm đi màu đến đâu ăn màu trên môi tới đó không cần bặm môi đã ăn màu rồi ý màu v24 theo mình thì thích_hợp dùng hàng ngày màu nhẹ_nhàng son như không son màu bám môi nên lâu trôi có trôi cũng còn 1 lớp mỏng nhẹ khá ưng,2
son đẹp hàng chất_lượng cao mình rất ưng thumbs_up đánh vào rất lâu trôi rất đẹp luôn flushed_face,2
tiền nào của nấy các bạn ạ son k có độ lì son như không son nhìn lem_luốc k nên mua nha mn uổng tiền lắm,0
906 chuẩn cam đất nhé ae son lì ko bị dây ra thành cốc rất ưng,2
săn sale 10 10 mà nay đã có màu đẹp và bám khá lâu đóng_gói kỉ càng,2
công_dụng đánh lên môi kết_cấu mịn xóp độ bền_màu ăn_uống trôi 90 màu siêu đẹp màu đẹp nhắm nha nên mua một thỏi màu 942 siêu đẹp siêu tây,0
công_dụng son kem perfect diary kết_cấu hàng đóng_gói cẩn_thận chắc_chắn độ bền_màu màu vẫn nhanh trôi,0
hong bíc nói sao lun nhưng mà màu đẹp xĩu á mấy bà ai môi khô không lo đâu nha màu này lên là bao xinh lun á mng nên mua son giữ được lâu nếu không ăn_uống,2
công_dụng xịn cực màu đẹp kết_cấu hơi nhỏ nhưng cx đc bởi tiền nào của đấy độ bền_màu son cx lì nhưng màu hơi nhạt chút dễ tán lắm ko bị đánh cục 3,2
mình mua màu đỏ thẩm cực xịn luôn ạ đc cái là mau trôi nhưng không sao màu đẹp là đc hihi sẽ ủng_hộ shop tiếp,0
kết_cấu mượt môi khô đánh lên vẫn đẹp độ bền_màu không cao mùi thơm nhẹ vỏ đen nhìn cưng á,0
son màu đẹp nhanh trôi ăn một_tí là trôi hết_sạch k lỳ 1 chút nào nhé,0
công_dụng son mình săn sale giá rẻ dùng kết_cấu giao hàng nhanh độ bền_màu son lì,2
màu lên khá đẹp son cầm chắc tay không bị nhẹ quá tuy_nhiên son đánh sẽ hơi khô nên dưỡng môi kỹ nha còn độ bền_màu thì mình thấy không bền đâu lau cái hết rồi hàng quốc_tế giao lâu lém hic,0
son màu đẹp lắm đánh cx mịn mà son ko bị khô môi đánh lên tay lì lên môi ko lì lắm vẫn cho shop 5 sao mình mua cho bạn mà muốn giữ lại luôn mình mua màu 01 đỏ đất nha giao hàng hơi lâu nha,0
đóng gói hơi sơ_sài mà son mới lì lên màu đẹp,2
son lì mùi hơi hắc nhanh khô nên tán nhanh màu ổn vừa giá tiền,2
giao hơi lâu hix đánh lên màu đẹp nha ko được lì tạm ổn dùng làm đánh màu má,0
kết_cấu lì smiling_face_with_hearts sản_phẩm rất xinh_đẹp tuyệt_vời tôi không_thể trông_đợi gì hơn cảm_ơn nhà cung_cấp nhà_sản_xuất cảm_ơn người bán hàng cảm_ơn sàn thương_mại_điện_tử cảm_ơn người vận_chuyển để tôi có cơ_hội dùng sản_phẩm tốt như thế này,2
màu đẹp đúng sắc đỏ ưng mịn k vón cục giao cực lâu bôi dưỡng lên nên nó nhanh trôi,0
mùi kh thơm lắm son tạm ổn với giá tiền nhanh trôi,0
công_dụng son này phải đánh đậm ms lên màu rõ đc kết_cấu thỏi son hơi bé nhưng vs giá_như z là ok r độ bền_màu màu khá nhạt nhìn qua như ko đánh í nhưng mà mùi khá thơm vị socola và lâu trôi,1
công_dụng tốt kết_cấu đẹp độ bền_màu đẹp màu son đẹp thơm mùi chất son mịn k keo khô 1 nhược_điểm là giao hàng hơi lâu nhưng vì dịch lại gần tết nên thôi thông_cảm cho shop m n nên mua,1
