processed_data,target
mình mua dùng thử thấy chất son mượt mềm môi mùi kẹo ok đáng để thử khuyên mn nên dùng son_dưỡng trước khi đánh nếu đánh son lên luôn thì lòng môi nó sẽ ko ăn màu mình mua 2 màu 402 và 302 402 màu son đỏ đất 302 màu đỏ tươi,0
công_dụng nhựa kết_cấu khá ok độ bền_màu hơi_hơi lig đẹp lắm mọi người à nên mua nhoa,2
hình_ảnh và video chỉ mang tính nhận xu màu son đẹp và lâu trôi,2
màu rất đẹp thơm mùi socola bôi lên đẹp nhưng nhanh trôi dùng làm nền rồi bôi thêm lớp son khác thì được thumbs_up,0
công_dụng bia 25 là huyền_thoại rùi màu chuẩn kh bị khô ai thích tone trầm trắng da trắng răng mua liền kết_cấu kem độ bền_màu đỏ cam đất,1
kết_cấu min độ bền_màu tot hình_ảnh mang tính_chất nhận xu son lên màu đẹp đánh nhẹ môi,2
son thơm và đẹp lắm luôn chất son mịn 2 cây hơi nhỏ nha son phải gọi là đỉnh mà kh lì,0
màu lên khá chuẩn nhưng mà son k bám được lòng môi hơi thất_vọng nhưng mà vì nó rẻ nên k đòi_hỏi gì nhiều,0
son mùi không thơm lắm son màu đẹp lì mà son kem nên xài hao son nói_chung ok,2
công_dụng lên màu ko được đều ạ kết_cấu đẹp độ bền_màu khá ổn so với giá sản_phẩm được đóng_gói đẹp lên màu ko được đều giao hàng hơi lâu ạ,2
màu đẹp tuy k bám lâu nhưng màu khá xịn,0
son màu đẹp nha bôi cũng mịn môi kb có lì k tại chưa đi đâu nên chưa biết có mùi rượu_vang khéo say son mất face_with_tears_of_joy,1
sản_phẩm đúng hình có hướng_dẫn sử_dụng đóng_gói tốt giá_cả hợp_lý nhưng trôi mau nhanh,0
công_dụng xinh vl kết_cấu jdjd độ bền_màu chua thu gói hàng ẩu lam son như kiểu có người mở roi á,1
son cực_kì đẹp lên màu chuẩn và bám màu rất lâu mk rất hài_lòng về sản_phẩm,2
công_dụng sơn kết_cấu đẹp độ bền_màu tốt sản_phẩm em được xem qua pr sản_phẩm trên shope nên nhanh tay lên đơn với giá siêu rẻ hàng về nhanh màu rất ưng cảm mơn_shop nhiều heart_suit,2
mua màu đỏ đất nhưng hơi có ánh_hồng 1 chút chất son mềm mướt nhẹ bôi xong tầm 15 p thì n mới khô lớp son lì cực luôn nha với giá rẻ chưa bằng 1 bát phở thì chất_lượng quá ok r ạ mn nên dùng thử thay_đổi nha,2
son mịn thơm lỳ đánh lên màu đẹp không bị khô môi siêu thích luôn ạ red_heart màu son giống với bảng_màu,2
mua lần 2 ở shop rồi giao hàng đủ có bọc chống sóc rất kỹ càng son lên màu đẹp dễ blend chắc là dễ trôi bao_bì đáng iu chụp lên nhìn màu khác ghe,0
công_dụng làm đẹp kết_cấu đẹp độ bền_màu chưa dùng chưa biết hnv,1
son đẹp đóng_gói cẩn_thận mùi thơm nữa shop giao hàng nhanh hơn với dự_kiến nữa son lì đẹp như a12 của blackrou mà với số tiền không quá 20 k quả là đáng đồng_tiền bát gạo cho shop 5 glowing_star luôn 3,2
ảnh mang tính_chất nhận xu son này dùng nhiều nên k có gì để nói nữa màu đẹp cũng khá lâu trôi mn nên dùng thử giá cũng k quá mắc,2
màu son cx ok chất siêu lì nhưng màu son k đc giống trong hình lắm 8 10,2
màu chùi 1_phát là ra son khó son lên môi rất xấu luôn son nhỏ lắm kiểu nhìn như mini,0
son không lì mấy chất khá ok màu này cũng xinh nữa nói_chung với giá tiền thì ok k đòi_hỏi nhiều hơn,0
giao đúng màu chất son mịn độ bám không quá cao,0
son lì lâu trôi mòi bdjdjd dns nấm hsg,2
màu xinh hơn mình nghĩ rất đáng mua chất son mềm lên màu đẹp hết điểm thì son nội_địa giữ được 3 4 h là max cơ_mà đáng mua lắm nha,0
son lì màu siêu đẹp đáng tiền siêu mê ok,2
công_dụng ỹucugu kết_cấu độ bền_màu,1
màu son xinh nhưng chất son hơi bột và dễ trôi ăn_uống thì lớp đỏ trôi đi sẽ ra màu hồng sen hơi sến,0
son đúng chất clay sẽ thấy lì nhưng bột bết và màu lên cũng hơi khác ảnh trên mạng xíu 2 màu dễ đánh và cũng hơi trôi,0
công_dụng tot kết_cấu long độ bền_màu 5 10 son lì màu kh đẹp khac vơía rnh nhé mng oi thất_vọng,2
video không liên_quan lắm chất son oke cơ_mà son không lì nhanh trôi,0
công_dụng mình thay xinh ne kết_cấu dong goi sp chac chan độ bền_màu mau rất xinh luôn nha a,1
đẹp đều có_vẻ ít nhanh trôi nhưng mùi rất thơm,0
công_dụng bt kết_cấu bt độ bền_màu bt tạm ổn ok hơi lâu khô 1 tí chất_lượng ổn giá rẻ nên không đòi_hỏi gì thêm,1
chất nhung mịn màu đẹp mà dễ trôi lắm nên cầm theo để bôi lại trong ngày,0
hàng tầm 7 ngày về đến nơi shiper thân_thiện son mùi thơm nhẹ chất son khá mềm hơi bột lên màu hơi nhạt không lì lắm nói_chung là với giá tiền này mình không mong_mỏi gì hơn các bạn hsinh có_thể tham_khảo,0
màu lên ổn đẹp chất son mịn nhưng hơi nặng môi á chán 1 cái là son k lì mình đánh lên môi xong lấy bông tẩy_trang khô lau nhẹ cái là bay luôn loudly_crying_face mà thôi 2 cây 9 k giá v thì quá ổn r_shop đóng_gói chán làm méo cả hộp son,0
son màu khá xinh không lì lắm nma so vs giá thì điểm 10 cho chất_lượng ảnh chỉ mang tính lấy xu,0
mua màu 201 tươi hơn trong anhe mùi rất quen nhưng ko nhớ mùi gì mua chơi thôi vì rẻ chứ cũng ko lì dễ lau dễ trôi,0
công_dụng làm đẹp kết_cấu tạm oke độ bền_màu cũng được rẻ cx khá chất_lượng màu son đẹp,2
sản_phẩm tốt bền_màu lâu trôi nhận hàng hơi lâu nha nhưng k sao vì k cần gấp,2
màu giống hình xinh nhg hơi bết k bt có lì k cx tạm,1
màu cũng ok vì có dưỡng nên nhanh trôi thấy cũng được,0
son đẹp mịn chưa test nên chưa biết có lì hay không đã từng sử_dụng loại này nên tìm mua mong chất_lượng cũg giốg vậy,1
kết_cấu mịn độ bền_màu ổn đóng_gói ổn son đến tay vẫn đẹp như hình chụp trên chất son k có gì bàn nch ổn,2
son này mua rất nhiều rồi và dùng rất ok độ lì và mềm môi không bị khô môi nha,2
công_dụng trang_điểm kết_cấu kem độ bền_màu tốt nhận hàng siêu nhanh sản_phẩm chất_lượng nên mua thumbs_up,2
shop giao hàng hơi lâu đặt từ 1 1 mà giờ mới nhận được chắc do dịch nên hàng bị lưu kho ạ màu sơn tone đỏ cam đất rất tôn da và trắng răng ai da hơi tối dùng siêu đẹp ạ chất son lỳ ạ,2
son khá thơm lên màu ổn_áp môi rất là mềm nha lâu trôi nữa mk để nguyên ngày,2
son lì lắm luôn nha mọi người ăn_uống thoải_mái luôn ạ thời_gian giao hàng nhanh màu cũng ok đó ạ đánh_giá shop 5 sao,2
công_dụng son kết_cấu đep độ bền_màu tốt son được nhưng mà như kiểu dùng rồi ý giao hàng nhanh,2
công_dụng son đẹp kết_cấu hợp_lí độ bền_màu màu đẹp son khá tốt_đẹp phù_hợp cho học_sinh sinh_viên,1
kết_cấu nhung mịn độ bền_màu nhanh trôi son nội_địa nên rẻ mình thấy mấy màu này để làm base thì ok nè,0
mình sale được giá hời thỏi son đẹp như minh_tinh về tay có 70 k sướng gì đây á màu siêu đỉnh luôn lên màu đẹp bám môi tuy ko bền lắm,0
công_dụng son môi kết_cấu chất kem xốp mỏng nhẹ mịn lên màu dễ độ bền_màu kém dễ trôi và không để lại lớp tint vỏ xinh nhưng cũng dễ dơ mùi thơm màu đẹp lên môi chuẩn nhỏ gọn dễ mang theo giá thì quá là okela cho chất và màu son,0
công_dụng nice kết_cấu len mau chuan độ bền_màu ko ben lam ản phẩm rất xinh_đẹp tuyệt_vời tôi không_thể trông_đợi gì hơn cảm_ơn nhà cung_cấp nhà_sản_xuất cảm_ơn người bán hàng cảm_ơn sàn thương_mại_điện_tử cảm_ơn người vận_chuyển để tôi có cơ_hội dùng sản_phẩm tốt như thế này,0
đây là lần thứ n mình mua son kem lì lần hãng ra mẫu mới là mình lại tậu về cho bản_thân một cây son là con_gái luôn_luôn cần son và đam_mê son như t thì nhất_định phải mua son hãng này,2
son xinh màu lên chuẩn khá lì không dễ trôi ạ đánh lên không khô môi chất son mịn,2
lên màu không dc đẹp mấy khó tán nữa không được lì được cái shop đóng_gói rất cẩn_thận,0
son màu lì đẹp nhưng vì chuẩn_bị hàng chậm quá vote 4 sao nha o,2
công_dụng son mịn mềm rất đẹp kết_cấu hình tròn dễ cầm hình_dáng đẹp độ bền_màu màu đúng ý lâu trôi sản_phẩm rất đẹp đúng mẫu mùi thơm mà muốn ăn lun sẽ ủng_hộ shop nhiu ship vui_vẻ,2
công_dụng mau depjdf kết_cấu nxndnd độ bền_màu chuan ok em đã tìm ra vào mục công_cụ thong minhg ghi màn_hình rồi tắt cái mục âm_thanh từ micro là dc,2
son siêu xinh luôn ý đúng màu mùi dễ_chịu lì cx ok siêu ưng nên mua nha,2
màu son đẹp nhưng mà lấy giấy lau 1 lần là hết_sạch màu son,0
công_dụng son môi kết cấu dạng kem độ bền_màu tốt giao hàng nhanh đóng gói đẹp chắc mua ở shop thì yên_tâm về chất_lượng rồi,2
vỏ son nhìn xinh_xẻo lắm son cũng khá lì mà mình lỡ chọn màu tone hồng rất là tiếc,2
công_dụng 5 5 kết_cấu 5 5 độ bền_màu 4 5 chất son mịn siêu tôn da luôn lên màu sẽ chuẩn hơn nếu có thêm lớp base che khuyết_điểm mùi siêu thơm luôn ý còn về màu thì màu 02 đẹp hơn 04,2
công_dụng son kết_cấu bột độ bền_màu mau trôi cây son nhỏ à vỏ nhựa son bột mà lên môi mỏng nhẹ mịn nên tẩy tbc hết để son lên đẹp màu số 2 đẹp lắm trắng da nữa,0
oke màu lên đẹp nhưng không bền_màu lắm,0
son lên màu đẹp lâu trôi nói_chung ok thumbs_up,2
son lên màu cũng khá ổn nhưng dễ trôi giá tiền thì phải chăng,0
son lì đẹp đây là lần thứ hai mình quay loại mua son này mùi thơm nha,2
công_dụng kết_cấu dac độ bền_màu k ly giao hàng khá lâu đóng_gói chắc_chắn săn sale giá rẻ nên k kỳ_vọng nhiều,0
công_dụng màu đẹp uýnh lên trông xinh mà giá cũng ok kết_cấu lọ trắng độ bền_màu 86 chất_lượng hợp giá_cả,2
công_dụng màu rất đẹp hợp mới da ngâm da trắng đánh lên cũng xinh lém kết_cấu tốt độ bền_màu bền,2
hình_ảnh mang tính_chất nhận xu son lì màu đẹp chất mịn siêu xịn ạ,2
son kh đc lì như sp quảng_bá son thơm ok hình_ảnh mang tính_chất nhận xu,0
chim_ưng ạ 3 đẹp hết chỗ chê rồi son tuy mịn mượt nhưng khá lỳ nếu k ăn_uống nhé,2
mua son lần 2 rồi mk thích màu này mùi socola lên khá mịn môi nhưng cũng hơi nhanh trôi,0
hàng oke lên màu cũng depj mà ko hẳn là lì nha cho ce nào muốn biết mà rẻ ghê á,0
công_dụng son kết_cấu lỏng độ bền_màu khá dùng rất mướt môi và mềm môi có mùi thơm,2
son mịn môi cực lên màu đẹp sáng da nữa ạ nên mua nha mn mới dùng nên k biết có lì hay không thumbs_up,1
son lì chuẩn màu son chính hãng có tem luôn nên mua m n ạ đóng_gói sản_phẩm chắc_chắn đẹp,2
công_dụng son làm trắng da trắng răng kết_cấu kem lì độ bền_màu 3 h màu nhiều sắc nâu hơn blr a12 màu son làm trắng da trắng răng dùng được cho mặt mộc nha,2
công_dụng đánh môi đánh mắt kết_cấu mềm mịn độ bền_màu lì giao hàng nhanh đóng gói cũng tốt dth màu lên môi xinh_đẹp khá chuẩn hợp mọi outfit,2
công_dụng tốt kết_cấu kem độ bền_màu ổn son mềm nhẹ môi bao_bì mới keng màu đẹp khỏi bàn_giao nhanh luôn sẽ ủng_hộ lần sau nhé iu_shop,2
shop gửi đúng phân_loại hàng chất kem mịn dễ blend nhưng nhanh trôi chất làm base môi và phấn má khá hợp vì tán rất dễ và đều hoặc hợp make sương sương thơ thơ,0
công_dụng a kết_cấu xinh độ bền_màu okok,2
không ngờ luôn á chất son_mịn cực_kì 2 màu mình mua rất đẹp không bị bột hay vệt nhẹ môi nữa vỏ cũng rất xinh luôn còn bám lâu không thì chưa biết nhưng rất thích nha,1
màu đẹp hơn so với mình nghĩ chất mau khô có độ lì nhẹ trên môi giao hàng nhanh,2
kết_cấu đóng_gói cẩn_thận độ bền_màu chưa test thử nên chưa biết son màu khá ưng vỏ mịn đẹp,1
nhìn vậy mà lúc về son nhỏ hơn so với trên ảnh mùi thì hơi đắng son rất lì nhé,2
shop giao hàng nhanh son rất mịn lâu trôi màu đẹp,2
son rất chi_là xinh_xắn lên màu đẹp mùi dễ_chịu chỉ có điều nhanh trôi nhưng với giá này thì rất ok rồi smiling_face_with_smiling_eyes,0
công_dụng son đẹp lắm kết_cấu vừa cx không bé độ bền_màu son lì son đẹp lắm màu lên môi rất ưng nhưng giao hàng hơi lâu,2
son đẹp lắm nha màu quốc_dân này thì khỏi bàn roi ạ siêu lì ko bị dính vào khẩu_trang nhiều lắm lau đi vẫn còn lớp tint nha,2
chất son bám lâu dễ tán k bị bết dính rất đáng tiền ship giao hàng rất dễ_tính,2
son dùng siêu thích í mn kiểu thơm mà lâu trôi í ưng lắm í nên mua,2
màu 203 hơi cam cam nhạt dạng bột nên có_vẻ nhanh trôi,0
son khá thơm test thử thấy khá ok có độ lì bám chắc vào môi nên thử trải_nghiệm,2
son màu xinh đã mua lần 2 son lì để được tầm 5 6 h nếu ko ăn gì son lì nhg ko khô mỗi lắm ngồi điều_hòa thì sẽ khô môi,2
công_dụng son moi o kết_cấu mềm_mại độ bền_màu đỉnh_cao r xuất_sắc nha mọi người oie nên mua ak gí quá hạt rẻ đi,2
công_dụng son_độ bền_màu okla hình_ảnh chỉ mang tình chất minh_họa giao hàng khá nhanh ok,2
màu lên môi mình ra màu hồng đất nhưng vẫn khá xinh màu son bám khá lâu nhé,2
sản_phẩm chất_lượng màu lên đều đẹp bao lỳ uống nước ko trôi test lên tay rửa tay chà vẫn còn bám tốt đóng_gói chắc_chắn có túi khí chống shock và hộp khá là đẹp nha,2
công_dụng son kết_cấu son_độ bền_màu tốt hm màu sáng hơn mình nghĩ nma cũng nên mua nha,2
công_dụng khong lì kết_cấu bột độ bền_màu k bênf khá thơm k lì k bền_màu cũng xinh rẻ nên cũng ok,0
son chất lỳ mướt mùi có chút vị cam lẫn mùi rượu mua với giá 16 k kh đòi_hỏi nhiều,2
giao đúng sản_phẩm check ra dc hàng chính son khá là mềm môi nhưng cx không lì cho lắm mùi rất thơm,0
giao hàng nhanh chất son lì mịn có mùi thơm bôi lên cảm_thấy nhẹ_nhàng,2
son sài ưng lắm lun thơm mùi cam đánh lên rất mềm và lâu trôi nên mua nha mn 3,2
thích sờ vỏ son cực min lắm màu đỏ nâu đẹp lắm màu ảnh như trên giá như vầy thì trôi nhanh rồi và tô phải tán ngay nhé k là k tán đuoc ý,0
son hơi bột bột màu son thì siêu xinhn bền môi c,2
công_dụng làm đẹp kết_cấu chất ổn và mịn lắm ạ độ bền_màu son bám môi tầm 3_4 tiếng đối_với mình là khá ổn,2
màu son đẹp chất son mềm mịn bền_màu khá tốt ảnh và video chỉ mang tính_chất nhận xu,2
giao hàng nhanh màu son ở ngoài tươi hơn trong hình với son nhanh trôi lắm,0
độ bền_màu 8 10 màu son mềm môi 10 10 màu thì 10 10 chi nhưng lì thì cũng k lì lắm,1
quá rẻ mà lại xịn xò vô_cùng chất kem mịn và khá lì hàng chính hãng nội_địa trung_quét được qr code check ra đúng hàng của hãng nha,2
công_dụng xinh kết_cấu cầm chắc tay độ bền_màu màu đẹp lỳ nha shop gói hàng bao cẩn_thận mua đồ mà gói hành thành xác_ướp ai cập luôn 10 đ cho khâu gói hàng giao nhanh hàng chính hãng siêu chất_lượng,2
son đẹp lắm lun á quý dị xịn xò nữa với cả mùi cực_kì thơm luôn á son lâu trôi giao hàng nhanh nữa mình ưng quá đi à mình mua lun 2 cây á nếu có cơ_hội mình sẽ quay lại ủng_hộ shop,2
son săn sale rẻ hơn tí 140 k màu bám lâu trôi ngon hơn hẳn,2
màu son đẹp chất son dễ tán hơi khô dung_tích son 2 mấy gr đó bằng nửa son bth giá rẻ khi uống nước cà_phê son trôi đi trông khá lem_nhem cần mang theo son để dặm lại,0
công_dụng đánh lên khá là mềm môi màu đẹp kết_cấu nhỏ gọn độ bền_màu mh mới thử lên chưa biết giao hàng rất lâu mh đặt hôm 27 12 mà nay mới nhận đc,1
công_dụng đánh_đẹp kết_cấu ghê độ bền_màu lì son đánh rất đẹp chất son mịn y,2
thiết_kế ưng chất son cũng khá là mướt không hẳn là lì nhưng không quá dễ trôi màu hơi tối so với màu ở ảnh vẫn ưng bụng với son và mức giá này rồi,1
công_dụng dungf kết_cấu nhung minj độ bền_màu 3 10 focalure mãi đỉnhg,0
mình có sẵn các loại belt này ai cần ib mình hoặc đr ig nhóe chất son lì sờ rất thích và rất nhẹ môi thỏi hơi nhẹ_tay và cảm_giác hơi ít nhưng so vs giá thì ok,2
công_dụng màu lên ko chuẩn mùi socola nhưng mk thấy hơi hóa_chất sao ý kết_cấu nhìn khá ngắn tầm như son thỏi ý que đánh thì bề_mặt to nhưng lỏng_lẻo khó đánh độ bền_màu ko bền đâu nha nhanh trôi dữ lắm thất_vọng vô_cùng thấy son mal nên cũng nghĩ ổn nhưng hàng về đúng buồn luôn thôi thì giá này cũng chả dám đòi_hỏi thêm,0
giao đúng màu bôi lên thấy mềm mịn giữ đc khá ko thích mùi cho lắm dùng đc phù_hợp vs giá tiền,2
màu lên đúng màu tuy_nhiên thì hơi nhanh trôi dùng đi chơi thì phải tô lâu_lâu xíu và chăm dặm lại,0
sản_phẩm đóng_gói cẩn_thận chưa test nên chưa biết giữ màu được lâu k,1
độ bền_màu 8 10 giao hàng nhanh đóng_gói cẩn_thận đập vào mắt là cái thiết_kế rất đẹp nhìn cây son sang_trọng j đâu lun á lên mà đẹp nửa mùi thì mình k thích ko thơm mà kỉu mùi của đất_sét tụi nhỏ hay chơi,2
kết_cấu khá đặc độ bền_màu không bền thấy màu đánh lên tay thì lên môi màu lại nghiêng về hồng hơn đỏ màu này hợp với da trắng hơn í,0
công_dụng làm đẹp kết_cấu hơi khô nhưng mịn màu đẹp độ bền_màu khá bền son xinh xỉu giá cũng rẻ vì săn sale ba màu đều đẹp,2
kết_cấu đẹp độ bền_màu có bám môi đâu mà biết công_dụng đẹp màu đẹp nhưng ko bám môi gì cả,0
sản_phẩm tốt màu lì màu không thơm cho lắm đánh lên môi khá ok mọi người nên mua ạ,2
màu này ko kén da nha mọi người mình khó chọn màu lắm luôn nhưng màu này mình ưng sắc đỏ nhiều cũng ít bị trôi mùi thơm mình ko thấy hăng giao hàng nhanh_chóng hàng chính hãng cái vỏ nhìn rất sang,2
son mùi thơm lâu trôi màu như hình sản_phẩm tốt giá rẻ mọi người nên mua nha,2
son lên màu siêu đẹp siêu lì chất son cũng mịn nữa sẽ còn ủng_hộ tiếp,2
độ bền_màu test thử với nước thì khá khó trôi son xinh xỉu hàng tận miền nam mà giao hàng còn nhanh hơn đơn mình đặt ở miền bắc expressionless_face,2
công_dụng màu lên tay cx oke kết_cấu son mịn hộp mỏng nhẹ độ bền_màu như mình thấy thì nó không có lì cho lắm vừa_mới xoa_tay là đã mất màu rồi chì mắt cx vậy nchung với giá này như vậy là cx ổn rồi giao lâu,0
rất ok bền_màu dề thương,2
là hàng oder nên giao hàng lâu gần 10 ng mới nhận đc hàng son lì bột nhg độ bám k tốt,0
son gọn_nhẹ thơm màu mịn nhanh trôi nhìn_chung phù_hợp với giá tiền,0
công_dụng xài ké son bạn thấy ưng nên mua kết_cấu mềm độ bền_màu lì nhưng k hẳn là lì lắm mn có_thể xem_xét lựa_chọn,2
kết_cấu dang kem độ bền_màu giữ được màu khá lâu màu đẹp lên môi chuẩn ship nhanh,2
son mịn và màu đẹp nhưng dễ trôi với giá này thì nói_chung là hợp_lý,0
màu đẹp cực_kỳ mình thấy son bám khá lâu trên môi mình kể_cả khi ăn_uống với giá tiền này thì sản_phẩm phải nói là chất_lượng ạ,2
công_dụng đệp lắm kết_cấu ổn độ bền_màu ok hàng ok nên mua k,2
hic màu này k xinh ăn vẫn bị trôi son thoi giao hàng hơi lâu,0
giao hàng nhanh son khó tán đều màu xinh dễ trôi mùi hơi ghê,0
công_dụng dùng để mix với những màu đậm vì màu này là màu nude như ảnh kết_cấu mịn độ bền_màu dễ trôi,0
công_dụng red_heart kết_cấu red_heart độ bền_màu red_heart màu xinh xĩu lun nha mn mình mua lần 2 rồi vẫn ưng màu này nhất son có mùi thơm nhẹ thích lắm mỗi tội giao hàng lâu xỉu,1
màu son 01 đẹp đỉnh lắm nhưng hơi khó tán dạng son kem nhưng hình_như son này hơi dễ trôi,0
hình_ảnh chỉ mang tính_chất nhận xu chưa dùng nên chưa biết như thế_nào son chắc dễ trôi,0
công_dụng lên màu đẹp mà hơi khô môi chút mùi thơm kiểu vanila kết_cấu đẹp độ bền_màu ko bền dễ trôi như son_dưỡng ấy crying_face,0
công_dụng màu này hợp làm lớp lót kết_cấu không mịn lắm để lại vân môi độ bền_màu tốt son có mùi thơm hàng đóng_gói cẩn_thận chắc_chắn giá rẻ chất_lượng phù_hợp với học_sinh,2
ảnh vid chỉ lấy xu thôi son màu đẹp lắm nhưng mà nhanh phai quá,0
chất son mịn kiểu như bột ạ mịn và không lì lắm đâu nha mọi người săn sale nên không đòi_hỏi 3 chỉ có giao hàng hơi lâu,0
ảnh và vd mang tính minh_họa thôi nhưng ta nói lên màu siêu xinh luôn á mềm mịn_mà lâu trôi nữa mồi ngọt ngọt thơm thơm rất thích nha red_heart,2
sản_phẩm thơm đánh mềm môi nhưng mà này có đánh lên có ánh_kim nên không ưng lắm với_lại bảo son lì nhưng k lì chút nào,0
son đẹp lì hàng quốc_tế nhưng giao rất nhanh phù_hợp vs giá tiền,2
son ổn nhưng khá nhanh trôi nha nhưng ncl màu cũng được vì rẻ mà,0
công_dụng giao hàng nhanh đóng_gói rất kĩ_càng rất đẹp và chắc_chắn độ bền_màu lên màu rất oke lên màu khá tôn da,1
hơi kén da tí nma lì mịn giao hàng nhanh bạn nào da trắng sài sẽ đẹp hơn,2
công_dụng màu đẹp độ bền_màu 60 màu son đẹp độ lì vừa phải đóng_gói cẩn_thận k có ảnh nên để tạm ảnh khác,2
rất đáng tiền nha chất son mịt mau khô son khá lì,2
son màu đẹp thơm mùi socola nhưng mà son không ăn môi cho lắm kiểu son tùy từng thỏi í mua 2 cây mà 2 chất khác nhau,0
công_dụng mua 8 cây lun ạ độ bền_màu rất bền rất hài_lòng về sản_phẩm shop nhiệt_tình giá rẻ klq nhưng bạn nào muốn thức khuya mà vẫn đẹp da thì uống yến chưng nhé hihihi,2
công_dụng bansm kết_cấu độ bền_màu,1
son đẹp k kì lắm,0
helo mình khá là ưng_ý với em son này vỏ rất đẹp và sang nha kèm theo đó là đóng gói cực chắc_chắn và cẩn_thận chất son mịn dễ tán màu giống hình khoảng 70 80 nhưng lên môi khá xinh và đặc_biệt là lâu trôi với một đứa rất ghét lúc ăn bị trôi như mình thì đây là 1 option hoàn_hảo,2
không giữ đc màu tốt lắm khi ăn vẫn bị trôi chắc do cơ_địa nên khiến môi hơi khô_shop đóng_gói ok kèm theo thiệp xinh_xinh rất đáng iêu,0
son màu chuẩn mùi nhẹ không thơm mấy chưa dùng nên không biết có lì không giá rẻ,1
mùi thơm chất son mềm ẩm nhưng lên môi nhẹ bám trên môi cũng khá tốt,2
màu son đẹp mịn mềm môi ko đc lì cho lắm giá hạy dẻ mà son chất_lượng,0
lì lắm cả nhà cả 2 thỏi romance với merzy mùi ulatroi luôn,2
son dùng thích ạ bền_màu nên mua,2
màu son đẹp nhưng k lì nhưng vs giá tiền vậy thì cũng duyệt white_heart,0
son lên đúng màu đánh lên môi mịn lâu trôi mua bốn màu đều trầm cả nên kén quần_áo mặc khi nào dùng hết thì mình ủng_hộ shop nha,2
son lên màu đẹp chất_lượng sản_phẩm tốt nhưng mau trôi,0
công_dụng bôi chứ nàm gì kết_cấu là son đó độ bền_màu không biết thật_ra là mình gửi nhầm sơn xuống nhà e mình chưa bt son thậth hay giả xấu hay đẹp nên nào nó về mình sẽ rv nha,1
