processed_data,target
5 ngày là có hàng rồi màu 403 siu đẹp nha mng chất son đẹp nên mua ạ,2
màu siêu ưng nhưng chất son thì dở quá không đều màu chất khô khó tán nên dưỡng môi trước khi dùng nhé,0
son lên màu đẹp mịn môi mùi thơm dê chịu đúng ha ng châ t lươ ng giao ha ng nhanh sẽ u ng hô tiê p tu c,2
màu ổn thôi nhưng mà nó kiểu dạng nhờn nhờn như có có dầu_ăn bên trong ý đánh ko tệp vào môi mà khi bặm môi nó kiểu trôi linh_tinh khó mà đều đc lòng môi nhưng vs giá quá rẻ như này thì ko_thể đòi_hỏi thêm đc tiền nào của nấy thôi nói_chung là vẫn đáng tiền,0
son lên màu mịn và thơm,2
chim_ưng ạ 3 đẹp hết chỗ chê rồi son tuy mịn mượt nhưng khá lỳ nếu k ăn_uống nhé,2
màu đẹp son thơm nhẹ đánh lên mịn rất ưng,2
mua son lần 2 rồi mk thích màu này mùi socola lên khá mịn môi nhưng cũng hơi nhanh trôi,2
công_dụng son kết_cấu lỏng độ bền_màu khá dùng rất mướt môi và mềm môi có mùi thơm,2
son mịn môi cực lên màu đẹp sáng da nữa ạ nên mua nha mn mới dùng nên k biết có lì hay không thumbs_up,0
đã nhận được hàng và rất ưng tone màu này chất son thì thôi khỏi bàn sẽ ủng_hộ dài_dài,2
son chất_lượng ổn phù_hợp với giá tiền chất son mềm mịn,2
son hơi hồng so với tưởng_tượng chất mềm mịn và thơm ncl ổn nha,2
son rẻ nhìn xịn xò lên môi không được đúng màu chất kem thơm mùi socola,1
giao hàng khá nhanh màu son đẹp chất ổn phù_hợp với giá tiền,2
son mềm môi cực màu cũng đẹp nữa mình mua lần này là lần thứ 2 rồi vẫn ưng nhà focalure nha,2
công_dụng son làm trắng da trắng răng kết_cấu kem lì độ bền_màu 3 h màu nhiều sắc nâu hơn blr a12 màu son làm trắng da trắng răng dùng được cho mặt mộc nha,1
son đẹp mềm mịn siêu thích,2
đồ từ trung_quốc nên vận chuyện tận 10 ngày ms lấy đc được cái màu son nhìn đẹp cũng mịn nữa điểm trừ là nó không thơm với giá rẻ vậy thì quá oke rồi cảm_ơn shop nhiều nhé,2
công_dụng đánh môi đánh mắt kết_cấu mềm mịn độ bền_màu lì giao hàng nhanh đóng gói cũng tốt dth màu lên môi xinh_đẹp khá chuẩn hợp mọi outfit,2
công_dụng tốt kết_cấu kem độ bền_màu ổn son mềm nhẹ môi bao_bì mới keng màu đẹp khỏi bàn_giao nhanh luôn sẽ ủng_hộ lần sau nhé iu_shop,2
shop gửi đúng phân_loại hàng chất kem mịn dễ blend nhưng nhanh trôi chất làm base môi và phấn má khá hợp vì tán rất dễ và đều hoặc hợp make sương sương thơ thơ,2
son màu xinh cực giao hàng khá nhanh bôi lên môi không bị khô nó chung là nên mua,2
công_dụng a kết_cấu xinh độ bền_màu okok,2
chất son không được thích cho lắm màu thì oki mà có_vẻ không hợp với mình vì bị đậm với già quá,0
không ngờ luôn á chất son_mịn cực_kì 2 màu mình mua rất đẹp không bị bột hay vệt nhẹ môi nữa vỏ cũng rất xinh luôn còn bám lâu không thì chưa biết nhưng rất thích nha,2
giao hàng nhanh son đẹp cầm chắc tay màu son xinh xỉu đánh lên môi mỏng nhẹ,2
giao hàng khá lâu đóng_gói soi cẩn_thận chất son xinh không khô môi,2
tuyệt_vời son xịn mịn,2
màu đẹp hơn so với mình nghĩ chất mau khô có độ lì nhẹ trên môi giao hàng nhanh,2
kết_cấu đóng_gói cẩn_thận độ bền_màu chưa test thử nên chưa biết son màu khá ưng vỏ mịn đẹp,1
chất son mướt màu son đẹp và hợp vào mùa đông đây là thỏi thứ 2 rồi,2
shop giao hàng nhanh son rất mịn lâu trôi màu đẹp,2
công_dụng son đẹp lắm kết_cấu vừa cx không bé độ bền_màu son lì son đẹp lắm màu lên môi rất ưng nhưng giao hàng hơi lâu,1
màu này như màu cánh hồng khô hồng đất í đánh lên khá tôn da mlb nữa mà chất thì đánh lên set lại môi liền nha,2
chất son bám lâu dễ tán k bị bết dính rất đáng tiền ship giao hàng rất dễ_tính,2
hình_ảnh son mk cảm_giác bột quá nhìeu đánh k được đẹp,0
màu 203 hơi cam cam nhạt dạng bột nên có_vẻ nhanh trôi,1
son màu xinh đã mua lần 2 son lì để được tầm 5 6 h nếu ko ăn gì son lì nhg ko khô mỗi lắm ngồi điều_hòa thì sẽ khô môi,1
son phải nói là xinh xỉu luôn mn ạ nhìn ca i vo son cũng thi ch lắm đánh lên môi mà nó có cái mùi đa o trời ơi mê lắm son mềm mịn đúng là hơi kho ta n chút đánh lên trắng da chất lươ ng cực mn nên mua ạ,2
hình_ảnh và video chỉ mang tính_chất nhận xu thôi son bị vón cục nhưng vẫn dùng đc,0
màu 302 đẹp nhất 402 thì cũng đc giống merzy m5 còn 501 thì n nhạt lắm k đậm như son mịn nhưng khó tán cực nhất là 501 3 thỏi đều khó tán lònh môi k ăn lòng môi tẹo nào,1
son mịn_shop đóng_gói kĩ_càng chất_lượng cũng ổn_áp lắm giao đúng màu mình săn được giá sale 40 k nên rất hài_lòng luôn,2
mình có mua hai em 403 404 hot nhất sau khi test hai em lên tay mình lại thích 404 hơn vì em có sắc đỏ mà ko bị kén da về cơ_bản_chất son hơi khó tán ó và màu lên cũng oke nhưng ko có gì nổi_trội và ngạc_nhiên quá,0
cũng oke với cái giá này có điều tán son khó với chất son cũng k mịn lắm,0
son xinh chất son mịn hình_ảnh và video chỉ mang tính_chất nhận xu beating_heart,2
mình mua 2 màu 402 và 404 một lên màu cam đất và một lên đỏ rượu nha mn thấy ok chất son thơm lắm,1
mịn,2
màu đẹp mềm môi hương thơm shiper thân_thiện tuyệt_vời,2
công_dụng son moi o kết_cấu mềm_mại độ bền_màu đỉnh_cao r xuất_sắc nha mọi người oie nên mua ak gí quá hạt rẻ đi,2
son chuẩn màu xịn xò nma hơi khô khi tô tuy nhien với giá này là tuyetzoi lắm rùi,0
chất son mịn đẹp ship nhanh đóng_gói rất kỉ giá lại rất rẻ,2
lần thứ 2 đặt em son này của perfect diary mình kiểu vẫn là say_đắm từ màu_sắc cho đến chất son mịn mềm kèm chút hương thơm rất khó diễn_tả cherries dùng em này mọi người dưỡng môi kĩ với tdc môi là màu lên càng đẹp nha red_heart smiling_face_with_hearts,2
về chất son thì khỏi bàn rồi smiling_face_with_heart eyes ship hơi lâu xí,2
khi xem review thấy nói em này là son kem mình đã 3 4 năm gì đó rồi ko sd son kem lì mình hơi do_dự khi mua nhưng mà mình lại thấy giá rẻ nhiều màu đẹp nên mình khá mong_chờ thật_sự không làm mình thấy vọng chất son kem đã đc cải_tiến nhiều không còn khô như ngày_xưa nữa màu rất đẹp rất ưng,2
màu xinh lắm mõi tội để lại vân môi giao xiu nhanh chất_lượng ỗn lắm nên mua hình_ảnh mang tính_chất nhận xu red_heart,0
màu son ưng dã_man ý đánh thử cảm_giác mềm mịn k bị vón cục mua được giá rẻ nên sẽ ủng_hộ tiếp,2
công_dụng son kết_cấu son_độ bền_màu tốt hm màu sáng hơn mình nghĩ nma cũng nên mua nha,1
shop đóng_gói cẩn_thận ạ chất son mướt màu lên cũng xinh lắm mình săn sale nên giá khá rẻ mình swatch son không chuyên_nghiệp nhưng nói thật là chất son rất đẹp đáng mua lắm đó,2
công_dụng khong lì kết_cấu bột độ bền_màu k bênf khá thơm k lì k bền_màu cũng xinh rẻ nên cũng ok,1
son chất lỳ mướt mùi có chút vị cam lẫn mùi rượu mua với giá 16 k kh đòi_hỏi nhiều,2
son đánh khả_mượt khô nhanh đầu son miềm mướt giao nhanh rẻ 2_cay mà có 9 k à màu đẹp red_heart lần sau sẽ ủng_hộ shop mik đã quét mã son chính hãng nha red_heart,2
giao đúng sản_phẩm check ra dc hàng chính son khá là mềm môi nhưng cx không lì cho lắm mùi rất thơm,2
ko uổng_công mong_mỏi hàng về shop đóng gói hàng cẩn_thận chất son đánh lên môi rất mướt và mịn có mùi thơm nhẹ sẽ ủng_hộ tiếp ạ,2
mình mua lần thứ 2 chất son thấy mịn á lên màu chuẩn có mùi hương nhẹ mua 2 màu v17 18 nhưng mình thấy màu v17 dễ xài hơn v18 nâu có ánh cam hợp da trắng mình tone da lạnh nhưng đánh màu v18 lợt thấy đẹp còn đậm thấy dừ sao đó nói_chung cũng nên thử ne rẻ mà thiết_kế đẹp chất son okela nhe 5 star,2
giao hàng nhanh chất son lì mịn có mùi thơm bôi lên cảm_thấy nhẹ_nhàng,2
mua của shop nhiều r nên sp miễn bàn chất son mịn mướt khá lì giao đủ sp đúng số_lượng và mẫu_mã đóng_gói khá chắc_chắn mng nên mua nha nhờ có điều hàng từ nc ngời nên n ship hơi lâu 1 chút,2
đã nhận được hàng shop giao đúng và đủ mẫu đặt_hàng quốc_tế nên từ 12 2 mới nhận dc hàng nè màu son hơi sáng so với ảnh mẫu đánh thì phải chất son mùa đông này hơi khô phải có thêm lớp dưỡng ở dưới ms chịu dc nha mn nchung vs giá tiền như vậy so vs chất_lượng son thì oke cho shop 5 sao,0
màu son lên môi đẹp mịn mướt mùi thơm nhẹ đúng đỉnh luôn mua lần đầu nhưng mà chất_lượng lắm sẽ ủng_hộ shop dài_dài smiling_face_with_hearts,2
son sài ưng lắm lun thơm mùi cam đánh lên rất mềm và lâu trôi nên mua nha mn 3,2
son màu oke lắm mùi khá thơm đánh lên rất mịn luôn smiling_face_with_hearts rất đáng tiền mua luôn see no evil_monkey,2
thích sờ vỏ son cực min lắm màu đỏ nâu đẹp lắm màu ảnh như trên giá như vầy thì trôi nhanh rồi và tô phải tán ngay nhé k là k tán đuoc ý,1
son hơi bột bột màu son thì siêu xinhn bền môi c,0
son màu xinh cực chất son mềm mà màu ra cx ok lắm luôn ý nói_chung là nên mua nha ảnh để lấy xu thôi ạ,2
son lên màu xinh nha mn nhưng chất thì mình k thích lắm vs giá tiền này thì quá ok r ạ,0
son đẹp lắm mng với lên mướt môi cực_kì màu 12 với 25 thì k_thể chê vào đâu được,2
vỏ son đẹp màu lên môi cũng xinh mềm môi nói_chung là rất ưng í luôn,2
giao hàng hơi lâu nhưng do dịch nên ko sao đóng_gói cẩn_thận mùi như socola đồng xu hồi bé ăn_ý màu đẹp hợp cho da trầm như mình chất son ko mướt hẳn vẫn hơi bị bột li_ti lúc đánh lên môi và một_số chỗ chưa đều màu ncl với giá thì ntn là ok r,0
công_dụng làm đẹp kết_cấu chất ổn và mịn lắm ạ độ bền_màu son bám môi tầm 3_4 tiếng đối_với mình là khá ổn,2
son xinh lắm nha giao nhanh nữa đó giờ mua son toàn mua của bia chất son mịn xinh lắm luôn mng nên mua nha smiling_face_with_hearts,2
màu son đẹp chất son mềm mịn bền_màu khá tốt ảnh và video chỉ mang tính_chất nhận xu,2
mùi thơm màu xinh giao hàng nhanh tuy_nhiên thì son hơi khô khó tán,0
độ bền_màu 8 10 màu son mềm môi 10 10 màu thì 10 10 chi nhưng lì thì cũng k lì lắm,2
dùng thích lắm ạ đánh lên môi mướt lắm lun lần sau sẽ ủng_hộ tiếp ạ smiling_face_with_hearts đóng_gói cũng cẩn_thận nma giao hơi lâu ạ,2
quá rẻ mà lại xịn xò vô_cùng chất kem mịn và khá lì hàng chính hãng nội_địa trung_quét được qr code check ra đúng hàng của hãng nha,2
giao hàng tầm chưa đến 1 tuần màu xinh mượt có mùi thơm nhẹ của socola woman_in_steamy_room đắt tiền lắm mng ưi,2
công_dụng xinh kết_cấu cầm chắc tay độ bền_màu màu đẹp lỳ nha shop gói hàng bao cẩn_thận mua đồ mà gói hành thành xác_ướp ai cập luôn 10 đ cho khâu gói hàng giao nhanh hàng chính hãng siêu chất_lượng,1
shop về đủ hàng đúng màu vì em mua dùm nên ko nhận_xét chất son ntn,1
chất son khá mướt môi k bị khô mùi k thơm hơi khó_chịu tí nhưng bù lại màu đẹp xuất_sắc với giá tiền ý thì trên cả mong_đợi,2
màu son đẹp chất son dễ tán hơi khô dung_tích son 2 mấy gr đó bằng nửa son bth giá rẻ khi uống nước cà_phê son trôi đi trông khá lem_nhem cần mang theo son để dặm lại,2
công_dụng đánh lên khá là mềm môi màu đẹp kết_cấu nhỏ gọn độ bền_màu mh mới thử lên chưa biết giao hàng rất lâu mh đặt hôm 27 12 mà nay mới nhận đc,2
công_dụng đánh_đẹp kết_cấu ghê độ bền_màu lì son đánh rất đẹp chất son mịn y,2
chất son mịn đặc k vón vỏ nhám nhám cầm chắc tay màu son giống ảnh tầm 70 đối_với môi mình thì son lên màu ánh_hồng nhiều hơn là đỏ ánh xám màu son làm sỉn màu răng khá nhiều,2
giao hàng lâu thiệt sự son màu rất xinh nma hơi khô với giá này thì ok ạ,0
chất son so với giá tiền là quá ok thỏi o5 có mùi như mùi socola luôn vỏ son siêu cute,2
thiết_kế ưng chất son cũng khá là mướt không hẳn là lì nhưng không quá dễ trôi màu hơi tối so với màu ở ảnh vẫn ưng bụng với son và mức giá này rồi,2
màu xinh lắm chất son mềm mịn hơn mong_đợi rất nhiều minh mua lại lần 2 vẫn rất ưng,2
công_dụng dungf kết_cấu nhung minj độ bền_màu 3 10 focalure mãi đỉnhg,2
son khá là thơm đánh lên môi mịn son nhanh khô nha smiling_face_with_heart eyes smiling_face_with_hearts face_blowing_a_kiss nói_chung là oke rồi á,2
màu xinh dã_man luôn ạ chất son xịn mịn hộp xinh dã_man gói cẩn_thận cầm chắc tay không bị lỏng_lẻo như 1 số son rẻ_tiền rất đáng tiền,2
son giao đúng màu đóng_gói kỹ săn sale 2 cây chưa tới 30 k chưa xài thử nên chưa biết chất son như nào giá này thì nên mua nha,1
son minh đánh lên k thấy anh cam thấy giống màu 03 mềm mịn OK_hand,2
son mịn màu đẹp còn lại thơm mùi nữa sẽ ủng_hộ shop nhiều smiling_face_with_hearts,2
son đẹp wá trời lun á mùi ngửi kĩ thấy thoang_thoảng giống vị quả cam chất son mềm mịn,2
mình có sẵn các loại belt này ai cần ib mình hoặc đr ig nhóe chất son lì sờ rất thích và rất nhẹ môi thỏi hơi nhẹ_tay và cảm_giác hơi ít nhưng so vs giá thì ok,2
công_dụng màu lên ko chuẩn mùi socola nhưng mk thấy hơi hóa_chất sao ý kết_cấu nhìn khá ngắn tầm như son thỏi ý que đánh thì bề_mặt to nhưng lỏng_lẻo khó đánh độ bền_màu ko bền đâu nha nhanh trôi dữ lắm thất_vọng vô_cùng thấy son mal nên cũng nghĩ ổn nhưng hàng về đúng buồn luôn thôi thì giá này cũng chả dám đòi_hỏi thêm,0
đóng gói hàng rất kĩ luôn chất son mịn mềm môi màu bôi lên môi rất đẹp nên mua nha mn,2
giao đúng màu bôi lên thấy mềm mịn giữ đc khá ko thích mùi cho lắm dùng đc phù_hợp vs giá tiền,2
son dùng mãi quen rồi mềm mịn và màu đẹp giao hàng cũng nhanh,2
màu son đẹp giao hàng nhanh_shop đóng_gói kĩ chắc_chắn màu lên môi hơi bị tối nhưng là ok màu son mềm thơm mịn lắm rất đáng tiền nha mn,2
kết_cấu khá đặc độ bền_màu không bền thấy màu đánh lên tay thì lên môi màu lại nghiêng về hồng hơn đỏ màu này hợp với da trắng hơn í,0
công_dụng làm đẹp kết_cấu hơi khô nhưng mịn màu đẹp độ bền_màu khá bền son xinh xỉu giá cũng rẻ vì săn sale ba màu đều đẹp,2
giao hàng hơi lâu nhưng bù lại chất son mướt đánh lên tay màu chuẩn không biết lên môi thế_nào,2
màu son lên rất đẹp đánh_hơi khô môi mùi cam nhẹ nhẹ nói_chung là nên mua,0
kết_cấu đẹp độ bền_màu có bám môi đâu mà biết công_dụng đẹp màu đẹp nhưng ko bám môi gì cả,2
hàng y_như mẫu bao đẹp và đánh lên mịn k đau môi giao hàng cũng nhanh mình khuyên mọi ng lên mua nha,2
chất son mịn có mùi hương_liệu hơi nồng nên ai không thích son quá có mùi nên cân_nhắc vỏ son xin son thỏi mịn,2
son mẫu_mã đẹp mùi thơm nhưng chất son hơi bột k tệp vào môi màu lên cũng k như_ý lắm giao hàng hơi lâu giá rẻ nên cũng k_thể kì_vọng quá nhiều vào chất_lượng mình vẫn đánh_giá 5 sao cho đóng_gói hình_thức và mùi thơm,0
son lên màu siêu đẹp siêu lì chất son cũng mịn nữa sẽ còn ủng_hộ tiếp,2
son đẹp thơm mềm mịn môi,2
công_dụng màu lên tay cx oke kết_cấu son mịn hộp mỏng nhẹ độ bền_màu như mình thấy thì nó không có lì cho lắm vừa_mới xoa_tay là đã mất màu rồi chì mắt cx vậy nchung với giá này như vậy là cx ổn rồi giao lâu,2
chất son_đẹp phù_hợp với giá tiền sẽ mua thêm vào lần sau nữa,2
son đẹp bôi mịn nhưng cái nắp trong cứ bị dính vào nắm son ý với giá này thì quá ổn mọi người nên mua ạ,2
son mướt mịn nhưng lên môi không đều màu cho lắm bao_bì đẹp gói hàng chắc_chắn,2
công_dụng màu lên đẹp kết_cấu đặc đóng_gói sản_phẩm rất đẹp và chắc_chắn thời_gian giao hàng nhanh sẽ ủng_hộ shop lại,1
son màu đẹp mịn nhưng lỡ đặt màu không hợp với da nhưng không sao mình mix với màu khác vẫn đẹp vận_chuyển hơi lâu nữa tháng mới có shiper nhiệt_tình sẽ ủng_hộ shop thêm nữa,2
giao hàng nhanh son mịn mà còn thơm mùi kẹo nữa mình mới đặt thêm 2 c,2
son gọn_nhẹ thơm màu mịn nhanh trôi nhìn_chung phù_hợp với giá tiền,2
son thơm mềm mịn lắm luôn ýy mọi người ơi màu chuẩn nhé chính hãng nè mình thích lắm luôn,2
son lên màu chuẩn đẹp k bị khô môi mùi cũng thơm nữa,2
đẹp mịn rất ổn,2
son ok nhé mn chất_lượng khỏi chê luôn màu đẹp bôi mềm mịn lắm,2
công_dụng xài ké son bạn thấy ưng nên mua kết_cấu mềm độ bền_màu lì nhưng k hẳn là lì lắm mn có_thể xem_xét lựa_chọn,2
hình_ảnh mang tchat săn sale chất son khá ổn,2
son kem rẻ chất son hơi bột và không dính môi mình chắc tại môi mình không hợp nhưng săn sale với giá này thì quá hợp_lí,0
kết_cấu dang kem độ bền_màu giữ được màu khá lâu màu đẹp lên môi chuẩn ship nhanh,1
son màu đẹp giá rẻ nhưng đánh lên rất mịn mượt thơm nhẹ_nhàng tôi rất ưng_ý với sản_phẩm này,2
son màu rất đẹp chất lì oke lắm giá rẻ đáng mua lắm nhé smiling_face_with_hearts sản_phẩm quá chất_lượng,2
son mình thấy lên màu cũng được khô nhanh lắm luôn ấy nên phải bặm môi nhanh chứ ko nó khô thành một cục luôn nhưng mà với giá_thành nay thì quá oke luôn rồi,0
son mịn mướt lên môi nhẹ kh dính bết màu lên siêu xinh luôn ạ sẽ ủng_hộ nhiều lần,2
mùi socola thơm lắm ạ sản_phẩm phù_hợp với giá tiền chất son ko tốt lắm mn cân_nhắc trước khi mua na,0
son mịn và màu đẹp nhưng dễ trôi với giá này thì nói_chung là hợp_lý,2
son màu đẹp được giảm_giá nên rất rẻ chất son ok giao hàng nhanh,2
son đẹp chất mướt màu không bị cam quá ok sp giao nhanh có buble kèm hộp mịn,2
hình_ảnh và video để nhận xu son chất đẹp lắm màu lên xynh dùng thích lắm mùi nó tựa như mùi của blr ý,2
màu 402 nhé màu siêu đẹp nhưng cá_nhân mình không thích chất son cho lắm vẫn 5 sao,0
mùi son không thơm lắm chất son thì đỉnh của chóp dùng lần này là thỏi thứ hai rồi màu tôn da,2
thời_gian giao hàng nhanh son chất đẹp mùi thơm dễ_chịu tuyệt_vời,2
hàng khá xinh châts son đúng giá ạ lên màu cx ok cảm_ơn shop nha,2
du ng son râ t châ t lươ ng lên ma_u đe p son mi n lă m nha shop,2
công_dụng đệp lắm kết_cấu ổn độ bền_màu ok hàng ok nên mua k,2
vỏ son xịn mùi socola rất thơm tuy_nhiên son hơi bột khô môi và màu 204 lên môi mình giống hồng cánh sen hơn là hồng đất mình săn sale có 23 k thôi nên giá này chấp_nhận đc ổn nhé mn,0
màu son bên ngoài đậm hơn trên ảnh nhiều chất hơi xốp nch thì cũng đẹp lắm,1
son hơi bột và chẳng ăn vào lòng môi tạm được màu đẹp,0
hàng đóng_gói cẩn_thận và đẹp son mịn lắm đúng màu nữa nên mua nhé,2
giao hàng nhanh son khó tán đều màu xinh dễ trôi mùi hơi ghê,0
son màu 402 siêu xinh lun 3 màu đẹp chất son ổn mùi thơm,2
chất son đẹp mịn màu lên giống hình chất_lượng sản_phẩm tuyệt_vời so với giá tiền mỗi tội vỏ hơi bị méo một tẹo,2
công_dụng dùng để mix với những màu đậm vì màu này là màu nude như ảnh kết_cấu mịn độ bền_màu dễ trôi,2
công_dụng red_heart kết_cấu red_heart độ bền_màu red_heart màu xinh xĩu lun nha mn mình mua lần 2 rồi vẫn ưng màu này nhất son có mùi thơm nhẹ thích lắm mỗi tội giao hàng lâu xỉu,1
giao hàng nhanh chất son đẹp,2
màu son 01 đẹp đỉnh lắm nhưng hơi khó tán dạng son kem nhưng hình_như son này hơi dễ trôi,0
chất_lượng sp tuyệt_vời son đúng màu khi đánh lên son mềm mịn nhất_định sẽ quay lại nhiều lần 3 yrshop,2
son mịn lên môi hơi bóng có mùi thơm thơm nói_chung là khá ưng,2
công_dụng lên màu đẹp mà hơi khô môi chút mùi thơm kiểu vanila kết_cấu đẹp độ bền_màu ko bền dễ trôi như son_dưỡng ấy crying_face,2
công_dụng màu này hợp làm lớp lót kết_cấu không mịn lắm để lại vân môi độ bền_màu tốt son có mùi thơm hàng đóng_gói cẩn_thận chắc_chắn giá rẻ chất_lượng phù_hợp với học_sinh,0
không nghĩ son lại đanh đẹp thế son mịn đánh lên môi dsc đây là son nội_địa lần đầu_tiên thấy ưng thế video chỉ mang tính_chất nhận xu,2
chất kem khác đặc mùi nồng quá vỏ hộp k hề chắc_chắn tem mác dán còn lởm nhởm,0
son bao xinh bao xin nha mọi người chất son như mô_tả hàng mùa dịch nhưng giao siêu nhanh ảnh và video chỉ mang tính_chất nhận xu mọi ng bỏ_qua nhé grinning_face_with_sweat,2
chất son mịn kiểu như bột ạ mịn và không lì lắm đâu nha mọi người săn sale nên không đòi_hỏi 3 chỉ có giao hàng hơi lâu,2
giao hàng khá nhanh đóng_gói sản_phẩm đẹp và chắc_chắn mới dùng nên chưa thấy hiệu_quả cần thời_gian dùng thêm chất son kiểu bột môi mà bị thâm đánh lên k hợp,0
đóng gói cẩn_thận chống sốc tốt màu đẹp lắm đúng màu mình thích nếu xài tốt không bị khô môi mình sẽ tiếp_tục ủng_hộ,1
son màu siêu đẹp ạ đánh lên môi nhẹ môi v17 và v18 đều ok đóng gói siêu chắc_chắn còn đc tặng quà nữa ưng quá,2
ảnh và vd mang tính minh_họa thôi nhưng ta nói lên màu siêu xinh luôn á mềm mịn_mà lâu trôi nữa mồi ngọt ngọt thơm thơm rất thích nha red_heart,2
hơi lem nhưng thoa lên môi thì mềm k khô bé bé xinh_xinh hợp giá tiền,2
bao_bì phải nói rất là xịn 10 10 chất em này mịn mướt màu son như ảnh rất xinh dùng làm lớp base rất đẹp,2
từ ngoài vào trong đều xinh luôn ấy vỏ son mùi hơi khó_chịu chút thôi son lên môi mịn mướt,2
hình_ảnh chỉ mang tính_chất nhận xu son lên màu không giống hình nhưng chất son mịn mướt kh khô môi,2
màu 505 là hồng nhẹ như cánh hoa_hồng ấy còn màu 402 đỏ đậm pha ánh_hồng cá_nhân mình thấy hơi khô môi mua giá 90 k cho 2 cây khá ổn,0
son kem màu khá ổn nhưng chất kem hơi khô cảm_giác như nhiều bột quá,0
hơi kén da tí nma lì mịn giao hàng nhanh bạn nào da trắng sài sẽ đẹp hơn,2
màu đẹp nâng tone da lắm đánh lên môi mịn phù_hợp đánh mặt mộc í nhưng mình nhìn bên trong son hơi ít,2
hình_ảnh mang tính_chất nhận xu son oke đẹp hơi khô môi mùi nồng mà tổng_thể xinh,0
công_dụng sjajsjs kết_cấu độ bền_màu shsj son này màu hơi tươi k đc đẹp lắm chất son ổn mình cảm_giác k hợp màu này vì môi mình dày môi mỏng chắc hợp màu hơn cảm_thấy hơi tiếc,2
sản_phẩm tốt chất son mịn thơm mùi socola đánh lên k bị khô màu lên đẹp,2
với giá này nhưng son vô_cùng mịn chất_lượng nhưng hơi ít smiling_face_with_hearts chúc_shop buôn_bán phát_đạt ạ k hình_ảnh vd mag tính_chất lấy xu,2
rất đáng tiền nha chất son mịt mau khô son khá lì,2
