processed_data,target
giao hành nhanh đóng_gói kỹ càng màu son giống như trên hình có mùi thơm nhẹ đánh lên môi rất mềm mịn nhẹ môi rất thích,2
son đẹp mua lần này này thứ 2 rồi màu xinh nhanh trôi chỉ đi chơi thôi chứ đi ăn là trôi hết chất son mịn màu đỏ nâu xinh cỉu luôn á,2
màu son xinh lắm chất mịn cũng khá lì so vs giá thì ok r okmk,2
đây là màu son của hãng nha cả nhà mịn không khô đâu nma k lì huhu hun cái là bay hết,2
son đánh mềm nhg mình mua màu này đánh tự_nhiên quá như ko đánh grinning_face_with_sweat,2
son mềm mịn mà lì lắm nha đã mua và nghiện luôn màu son đẹp rất nên mua,2
cách đóng_gói hàng của shop mềnh rất chi_là ưng_ý luôn á vỏ son đẹp lắm ý màu thì hơi lỏng nhưng đợi khổ sờ lên thì ko bị dính ra_tay các bạn lên mua nha màu 941 rất giống vs màu son a12 br ý hợp vs mấy pạn có tông gia ko đc sáng cho lắm,0
vỏ son đẹp chất son quá tuyệt mịn có độ_ẩm cho môi lên màu đẹp trôi son sẽ có lớp son lì cho shop 5 sao,2
chất son mềm màu lên chuẩn đều màu độ bám k lâu lắm nói_chung khá thích,2
son thơm mùi lần lấy som ra thì cọ ra hơi nhiều nếu mng muốn đánh lòng môi như mình thì ph gạt bớt vào thành son nhìn hơi mất thẩm_mĩ nma kh trách_shop đc smiling_face_with_tear giao hàng nhanh lắm nha,2
son đẹp nhưng mà không giống màu hình chất đẹp hình_ảnh và video mang tính_chất lấy xu,2
cũng đc chất son ko lì lắm nhanh trôi,1
son màu xinh lắm nha mn nên mua nhé giá hs nha đặc_biệt son k bị vón lại,2
công_dụng de son dep nha mn mua ik mua ik ahihi kết_cấu min độ bền_màu bam mau lau sắp tết r mn mua đi nha,2
công_dụng son màu nude đẹp kết_cấu chất kem xốp dễ đánh_hơi khô môi độ bền_màu rất dễ trôi với giá_thành như_vậy thì chất_lượng vầy là quá ổn mặc_dù dễ trôi với hơi khô môi nhưng màu lên giống với hình,0
công_dụng làm đẹp kết_cấu dạng thỏi độ bền_màu cũng được,1
son có mùi thơm như socola ý chất nó lạ lạ mà cũng ok mix với màu nâu đất xinh lắm luôn,2
shop đóng_gói chắc_chắn ko bị méo gì luôn son có mùi thơm nhẹ_nhàng có một lớp dưỡng nên khi đánh ko bị khô môi nói_chung là rất ưng,2
son xinh mỗi tội giao hàng hơi lâu son khó tán nhưng màu đẹp đóng_gói sản_phẩm tốt,0
video chỉ mang tính_chất nhận xu giao hàng nhanh chất son mịn nhưng màu 302 thì ko ưng lắm nàu 402 thì quá ok lên màu rất đẹp,2
công_dụng tô son nha kết_cấu đẹp độ bền_màu dễ trôi tông màu ổn g giao hàng nhanh đúng sản_phẩm,2
mua hộ bạn nhưng có một cây nên test cho mn coi nhé chất son mk thấy mịn cũng dc màu đẹp cả màu 05 cũng đẹp lắm nhé,2
giao hàng quá nhanh luôn á chất son mình thấy cũng không lì cho mấy mà màu thì đỉnh,1
shop giao đúng màu anh ship dthw nhưg son khá khô và khó tán,0
công_dụng son môi kết cấu dạng kem độ bền_màu 1 2 h màu son đẹp ko bị khô môi video mang tính_chất lấy xu,2
son đã thêm nhiều dưỡng hơn rồi nè lên môi mịn mướt hơn hẳn những đợt trước mùi thơm nhẹ trôi khá nhanh,2
son chất mịn ko phải son lì nên lau xíu là trôi hết nhưng giá này đc cây son vậy thì tuyệt_vời red_heart,2
giao hàng nhanh shop gói hàng cực_kì kĩ luôn nè màu son đẹp và có dưỡng ẩm 10 10 ạ,2
tông màu đỏ đậm hợp mùa đông hơn hè package của tpd thì k có j bàn đẹp mê_hồn nắp son bằng nhung nên sễ bẩn chất son mềm mượt na_ná chất bia nhưng ít bột hơn,2
hơi bột bám màu kém nhưng màu đẹp giá này,0
son thơm mịn màu ko ưng cho lắm nhưng chắc tại mìn ko hợp thui nên mua nhé mn tặngw_shop 5 shoao thumbs_up,2
giao hàng hơi lâu nma chất_lượng lắm nha màu v18 hơi trầm nên phải makeup mới đẹp nma mình là mình vẫn thích chất son thích lắm kh bột kh khô,2
sp tốt dạng kem cần chắc tay đơn quốc_tế hơi lâu đóng_gói cẩn_thận,1
son lên màu đẹp mịn như nhung,2
giao hàng khá nhanh hàng rất giống ảnh nhưng son không đc mịn lắm,0
đóng gói sản_phẩm đẹp chất son mềm môi bao_bì đẹp nhưng có_vẻ màu này hợp với các bạn ten hơn thì phải,2
son thơm lên màu đẹp mướt giá_thành hợp_lý phù_hợp với túi_tiền học ảnh chỉ mang tính_chất nhận xu,2
độ bền_màu bthg công_dụng đẹp kết_cấu mịn son lên môi đẹp mềm mịn chất_lượng sản_phẩm tuyệt_vời,2
mọi người cứ nhìn chất son em test lên tay là mn biết nó chất_lượng xinh_xẻo như thế_nào rùi nha,2
kết_cấu khá tốt_shop giao đúng đủ hàng đóng_gói gọn_gàng sản_phẩm giao hơi lâu chưa dùng thử nhưng thấy có_vẻ chất_lượng,2
công_dụng thơm kiểu sôcôla á kết_cấu mịn độ bền_màu không bền,2
chất_lượng tốt chất son nhẹ lâu trôi không khô nứt môi rấ đáng mua,2
phấn mắt dùng thích vch son hơi bột mùi hơi lạ ncl mình k thích mùi shop giao thiếu son,0
son thơm chất son mềm lì môi đánh rất thích giao hàng nhanh,2
ở ngoài màu đậm hơn cam đất_son thơm chất dùng mượt ok hơi lì,2
son mềm môi mà màu xinh quá_trời lun ạ ảnh với vud mang tính lấy xu ạ,2
son mùi nhẹ đánh lên mịn nhưng m tháy k lì lắm hợp vs giá tiền nha mọi người red_heart,2
shop giao hàng nhanh chất son rất lỳ lâu trôi mình lấy nước rửa rửa cũng mãi mới sạch nên mua nhé mọi ng,1
công_dụng đẹp kết_cấu mịn độ bền_màu chưa biết vận_chuyển nhanh sang xịn mịn lắm ạ sẽ ủng_hộ dài_dài,2
hàng giao hơi lâu nhưng bù lại son thơm vs chất mịn lắm nha sẽ ủng_hộ shop tiếp,2
son đẹp đây là thỏi t2 mình dùng rùi chất mịn lắm thơm mùi cafe rẻ nữa,2
công_dụng len mau dep kết_cấu kem độ bền_màu lau troi son cầm chắc tay màu lên đẹp lâu trôi nên mua,1
màu tươi là 302 màu còn lại là 402 chất son khô nhanh nên mng phải tán nhanh vỏ cũng đc lọ 402 bị hở xíu xiu kh ảnh_hưởng đến chất_lượng nên kh sao có mùi thơm bôi lên môi 1 tgian sẽ hay son có dưỡng bôi nhìn sẽ thấy nma kh bóng quá đâu màu son mình chụp y_chang màu ngoài nên mua,1
son đẹp mềm min có điều không lì nha son lên cái là bay liền à,2
chất đỉnh vcl í mng ko ngờ rẻ mà chất mịn xịn sang ultr má đáng mua,2
công_dụng làm đẹp kết_cấu hoàn_chỉnh độ bền_màu khá tốt mình thích nhất mùi son rất là thơm luôn ý,2
son rất là mịn luôn á mà lên màu còn đẹp xĩu nữa không ngờ giá rẻ mà chất_lượng ok vậy luôn á,2
công_dụng son mịn đẹp kết_cấu vỏ chắc_chắn rất là xịn luôn nha độ bền_màu bám màu rất ok son mướt săn sale giá quá hời luôn,2
chất_lượng sản_phẩm tốt đóng_gói kỹ có mùi thơm son mịn đẹp,2
công_dụng trang_điểm kết_cấu đẹp độ bền_màu tôtd với giá tiền siêu uư đãi này mà có_thể có cây son chất_lượng đáng chú_ý như vậy đồ bền_màu lâu màu lên rất đẹp dễ đánh lên môi,2
son đẹp sang xịn mịn mua làm_quà tặng shop gói kĩ xinh_xẻo lắm ạ thanks,2
công_dụng ok kết_cấu nhìn cute độ bền_màu 90 sản_phẩm oki hơi đậm giao hàng siu nhanh_shop dễ_thương nhiệt_tình,2
son xinh xỉu cả vỏ và chất son đều ok màu cũng đẹp nữa mua son nđt mấy lần mà mỗi lần này ưng quá_trời lun á,2
cá_nhân mình thấy em số 14 này có mùi rất thơm mịn lên môi không bị vón cục ảnh này mình chụp cam ko có filter lên lên ảnh là màu chuẩn của son các bạn có_thể tham_khảo,2
mình mua 2 màu lên tay khá xinh nhưng lên môi màu hơi bệt làm xỉn men răng mùi khá hắc và chất son cũng hơi khô tuy_nhiên shop giao hàng khá nhanh đóng_gói và mẫu_mã đẹp nên vẫn khuyến_khích 5 sao,0
chất xịn xò đẹp mướt mình mua màu 24_hợp vs ng đứng tuổi 1 chút màu ko tươi như mình nghĩ,2
đánh lên môi rất mềm và mịn nhưng màu ko được như trong ảnh mà kiểu hơi tím tím ko phải màu đỏ lạnh kiểu của 3 ce,2
màu rất đẹp mùi thơm giống a26 đặc_biệt màu 404 tuyệt đẹp nha đánh lên nhìn da trắng bật tông chất son ẩm nhưng không cố_định nên đánh rất khó và đặc_biệt ko ăn lòng môi chút nào với giá tiền như vậy cũng ko đòi_hỏi nhiều đẹp,0
sản_phẩm đóng_gói chắc_chắn đầy_đủ màu bên ngoài tươi hơn trong ảnh son dùng mượt mịn thích lắm,2
hình_ảnh mang tính_chất nhận xu_shop đóng_gói cẩn_thận dịch nhưng giao hàng khá nhanh chất son mịn đẹp,2
son xịn hịn lun á màu ưng_ý cực_kì test lên môi ko bị trôi vs cả mềm lắm lắm,2
son lì màu đẹp như hình chất kem hơi đặc một xíu hàng gói rất kĩ,1
giao hàng nhanh lắm ạ chất son khá ổn với giá này thì quá rẻ rồi,2
đẹp sang xịn mịn nên mua nha,2
son lên màu đẹp chất đẹp mà giá siêu rẻ rất đáng mua mua của shop rất nhiều lần kh thất_vọng lần nào,2
ta nói nó đẹp sx lun aạ chất k khô lắm đâu mng ui săn sale có 30 ka mà ưng bụng màu này tựa bia 38 mng nhé nên mua ạ,2
kết_cấu ok độ bền_màu tot màu son đẹp mãi đỉnh giao hàng rất nhanh shop trả_lời nhiệt_tình sẽ còn ủng_hộ,2
son mềm mịn,2
giao hàng siêu nhanh đóng gói đẹp chắc_chắn chất son siêu đỉnh ko có j để chê,2
son lì mịn màu đẹp ạ smiling_face_with_heart eyes aw,2
công_dụng son la de danh chu lam gi kết_cấu son kem độ bền_màu dc son lì nhẹ dễ dùng mùi ổn tuy_nhiên nó tươi hơn mình tưởng kiểu trên anh cam đất vè cam cháy,1
màu son xinh nhe m n mịn nữa person_gesturing_OK,2
chất velvet bông mịn không làm lộ vân môi son có mùi đào thơm nhẹ_nhàng giá quá rẻ cho 1 em son xịn như này,2
giao hàng nhanh son cực xinh_xẻo không bị khô môi có mã check nói_chung là nên mua nha cả nhà son không lì lắm nhưng vẫn cứ là ok la mua 2 cây được tặng 1 mặt_nạ nữa nè 3,2
đánh rất mềm và mịn tẩy_trang nhanh không làm khô môi tôn màu_da,2
công_dụng ad kết_cấu li_độ bền_màu xinh,1
hình_ảnh chỉ mang tính_chất nhận xu chất son dày hơi khô,0
công_dụng son môi kết cấu dạng son kem màu 25_độ bền_màu 3 4 tiếng mùi thơm giao hàng nhanh rất ok màu đúng theo yêu_cầu oki sẽ ủng_hộ lần sau,1
màu đẹp mịn k lỳ mấy nc giá rẻ thì đi đôi vs chất_lượng,2
son mịn đẹp khá lỳ thơm chất khá ổn nên mua hihiji,2
màu son nâu tây lên môi bao xinh nha vỏ nhám trông lạ_mắt chất son mịn thơm nhen nên mua nha mng,2
son bao_bì và vỏ xịn xò lắm chất son với màu son thì chưa thử vì son mới hơi tiếc 10 đ ạ,1
tui thích mùi son này màu xinh mà tôn da lắm nhưng đánh lên thì hơi khô môi xíu,0
son thơm giao nhanh mịn thích son hãng này lâu rồi mà giờ mới mua được,2
ảnh và video không liên_quan son mùi giống v đó màu đẹp chất tạm ổn,1
chất son e này thì cực thích luôn nó mịn mùi thơm đánh lên màu cũng đẹp,2
đặt từ hôm 15 mà đến m5 mới nhận được sad_but_relieved_face chất son lần này bị sao sao á lên không đều huhu hay_là do mới đầu mình đánh nó bị như z mình mua ở sốp này vài lần rùi và chưa lần nào lâu như zay thui không_sao vì hàng được cam_kết chính hãng nên mình hoàn_toàn yên_tâm kiss_mark,0
đọc review rất kỹ mới quyết_định mua của hãng này ko biết có phải màu mình mua bị vậy ko chứ mình cảm_giác pr cực_kì chất son rất đặc luôn khó tán mình phải dùng tay mới đều đc màu sẫm hơn mình nghĩ nên già lắm đc 2 tiếng sau thấy bị loang_lổ khô môi nói_chung tệ ko còn gì tả giao hàng lâu,0
màu son đẹp đánh lên mềm mịn môi 79 k 1 thỏi son thì khá xịn nên mua hình_ảnh klq vì mình lười chụp ảnh smiling_face smiling_face,2
mua lần 2 roi lần đầu son chất ko lì lần này cũng hơi lì nói_chung chất son ok ưng nhé,2
shope mal nên gói kĩ ghê é màu son này kiểu đỏ hồng í chị_em hông có nhiều đất như màu 25 đánh lên trông cũng ổn trắng răng nhưng có vẽ sẽ khô môi í nàng nào ko chịu đc mũi sẽ hơi khó_chịu á nha,0
chất son và màu son ok có cái mùi hơi hắt đánh_giá 5 sao,2
chất son mịn khá ưng_ý mua 2 cây màu nào cũng đẹp sẽ ủng_hộ tiếp,2
son có mùi cafe nha màu xinh phết ạ son mềm mịn nhưng pải dưỡng môi k bị nẻ đánh lên mí đẹp ạ thank sh nhìu ạ,2
đánh ưng nhắm giá săn dc siêu hời lun í có 5 k disappointed_face OK_hand mình thích đánh kiểu mịn mịn vầy nề,2
sau 1 tháng cây son mới về face_with_tears_of_joy mà son đẹp tô khá êm màu đẹp và có mùi cam mình khá ưng màu son này,2
công_dụng khá đẹp kết_cấu son nhẹ môi nhưng khá khô độ bền_màu mình thấy son k bám mấy khá dễ trôi không giống tượng hổ_mang vẻ hững_hờ ở bạc_liêu cũng không giống những chú hổ trông có_vẻ ốm đói ở phú thọ gần đây cộng_đồng mạng đang hết lời khen_ngợi cho tượng hổ tại thái_nguyên tượng hai linh vật hổ một con đứng một con nằm với dáng_điệu khoan_thai hiền_hòa nhưng cũng không mất sự oa,0
sang xịn mịn lắm luôn nha nhưng chỉ mỗi cái giao siêu lâu đặt từ hơn tháng và bh ms nhận đc hàng nhưng đk cái là mk mua 2 thỏi vs giá rẻ lúc đag sale cn về chất_lượng khỏi pải bàn,2
son khô môi màu chuẩn tươi xinh k bị vàng răng da ai cực trắng càng hợp hơn nữa mẹ mình đánh trẻ ra vài tuổi chất son khá lỏng k có mùi thơm nhưng cũng k hôi nồng quá vỏ đẹp cầm chắc_chắn bao_bì chuẩn hàng_hiệu giá ok so với cây son như này đầu son khá to nên lấy ra khỏi thỏi hơi khó,0
son mịn màu đẹp lắm nên mua nha_dịch nên hàng hơi lâu,2
son này này giống hình nhưng chất kem bột quá mùi cũng k thơm lộ vân môi nếu mix với son khác thì cũng được chứ bảo xài không thì xấu lắm nha đc cái hãng này giá rẻ nhìn sịn xò nhưng chỉ phù_hợp với giá tiền thôi nha k đòi_hỏi gì đcthêm,0
son đẹp xinh nhg hơi lộ vân môi cx đc,0
son đẹp mềm như nhung nhưng màu ko giữ đc lâu giá rẻ thỏi son cầm chắc_chắn sang chảnh màu xinh,2
son màu đẹp tôn da_da ngâm hay da_trắng đều sài ok giá ổn tui chụp hình thì màu hơi nhạt chứ ngoài son lên môi xinh lắm son mềm mịn kh khô môi nói_chung là nên mua nhoe red_heart red_heart,2
son mới cảm_nhân thì mình thấy son lỏng cực đánh lên thì màu hơi đậm mặc_dù mình chỉ đánh 1 lớp mỏng son rất lì lun hợp cho mấy dịp đi tiệc thui nha còn mấy bạn hs sv thì nên chọn màu trông đỏ tươi hơn xíu để khi nhận hàng thì màu lên sẽ đẹp hơn nhìu,0
son đẹp lăms nha màu lên môi đẹp và mịn nữa nói_chung v là ok r,2
son uki lắm mùi cx k thơm như tưởng_tượng nhma đánh mướt nhé mng sang shop em_em có bán váy như vid kia nhé mng,2
công_dụng son kết_cấu ok độ bền_màu ok màu này hơi ngả cảm vỏ ngoài ọp_ẹp nhưng cũng ok mùi hơi khó_chịu nhưng chất son ổn hơi khó tán,2
công_dụng sang moi kết_cấu dep độ bền_màu ben độ lì của son thích màu son thơm lắm mình thích màu này và hàng chuẩn,2
chất son đẹp khá mướt,2
công_dụng tốt kết_cấu tốt độ bền_màu tốt ok giao đủ hàng đóng_gói cẩn_thận nhưng về hơi lâu,2
giao nhanh đóng_gói cẩn_thận đúng hàng màu đẹp son mềm mịn phjk,2
giá rẻ son mịn môi không lì lâu màu son sáng da hợp trend hàng giao cẩn_thận,2
giao hàng trong thời_gian covid nhưng cg k quá chậm chất son hơi lỳ m thấy son khá thơm hơi giống mùi bánh_trung_thu dẻo ấy màu lên chuẩn xinh lắm ấy sẽ mua lại lần nữa mua hôm sale nên giá rẻ cực đóng_gói cg rất kỹ và hộp k bị móp méo,1
vỏ son dễ_thương chất son sướng lắm luôn nói nói_chung là đỉnh lắm luôn,2
công_dụng mau len dung voi hinh kết_cấu chat son min khong qua kho hay li_độ bền_màu binh thuong,2
mình thấy son màu đẹp cực vừa rẻ vừa đẹp màu 403 thì nó sẽ bỏ hả mướt hơn 404 những chất của 404 mịn vừa phải nói_chung là đáng thử,2
công_dụng làm đẹp kết_cấu son lỳ độ bền_màu 8 10 mình chưa test cây này nên mình cho nhiu đây điểm vì vỏ đẹp son có mùi thơm kiểu gì ấy hơi khó tả nhưng chất son mịn mượt dễ tán bặm bặm 2 lần là oki đẹp,2
màu xinh nhma lên môi mình nó cứ bị bợt bợt làm_sao í kiểu k_thể tán đều phía trong lòng môi nhìn hơi khó_chịu crying_face,0
chất son mềm mịn lên màu đóng_gói kỉ và giao hàng tiền nha còn được tặng thêm thỏi son nhỏ nhỏ xinh_xinh nữa hình_ảnh chỉ mang tính_chất nhận xu,2
son màu lên đẹp đánh mướt giao hàng nhanh ạ đóng_gói cẩn_thận,2
huhu son xịn mịn sang r cho shop 10 đ hihi ship cũng nhanh dù đg dịch nữa face_blowing_a_kiss,2
tôi yêu các sp son của perfect diary son lên chuẩn màu mịn thích lắm,2
công_dụng làm đẹp kết_cấu đẹp độ bền_màu khá nhanh trôi chất son hơi bột đi nhma son thơm mùi socola lắm nch với giá này thì đáng mua nha,0
24 g nhưng ko chỉ bằng 1 10 thôi nhưng chất son siêu phê ko cần make đánh lên cũng đc,2
nhận hàng đủ son mềm môi thơm 2 màu ưng_ý màu ngoài tối hơn là của romand màu trong là bia,2
son oke lắm nè vỏ ngoài xinh son hơi bé xíu màu như trên hình chụp í chất mịn cũng dễ xóa trái là 403 phải là 402 á giao hơi lâu do là hàng qte nma phù_hợp với giá tiền lắm nè màu lên môi xinh á vid ngoài lề nhận xu thui hõng liên_quan tới son uwu,2
hình_ảnh và video mang tính_chất lấy xu chất son đẹp mịn full_moon_face cold_face,2
son mùi thơm k biết có fake ko mà như vậy đánh lên khá khô môi giao hàng rất rất lâu luôn ạ trời ơi,0
với cái giá 50 k cho 1 thỏi son nhe này thì rất là tuyệt vòi ảnh mẫu với màu son ở ngoài thì màu ngoài nhạt hơn nhé mn chất mượt như nhung hơi khó tán thoi nói_chung là 10,2
son màu đẹp chất son lên môi k dễ tán hơi bột beaming_face_with_smiling_eyes,0
son không giống màu ảnh đâu hơi ngả hồng hơn chất son đánh lên môi để lại vân ai mà môi bị khô là sẽ thấy viền viền nếp môi rồi da môi rõ lắm đẹp kiên_nhẫn đánh bằng cọ môi thì okie,0
giao đúng và đủ nhưng mà son bên trong khá ít chất son khó tán dễ dịch_chuyển nhưng mà khá mịn,1
giao hàng khá nhanh tầm 2 3 bửa là nhận được rồi son mịn màu k giống hình lắm,2
shop gói hàng tốt son xinh thơm và mướt lắm màu lên cx rất xinh nx,2
son đẹp lúc đầu loãng nhưng khô nhanh màu lên đậm hơn tưởng_tượng nhưng mà vẫn rất okela,2
son mùi hơi hắc chất vừa hơi đặc khó tán 1 xí màu lên xinh_đẹp son lì bạn nào thích son lì thì mua hợp,0
công_dụng son moi kết_cấu kem độ bền_màu ok chất_lượng tuyệt_vời son mịn,2
công_dụng tốt kết_cấu đẹp độ bền_màu tốt star struck birthday_cake star struck,2
son lên màu mùi thơm nhẹ sẽ quay lại ủng_hộ shop,2
săn sale nên được giá rẻ hàng quốc_tế nhưng giao nhanh chất son mượt màu son lên hình đẹp,2
son hơi khô màu thì cũng okila nghe rewiew nhiều nên mua thử xem sao ai_ngờ cũng bình_thường,0
mình cũng lười test từng cái nên mình test tổng_hợp ra luôn shop giao đủ nhưng mà cây chì xé bị gãy làm đôi huhu tired_face chất son mịn kiểu như chất br màu son đẹp nhưng mùi hắc với mùi j thì mình ko bít nerd_face,2
son siu đẹp và thơm rẻ nữa màu đẹp và chất son như mấy son bi ý thích nhắm,2
son của hero chất khá mướt và thích nha mn smiling_face_with_tear ôi màu 05 siêu xinh luôn ạ chuẩn gu mình trong ảnh màu ở phía trên cùng mình nghĩ các bạn nên mua màu 05 hoặc 01 sẽ dễ đánh hơn,2
son đẹp lắm mọi người ơi son rất mềm mịn còn có mùi socola nữa săn sale nên giá 2 thỏi còn 74 k,2
son đánh lên mịn thơm rẻ mà chất_lượng ghê xứng_đáng 5 nha,2
do là hàng quốc_tế nên giao hàng hơi lâu chất_lượng sp khá tốt son mịn thơm che khuyết_điểm dùng khá thích,2
công_dụng ok kết_cấu đẹp độ bền_màu ok mùi thơm chất son mịn,2
đóng gói rất chắc_chắn sản_phẩm sử_dụng rất êm sẽ ủng_hộ shop nữa,2
màu thì giống hình nhưng cảm_giác chất son k dc mướt lắm hơi khô môi son bám màu lâu,0
chất son mịn nhẹ môi màu mlb rất là xinh luôn nha,2
chất son rất ưng nha mn lên màu tôn da lắm ạ son rất mịn mềm môi nói_chung là nên mua nha sẽ ủng_hộ shop thêm ạ,2
chất son mịn có điều màu trong ảnh với ngoài hơi khác nhưng với giá tiền này cũng ko đòi_hỏi được,2
màu son xinh lắm mềm môi và nhiều dưỡng nhé mùi thơm thơm,2
mua lúc sale 2 sp giảm 50 nên hời lắm tôi mua hẳn 2 cây 2 màu luôn v17 với v18 thề là màu xịn cực_kì mỗi tội mình k thích mùi lắm chất son mịn nhẹ,2
son mùi thơm chất đánh lên môi cảm_giác mềm mịn lắm nha lên mua,2
son xinh lắm luôn mượt_mà 10 điểm,2
công_dụng phù_hợp với son hàng ngày không make up kết_cấu chất kem mịn tuy_nhiên dễ lem độ bền_màu ổn son lên màu đẹp sáng da thiên cam mềm mịn không bị khô gây bong_da lúc đánh lên dễ lem nhưng mà lấy giấy bặm sơ để lấy bớt son ra là được ổn với mức giá,1
theo cảm_nhận của mình thì son khá lâu khô đánh rất dễ bị dính răng với giá_như này thì cũng không đòi_hỏi gì thêm vận_chuyển khá lâu,0
mua lần 2 vì cái cũ mua xong nó mất đi đâu mất_tiêu son khi đánh lên môi khá khó tán đều nha mọi người,0
đóng gói chắc_chắn hàng tuyệt mình đặt màu đỏ rượu_vang lên màu đẹp mịn,2
son xinh sịn mịn lăm nhó,2
son về màu rất ưng nha giao hơi lâu 1 xíu chất son khá thích nên mua nha,2
son lên màu hồng_hồng rất xinh ship nhanh lắm luôn á son hơi bé nhưng phù_hợp giá tiền đánh lên xinh lắm lắm luôn hơi bị khô môi xíu tóm_lại phù_hợp giá tiền,0
chất son tạm được màu cũng xinh săn sale giá rẻ nên nhìn_chung cũng okela,2
son đẹp mịn môi khá lì giá quá iu hihihi sẽ ủng_hộ lâu_dài,2
son hơi khô lên màu tươi hơn ảnh minh_họa màu bên trái là màu 302,0
đơn mình đc tặng mặt_nạ nè hehe trông iu lắm mình chưa dùng nên chưa biết chất sao ạ,1
son lên chuẩn màu chất son mềm mịn dễ tán chỉ cần lấy ít son là tán được đều môi rồi nhưng mà màu này make up thì sẽ xinh hơn,2
độ bền_màu 2 4 h công_dụng son kết_cấu kem son oke lắm luôn ạ mềm môi giữ màu cũm tạm ổn nha,2
giao hàng đúng đủ nhanh hơn mh nghĩ son xinh giá rẻ hehe winking_face nên mua nha mng chất đẹp nửa smiling_face_with_hearts,2
son bôi lên ko bị khô môi màu dịu ko có mùi khó_chịu như mn nhận_xét tuy_nhiên trôi nhanh với ko tán đều màu đc,2
102 màu sáng mình dùng làm son_lót để che viền thâm môi 104 màu đẹp đè lên 102 chất son mịn nhưng lên môi mình bị bết,0
chất son mịn đẹp lên màu chuẩn cực mình chọn màu 403 với 501 thì thấy cả 2 đều xinh bạn nào muốn chọn màu son đi học thì có_thể tham_khảo màu 501 nha,2
oke nè son rẻ mà mướt nhưng không đúng màu cho lắm,2
son thơm mùi dễ_chịu mịn và lén màu rất đẹp son lì thật_sự kh thấm nước mình đặt 1 cây mà shop giao về 2 cây luôn,2
