processed_data,target
shop giao hàng nhanh son lên màu đẹp chất son hơi bột không bám môi cho lắm nhưng mà so với giá tiền thì quá ổn nên mua ạ,0
bao_bì xịn gói cẩn_thận giao hàng hơi lâu chất son hơi khô,0
giao hàng quốc_tế nên siêu lâu đúng 2 tuần được cái đóng_gói cẩn_thận có hẳn túi bọc củ hãng thấy mọi người kêu chất son khô nhg mình đánh lên thấy bình_thường bám màu ổn mới đánh thì mùi ko thơm nhg đánh lên tầm 1 là có mùi thơm thoang_thoảng rồi,1
công_dụng kết_cấu chất kem mịn độ bền_màu tạm ổn lên màu nhìn xin,1
chất son ok thơm tot hình_ảnh không liên_quan hihi_shop xem đỡ nhé rolling_on_the_floor_laughing,2
vỏ đẹp hộp đẹp màu son mình chưa dùng nhưng tone này mình nghĩ chất và màu sẽ ổn thôi giao hàng hơi lấn_cấn đoạn lấy hàng từ nơi bán lấy đc hàng thì ổn k phải chờ lâu,2
son đẹp cả chất son lẫn_màu son đóng gói đẹp và chắc_chắn giao hàng nhanh lắm slightly_smiling_face,2
rẻ xinh màu đẹp date cao hàng quốc_tế nên ship lâu nhưng chất_lượng siêu oke nhé mn ơi son vỏ xinh siêu chất son hơi lỳ bám tốt mùi k thơm tẹo,2
giá rẽ hợp với ví tiền học mình ko ưng cho lắm chất kem kiểu bị vón cục ý hình anh chỉ mang tính nhận su,0
công_dụng dep lamswjd kết_cấu dep độ bền_màu chua dung nhiều nên chưa bt fwb thơm thích lắm nha,2
màu xinh mà mướt săn sale 2 cây có 150 k rẻ quá_trời luôn aá,2
vừa nhận đc son phải khui ngay chất son mền mịn trên môi khá là oke nhưng có_vẻ dễ trôi nhưng với giá này thì mình rất ưng nha,2
giao hàng nhanh giá_cả hợp_lí son_chất rất mượt màu lên khá tây mn nên mua nhé,2
công_dụng son kết_cấu tạm được màu lên cũng xinh không lì lắm vơid giá này thì ổn mng mua cũng được nha ship cũng nhanh không bị tắc đơn tạm được nha,1
son kem màu khá đẹp lên màu chuẩn son thỏi thì màu không chuẩn lắm mình thích pha chút nâu hơn nữa,1
màu son 25 final note quá ưng luôn chất kem xịn ny mình rất thích 3,2
son lên có mùi thơm nhẹ nềm mịn màu khỏi chê lên môi tươi sáng rất đẹp hộp cũng dễ_thương,2
hàng đẹp chất son ok giao hàng nhanh xứng_đáng đánh_giá năm sao,2
son mịn màu chuẩn rất đẹp nha mọi người nên mua nha son màu đẹp,2
công_dụng son mỏ cho hồng_hào kết_cấu bột và rất dễ bị khô môi nha độ bền_màu bao nhanh phai,0
kiểu mình bị nghiện em 1 này ấy son rất hợp với mấy đứa da tb sáng như mình chất son cực mịn giá lại quá rẻ mình mua 1 lúc hai cây sài cho lâu sẽ mua lại,2
màu đẹp chất son lỏng để 1 lát thì khô môi,0
10 ngày là nhận được chất son lỏng mùi khá nồng đấy,1
màu son ok lắm recomend mng mua nha chất khá ok k lì lắm nhma xinh,2
công_dụng lm đẹp môi kết_cấu mềm mịn độ bền_màu bám tốt lần đầu dùng bia nên khong biết nói như thế_nào cả mình đặt 1 cây son mà shop tặng thêm 1 cây lộc cuối năm cảm_ơn shop ạ giao hàng rất nhanh smiling_face,2
chất son mịn đẹp màu siêu ưng son trung nhưng chất_lượng đáng_giá của hàn nha growing_heart,2
son lên môi rất tự_nhiên có mùi socola rolling_on_the_floor_laughing mịn dễ tán sẽ ủng_hộ tiếp,2
chất son oke màu lên chuẩn giá rẻ,2
sản_phẩm rất ok son lì mịn với thơm nữa giao hàng nhanh hơn dự_kiến,2
hình_ảnh chỉ mang tính_chất nhận xu màu hướng cam hơi nhạt chất mịn giữ màu tầm 2 3 tiếng,2
son màu y_như hình màu xinh lắm bôi không hề khô môi luôn nhé mn,2
chất son ổn màu nhạt hơn so với hình xinh cầm chắc tay mùi hơi hăng không lỳ lấy khăn giấy lau 1 phát là sạch luôn,2
son màu đẹp mẫu_mã bắt_mắt xịn sò không bị khô môi giao hàng nhanh thỏi son sang chảnh,2
son mướt môi lắm nha mới đầu đánh lên_lớp đầu_tiên thì nó ko lên màu đẹp lắm nhg mà mn đánh thêm nhiều lớp nx thì màu lên rất chuẩn da nào cx hợp ạ nói_chung là mn nên mua nhá giá_thành rẻ hợp túi smiling_face_with_hearts,2
công_dụng ụ kết_cấu ok độ bền_màu đẹp màu đẹp ok rô xinh,2
tông màu rất đẹp bôi son_dưỡng xong lên_lớp son rất là mịn_màng mình sẽ luôn ủng_hộ shop,2
giao hàng hơi lâu nhưng do dịch nên như vậy là cố_gắng lắm rồi chất son lì bền_màu nên mua nhé mọi người,1
shop giao hàng nhanh săn sale được giá rẻ màu lên môi mịn mướt chứ không bị khô lắm,2
mùi son thơm lên màu chuẩn chất son cũng vừa_ý mình lắm hundred_points,2
shop giao hàng lâu bù lại đóng_gói cẩn_thận màu son đẹp mỗi tội khô nhanh mình đánh lên môi không nhanh tay là nó khô mất luôn,0
sản_phẩm rất xinh_đẹp tuyệt_vời màu này là màu ưng nhất đỏ cam siêu xinh chất son thì vẫn vậy nhanh trôi chùi cái là sạch,1
mùi khá nồng chất son hơi khô bột nhma mng có_thể giải_quyết bằng cách tẩy tbc môi dùng son_dưỡng trước khi son là xức xắc luôn nhe,0
kết_cấu mềm mượt mới với đầu cọ hình trái_tim hai mặt mềm_mại giúp đôi môi của bạn có cảm_giác nhẹ_nhàng giống như một đám_mây nhẹ trên môi không gây nặng môi cả ngày dài,2
giao đúng mã son mịn môi lần trc mua 1 cây rồi quá ưng nên đặt thêm 2 cây nữa,2
chất son lên màu đẹp không thơm như nhưng mịn hơn rất nhiều shop đóng hàng cẩn_thận kĩ_càng giao hơi lâu vì từ nam ra bắc nên không sao ạ_shop thì uy_tín rồi nên mng mua đi ạ mình hơi bị thích_shop r đó smiling_face_with_heart eyes,2
tạm hài_lòng chất son ko ưng lắm xài tạm cũng đc,0
hình ảh mag tính_chất nhận xu nhueg son về dùg ưng lắm ý ạ chất son màu son rất là đẹp,2
giao đúng hàng màu son và chất son đẹp lì nên mua nha,2
rất ưng chất son mịn không khô môi mùi thơm lên tay màu như video nhưng lên môi nhìn sáng hơn,2
vỏ sang mà dễ bám vân tay quá nl2 thì màu lên y_như ảnh swatch ra_tay mỗi tội cảm gúac cứ nhạt nhạt k đánh đậm đc son kem thì chất_lỏng mà son lên k đẹp bằng các vẻ trc,0
son đẹp xỉu rất mềm và mướt môi đóng gói đẹp không ảnh_hưởng đến sp bên trong,2
son màu đẹp chất son hơi khó tán nhưng với giá này thì ok ah,0
chất son ok màu lên đẹp giá rẻ nữa nên mua nha,2
công_dụng son môi kết_cấu lỏng độ bền_màu ổn lên môi ko làm khô môi nha mn hình_ảnh chỉ mang tính_chất nhận xu,2
son đẹp lắm ạ nhưng có mùi mình ko thik lắm son khô nhanh nên mk phải tán nhanh á_shop đóng_gói cẩn_thận,1
chất son siêu thích nha red_heart rất mịn luôn màu chuẩn như hình luôn né màu 402 siêu đẹp,2
màu đẹp nma không thích chất của son cho lắm vì nó không mịn khô môi,0
son phải gọi là đỉnh của chóp luôn mọi ngưòi ơi vừa mềm mượt không bón cục màu còn đỉnh đỉnh đỉnh đỉnh vãi còn rẻ nữa son này ko hề kém_cạnh hãng khác đâu mng ạ,2
son đánh lên màu đẹp nhưng mà chưa kịp bặm đã khô smiling_face_with_tear nhưng được cái k khô môi,2
công_dụng son môi kết cấu đẹp độ bền_màu son màu lì màu lên đúng mẫu nha xinh lắm nên mua,2
màu son lên đẹp chất son lỏng màu lên giống hình khả_năng bám môi khá tốt không bị nhả son quá nhiều môi nên tẩy da chết mới đánh nhé mng,1
son ổn mùi dễ_chịu cũng k khô môi lắm đâu giá rẻ v là ổn lắm rồi,1
hàng đẹp giao hơi lâu chất son đỉnh hình_ảnh chỉ mang tính_chất nhận xu,2
màu son đẹp chất son mềm mịn giao hàng hơi lâu nhưng xứng_đáng công đợi,2
công_dụng son môi kết_cấu mịn độ bền_màu khá mình rất hài_lòng về sản_phẩm chất_lượng sản_phẩm rất tốt,2
hàng ổn son lên màu ok khó tán shiper giao hàng quá nhiệt_tình red_heart nói_chung tạm ổn,0
chất son mướt lên môi xinh cực vỏ son cũng xinh nữa rất hài_lòng,2
hình_ảnh với vid để nhận xu thui vì đặt dùm k có hình nhma nghe nói là màu lên giống với hình chất son đẹp ạ,2
hàng auth nha mọi người sơn đánh mịn mà thơm nữa giả rẻ nên mua nha,2
giao hàng siêu siêu nhanh luôn ý ngay ngày hôm sau là nhận được rồi đóng_gói kĩ_càng màu 25 cỉa bia là quá nổi_tiếng rồi siêu dễ dùng chất son mịn vỏ cầm chắc tay săn sale 12 12 chỉ còn 12 k thui,2
theo ý_kiến riêng của mình thì son khá bột khô môi và kiểu khá dính á không nên bặm môi quá nhiều lần và đặc_biệt mùi son là điều mình rất khó_chịu nhma được cái son rất lì nha và mình mua chỉ có 62 k thì phải tóm_lại cũng khá ok đây chỉ là ý_kiến riêng của mình thôi nhé,0
đóng gói chắc_chắn giao hàng nhanh chất son thì bình_thường theo mình thấy thì hơi khó tán đều khá lì 2 màu 402 và 404 khá giống nhau,1
đã nhận đk hàng nhưng màu son k giống ảnh cho lắm chất mềm mịn nhưng vẫn cho 5 sao nhé,2
bị lỗi nhỏ ở vỏ son mềm mịn và mượt ạ lên môi xinh thơm mùi giá rẻ nên mình sẽ mua thêm vài màu khác,2
son hơi khô nhưng màu lên xinh xỉu nhoa mn,0
son đẹp nè giao nhanh và gói hàng chắc_chắn lắm nha xịn mịn luon mà son hơi lỳ h ảnh mang tc lấy xu,2
son màu đẹp lắm lun màu chuẩn và mượt môi sẽ ủng_hộ shop nữa face_blowing_a_kiss,2
màu 25 thì khỏi bàn r nhưng chất son hơi khô và nhanh trôi,0
son đẹp mà hơi nhỏ chất bột bột nói_chung là phù_hợp vs giá tiền hoi màu đậm hơn hình một xíu,0
công_dụng dễ đánh lên môi lắm ạ kết_cấu mịn độ bền_màu lâu trôi,2
đã nhận được hàng son lên môi màu chuẩn chất son mềm ncl rất ưng,2
son chất đẹp mịn vận_chuyển nhanh shiper giao hàng có tâm video chỉ mang tính_chất nhận xu,2
son thơm lắm mn ạ mùi cam rõ luôn màu như hình chất lì mềm lên môi siêu xinh tuy độ bám dính chưa đc tốt nhưng giá hạt_dẻ nên k đòi_hỏi gì tóm_lại là mn nên mua nhé,2
đẹp lắm đánh mướt nhg vẫn nên dưỡng môi trước khi đánh nha để đẹp hơn,2
công_dụng gất là đẹp nhe lên đúng màu mềm môi còn thơm mùi socola nữa nè nên mua nhe kết_cấu gất là ố kề độ bền_màu okela lắm hàng quốc_tế nên hơi lâu nhưng mà hợp_ý mình lắm xài oke lắm nhe,2
son thơm xịn và mịn bám lâu nữa nên mua nha mọi,2
hình_ảnh k liên_quan nhưng son xinh lắm đánh mướt môi hơi nhanh trôi nhưng màu lewn rất đẹp,2
ưng lắm luôn ạ màu lên đẹp chất son khá mịn mùi thơm giá lại rẻ nữa shop quốc_tế nên giao hàng hơi lâu ạ nma k sao lần sau sẽ ủng_hộ tiếp ạ,2
hàng ok nên mua màu đẹp son kh khô môi,2
shop đóng_gói rất là kĩ luôn nhận hàng nhìn màu thích cực luôn ý bôi lên rất là mịn nhưng mà nó k bền_màu lì cho lắm ncl cũng đẹp ạ,2
son lên môi khá mượt nha màu đẹp nhưng ăn_uống thì vẫn trôi nha,2
son lên môi không giống màu mình coi video không biết có phải là do môi mình hay không nhưng chất son mềm mịn hàng chuẩn còn màu môi thì không giống xem video lắm,2
vỏ hộp và vỏ cây son đẹp màu hồng xinh chất son mềm mịn dễ tán,2
giao hàng nhanh chất son lì mềm có dưỡng nên đánh lên môi không sợ khô môi đâu nhé các b nhưng vì_thế mà chất son cũng sẽ dễ trôi chăm dặm lại là đc mùi thỏi 501 thơm mùi đào không nồng tí nào_đâu 2 màu này trôi ra để lại base cam à mà màu 501 thật_sự hợp để mix với 302 đấy ạ,2
mình chờ_đợi hơn cả tháng mới nhận được do dịch nhưng bù lại rất ưng về chât lượng màu mình có swatch ra_tay lau đi còn lớp tint đầu cọ mềm son mướt,2
hàg tuyệt đẹp có mùi thơm socola với mùi cam chất son mịn đóng_gói sản_phẩm tạm được nhưng giao hàg chậm lắm flushed_face smiling_face_with_heart eyes,2
thấy đc khen nhiều nên mua về thử màu này lúc_nào cũng cháy hàng chất son mịn mượt,2
son đẹp và chất mịn lắm nha son mùi cũng khá thơm,2
hình_ảnh chỉ mang tính_chất minh_họa chứ son đẹp chất kem mịn lì,2
chất son khá là thích mùi cũng thơm nữa thiệp của shop dễ_thương lắm luôn smiling_face_with_heart eyes,2
công_dụng son cái mỏ kết_cấu idk độ bền_màu prety its so god to danh len cai mo cua minh do,1
màu trên ảnh mình chụp nó hơi cam chứ ở ngoài là đỏ đất nha son khá mượt nhunge mà nhớ tẩy da chết môi thì đánh nó đẹp hơn á,2
mình thích son cam trước đó mình dùng màu này rồi h hết nên mua lại quá rẻ mà chất son mịn lắm nên mua nha mn ơi red_heart red_heart,2
chất son mượt bám cũng ổn mùi son ngửi lâu hơi nhức đầu,2
màu nhanh trôi quá ăn có tí là trôi rồi mk thấy màu lên môi rất mịn kiểu nó giống black round í nhưng rẻ hơn black round nhiều,2
công_dụng cho ai thich mau hoi hong độ bền_màu chat son li min son màu k giống hình lắm,2
công_dụng mau nhat_hon so voi anh danh len bi bot kết_cấu chat dat set de lam bet moi độ bền_màu do ben mau yeu,0
son lên màu đẹp sáng da chất son mịn giá rẻ nhiều khuyến_mãi,2
son cũng khá mềm môi nhưng không lì lắm lên màu đẹp new_moon_face smiling_face_with_tear new_moon_face pile_of_poo,2
sản_phẩm rất ok chất son mướt mịn rất sài lòng đâu là lần đầu mình dùng hiệ này red_heart sẽ ủng_hộ tiếp,2
son màu đẹp lì nhanh khô rất ưng_shop cbi hàng nhanh nhưng vận_chuyển hơi lâu vẫn ủng_hộ shop 5,2
chất son mịn khá là xịn giao hàng nhanh xin_lỗi vì những hình_ảnh hong liên_quan,2
lên màu xinh cực luôn í màu 01 rất xinh luôn nha lên môi mướt mùi không quá khó_chịu,2
đóng gói sản_phẩm ok chất son mịn sài thích lắm nha son thơm màu đẹp tôn da đáng tiền 3,2
màu đẹp nhưng son khô vs k mịn môi đánh lòng môi ok đó tạm dc,0
sản_phẩm đẹp giống hình màu son đẹp hơi cam xíu khá giống bia 38 38 bên trái chất son kiểu bột bột á đóng_gói cẩn_thận,0
kết_cấu chất son lên môi tán đều ra xiu đẹp base cam tẩy da chết dưỡng môi kĩ trước khi son nha ce,2
điểm cộng cho là màu đẹp và bám màu trên môi rất tốt thumbs_up điểm trừ là son cực_kỳ dễ dây ra ngoài và nếu để môi bình_thường mà son lên thì cực_kì khó tán chỉ dễ tán nếu thoa 1 lớp son_dưỡng ở dưới rồi đánh son ở trên,0
chất son đẹp bôi mịn môi k bị vón bột mùi thơm cây cầm lên khá nhẹ nói_chung perfect ạ,2
công_dụng rất tốt kết_cấu rất tốt độ bền_màu rất tốt son lên màu rất đẹp giao hàng nhanh đóng_gói cẩn_thận_shop tư_vấn rất nhiệt_tình,2
sản_phẩm chất_lượng son thì có mùi thơm màu 301 nhưng kiểu màu nâu socola nói_chung là đc nhưng son hơi khô nói_chung là cho 9 10 giao hàng lâu đợi mãi mới nhận đc,0
sản_phẩm ưng lắm nha mùi thơm mịn nên mua giao hàng nhanh hình_ảnh mang tc nhận xu,2
son có mùi socola khá thơm chất son mịn màu cũng ok,2
công_dụng son lên môi nhẹ kết_cấu lỏng tán màu đẹp độ bền_màu 10,1
chất son khá là mịn nhưng phải tô lên nhiều lần mới lên màu giao hàng nhanh đóng_gói kĩ sản_phẩm oke,2
hình_ảnh mang tính_chất nhận xu son nhìn rất sang chất son mịn nha mn,2
chất son thì khỏi bàn rùi ạ rất oke luôn mình dùng 1 cây cũng hơn nửa năm mới hết mà sao thấy son nay hơi ít đóng_gói ok nên mua ạ,2
dùng thích lắm ạ ban_đầu tưởng chất son sẽ làm nặng môi nhưng không đâu nha mùi thơm_lừng luôn,2
chất son mịn màu ổn với giá chưa đến 20 k cho 1 cây son như này thì cũng là 1 trải_nghiệm cũng khá ok smiling_face_with_smiling_eyes,2
son đẹp giao nhanh hơi lâu trôi 1 tí mà phải dùg son_dưỡng xài khô môi lém,0
công_dụng phù_hợp cho da ngâm kết_cấu mềm mịn độ bền_màu bám môi 70 80 giá_cả phù_hợp hsv giao hàng nhanh đặt sale 15 1 là 16 1 đã giao,2
son đẹp chất lì lâu trôi rất xịn rất đáng tiền,1
son đẹp lém nha mn chất thíc lắm ạ son lâu trôi i,2
giao hàng nhanh nhận hàng đủ mình chưa dùng nên chưa biết chất son thế_nào,1
công_dụng giao hàng nhanh kết_cấu son chất_lượng độ bền_màu màu đẹp ok,2
giao nhanh son hơi khô màu lên cũng xinh mùi thơm cực_kì hệt socola luôn nha,0
son xinh giống ảnh chất ok lắm nha giao hàng hơi laia nhưng chất_lượng ok,2
công_dụng làm đẹp kết_cấu mịn lém nhe độ bền_màu lì nha ăn_uống tới_bến mà vẫn còn giữ lớp nhìn cũng không phai đi nhiều đâu nchung màu xinh lắm á,2
giao hơi lâu sản_phẩm chất_lượng son rất đẹp và mịn không bị khô môi,2
shop đóng_gói và giao hàng nhanh son mịn thơm lên màu đẹp lần sau mình sẽ ủng_hộ thêm,2
màu đẹp chất mướt nha rất được mùi son thơm,2
son k bột lắm đâu ạ lên môi lúc đầu đều lắm nhưng bặm vài cái thì chỗ có chỗ không,1
thỏi thứ 2 mình mua thích màu này dã_man mỗi tội chất son hơn bột,0
son mịn màu lên chuẩn mua không uổng tiền rất đáng để được 5 sao,2
nhận hàng khá nhanh shop gói hàng cũng cẩn_thận nữa son đánh lên mềm mịn dễ tán cực luôn k có mùi nha đánh lên mịn lì nhưng k hề khô mà giá quá rẻ luôn ý mỗi tội là son khi test lên tay sẽ đẹp hơn khi lên môi mình và màu trên hình cũng đẹp hơn so vs ngoài nữa dù_sao cũng cực ưng nha,2
son mềm mịn đáng mua nha mọi ngưòi thấy của shope mal nên cũng yên_tâm,2
kết_cấu chất nhung mịn độ bền_màu hơi làm khô môi thoa tầm 2 tiếng là môi khá khô r rẻ đẹp gần tết nên ship lâu 301 mình mua lần 2 r vẫn đẹp 302 màu hơi sến hồng cánh sen ngả tím khá sáng đáng nhẽ mình phải xem review của lio trc khi đặt nh 0 sao chắc mix với son đậm hơn là đc,2
công_dụng làm đẹp kết_cấu tốt độ bền_màu tốt son xinh màu đẹp giao hàng nhanh_chóng ạ sẽ ủng_hộ shop,2
son thơm mịn màu oke ăn thì sẽ bị trôi phần lòng môi nhé mọi người shop gói hàng cũng oke nha,2
cây son hơi nhỏ cầm nhẹ_tay chất son mịn,2
công_dụng son lên màu đẹp kết_cấu đặc son đẹp cả về hình_thức lẫn_màu son giá_cả phải_chăng mà được như vậy là quá ổn_áp mn nên mua nhé hàng quốc_tế giao hơi lâu thôi,1
k uổng_công chờ_đợi son siêu mịn thơm nữa mềm môi k bị khô lần sau sẽ ủng_hộ shop thumbs_up,2
son màu xinh hàng chính hãng nên yên_tâm tuyệt_đối mk đã dùng bia nhiều r siêu lâu trôi mà k bọ khô môi,0
son thơm với mịn lắm nhưng mà thoa lên phải tán nhanh 9 k cho 2 cây thì giá quá hời mà chất son cũng đẹp nữa red_heart,2
son đánh mượt mềm môi giao hàng nhanh_chóng màu hợp vs da mình săn đc sale nên mua rẻ đóng_gói cẩn_thận check đc mã_vạch vd mang tính_chất nhận xu,2
giao hàng nhanh chất son ok chưa sử_dụng nên chưa biết độ bám,2
son đẹp hồng hơn hình 1 xíu có điều giao hơi lâu chất_lượng son ok ko bị khô,2
son dc mướt nhiều kh thơm lắm nch là dc nha,2
son kem lì màu rất đẹp ạ nhưng son lên nhanh trôi rất ưng_ý ạ smiling_face_with_hearts,1
công_dụng đánh lên môi kết_cấu xinh độ bền_màu kh bền nên mua nhá m n nhma nó kh có lì đâu với giao hàng lâu cực,2
son siêu đẹp đánh khá mướt môi đặc_biệt là lâu trôi và ko dây khi ăn_uống dịch giao hàng hơi lâu nhưng vẫn đợi đc thumbs_up,2
công_dụng màu son đẹp kết_cấu đẹp độ bền_màu chưa thử mài son rất đẹp nha ừn ý,2
son mịn lắm mn nên mua,2
công_dụng son kết_cấu mềm mịn độ bền_màu tốt shop chuẩn_bị hàng nhanh đóng gói hàng cẩn_thận son đánh lên nhìn màu ưng,2
lần đầu_tiên dùng thử dòng son này chưa biết chất son như thế_nào nhưng cảm_thấy rất thích vỏ hộp của son đẹp,1
son đánh lên mềm môi mịn như nhung í rất thích mùi son thơm ngọt ngọt kiểu mùi nho với cả dâu_tây màu mình đánh là 403 xinh xỉu luôn phù_hợp cho mọi loại da và màu 402 thì không phải nói đẹp xuất_sắc luôn màu nó tựa tựa giống với romand milk tea 02 á nói_chung là sản_phẩm rất đáng tiền mua,2
lần đầu mua son của nhà này chất son ko bột mấy màu đẹp nha mọi người tuy_nhiên mùi hơi khó_chịu,1
son khá đẹp đóng_gói sản_phẩm ok chất son không lỳ lắm nhưng mà vẫn ok red_heart red_heart,1
xịn xò lắm chời giá rẻ mà chất xịn lắm thơm thơm,2
chất son mịn thơm nhưng điểm trừ là dễ trôi vd khi đeo khẩu_trang hay không may bị quệt sẽ bị dính son bao_bì đóng_gói cẩn_thận kèm hộp son khá cute hình_như màu mình mua hơi đậm hay sao nên mấy bạn học_sinh như mình chỉ cần đánh nhẹ là màu nên rất ok rồi giá rất phải_chăng nên mình rất thích,2
công_dụng son môi kết_cấu mịn mượt thơm độ bền_màu 2 3 h nếu ko ăn_uống đẹp two_hearts,2
chất lì mà nhẹ môi lắm nhé thỏi son nhìn thiết_kế cũng iu nữa chứ,2
màu len đẹp thơm mịn mướt môi rất đáng tiền mua,2
giao hàng khá nhanh chất hơi bột một_tí khá ổn so với giá,0
màu lên môi vẫn tươi tươi sao á mn nhma chất son với mùi son không chỗ nào chê nha cho 8 đ vì màu hơi tươi smiling_face_with_tear,2
màu son đỉnh lắm luôn lại còn mềm môi nữa cực_kì ưng í,2
màu giống hình lắm mịn mướt không khô môi đâu mọi người nên mua nha,2
hàng về hơi lâu chất son đc màu đẹp nói_chung khum có gì để chê đôu rất đáng mua 3,2
son xinh xỉu luôn mùi không bị nồng hơi khó tán xíu,0
công_dụng màu nhẹ_nhàng đẹp kết_cấu mềm_mỏng mướt độ bền_màu bthg bám ko lâu lắm son giao khá lâu nhỏ chất đẹp lên môi rất mềm mùi thơm màu 105 này trông rất tự_nhiên lên môi không bị nặng màu finish khá sến,2
mua lần đầu màu xinh mướt son hơi nhẹ k nhưng mà màu này thì cũng g chả có gì để chê nữa,2
thực_tế so với giá thì son rất đẹp từ chất cho đến vỏ son mặc_dù đợi hơi lâu còn lại rất đáng mua,2
màu đẹp mịn đánh_giá tiền,2
son đẹp lắm ạ bôi lên nhìn đẹp và khá mịn nói_chung sản_phẩm tốt red_heart,2
kết_cấu hihi độ bền_màu hihi oke lắm mng đúng màu mình thích kiểu thâm_thâm mùi cũng thơm ncl oke,1
công_dụng voi gia nhu vay thi son khong con gi de che kết_cấu lop son min va mem de tan độ bền_màu uong nuoc thi van bi lem tren thanh coc nhung noi chung thi van ung nha,2
son xinh lắm mng ơi với giá này mình kh đòi_hỏi lắm mà về ưng kh tưởng luôn chất son mềm mịn thơm dễ_chịu_cực ý màu đẹp lên môi xinh xỉu luôn á son hơi bóng nhẹ còn tẩy thì trên môi quẹt 1 đường là đi luôn chứ kh như da tay trên video nhé ạ face_with_tears_of_joy,2
son thơm xỉu luôn á chất đỉnh nói_chung là ok lắm luôn smiling_face_with_open_hands,2
đóng gói gì mà xinh_xẻo dữ đến cả cái vorvungx k lỡ vứt nữa nói đến cái hộp thì lại xinh hết kế sang chảnh nữa chứ son thì phải nói đến chất màu v07 cảm_thấy rất ưng cái bụng về sự lên màu chất din đẹp môi mềm độ bám cũng ok nữa ưng,2
công_dụng son kết_cấu bột mịn độ bền_màu lì màu khá đẹp như màu môi vậy đnahs đi học thì rất ok son ny tặng nên không_chê được,2
công_dụng màu đẹp kết_cấu ổn độ bền_màu tuyệt_vời tuy giao hàng hơi lâu nhưng son khá ổn chất son mịn nhỏ nhỏ xinh_xinh,2
