processed_data,target
son đẹp lắm nha mn tuy là son nội_địa giá rẻ nhưng chất son mịn dễ tán ko bị bón cục mùi son thơm nhẹ nhẹ ko quá nồng,2
son màu lên chuẩn đẹp tuy_nhiên dễ khô nên cần dưỡng môi kĩ 1 chút,0
công_dụng rất đẹp kết_cấu tốt độ bền_màu tốt chất son mịn nhưng không bị khô lâu trôi mình thích mầu số 25 lâu trôi,2
màu đỏ trầm mà giống màu đỏ chery quá chất kem mịn đánh lên môi mướt,2
chất son với mùi của ver này thì mình vẫn luôn ưng rồi màu v21 mình vẫn dùng từ trước rồi lần này có đặt thử thêm v25 thì cũng rất đẹp v25 nó cũng gần gần như v17 đánh vào mùa đông hợp luôn màu này dùng đánh lòng môi đẹp lắm,2
màu lên khá ok son mịn không lì mùi hơi hắc nhưng kh sao nha,2
xinh xểu chất son mềm mịn lên màu chuẩn mỗi tội giao hàng lâu ơi là lâu,2
mình kh ngờ với 20 k có_thể oder được chiếc son sịn sò như vậy màu khá ưng chất son mịn và lì sẽ tiếp_tục ủng_hộ shop lâu_dài broken_heart,2
son khá bột và sẽ có độ xê_dịch nhiều khi bặm môi nhất là với những màu nude thế này mình mua màu này để làm màu base thôi với giá này thì mình cũng k kì_vọng chất son cho lắm ngoài chuyện bị giam hàng ở hải_quan từ 12 12 tới nay thì cái gì cũng ok may_mà shop gói hàng chắc_chắn,0
công_dụng làm đẹp kết_cấu mịn dễ tán độ bền_màu chắc tốt,2
son môi mới nhất của focalure sắp ra_mắt đôi môi quyến_rũ mềm và mịn như nhung son kem dạng nhung lì mới giúp môi bạn trông mơ_màng và mềm như coton khi mới thoa sẽ cảm_giác giống như đất_sét lướt nhẹ sau đó sẽ trở thà giao hàng khá lâu,2
son đẹp cực màu sin chất son okela lắm nha mọi người đáng để mua ạ,2
son lì lắm nha son lên cảm_thấy mền môi son thơm oke son thì thơm mùi socola nha money_with_wings,2
son chất đẹp xĩu lun á shiper expres dễ_thương có lần cho tui thiếu tiền hàng nữa,2
giao hàng hơi chậm mình swatch lên tay thấy 303 vs 401 màu đều kh biết lên môi ntn còn 301 thì kh đều màu cho lắm chất son êm mướt có_thể thể độ bóng nhẹ khi mới swatch nên mình nghĩ lên môi sẽ kh bị khô đâu 303 v 401 thì mướt hơn còn 301 thì swatch xong hầu_như tiệp ngay kh có độ bóng,2
công_dụng son kết_cấu xốp độ bền_màu kém son màu khá đẹp thích_hợp làm base hoặc sử_dụng bình_thường phù_hợp với da trắng son thơm mùi socola ngọt nhẹ chất son khá bột k bám môi nên dễ trôi và bị lợn_cợn nhưng do giá rẻ nên không đòi_hỏi gì nhiều,0
hai màu này xin cực thích nhất màu 03 chất son mịn mướt hdhdhd,2
công_dụng cho môi xinh_xẻo lên nữa kết_cấu k biết tả độ bền_màu màu đẹp mà chạm đâu dính đó son thơm vl luôn tưởng đâu trét lên môi màu đẹp vl biết z sắm 2 thỏi này gòi mà bay_màu lẹ lắm cũng k đòi_hỏi vì đúng giá thôi,1
được mỗi màu đỏ đất còn rượu_vang thì y_như hàng cũ để lâu ngày mùi kinh vl đã v còn đánh ko ra_màu nhìn vào chất son thì bột bột thấy ghê,0
son đẹp lém lì mịn_màng,2
màu đẹp giá_thành phù_hợp với hsv chất son_ổn phù_hợp với mọi tone da,2
dù dịch nhưng giao hàng rất nhanh 2 màu con 502 và 403 mình có test cho bạn nào tham_khảo độ bám màu k được cao mùi cam giác giống mùi cồn 1 chút nói_chung với giá tiền này mà màu son cũng như chất son thì k chê vào đâu đc hồng đất và cam cháy nhé mn,2
son xinh mịn môi giao hàng nhanh vỏ son cũng xinh ok mình test theo thứ_tự nha,2
son xinh lắm nha mng đánh lên mềm k bị khô màu chuẩn nhưng giao hàng lâu vì shop ở nước_ngoài,2
chất son ko như mong_đợi màu cũng ko xinh nữa mùi cứ bị kiểu dổm dổm sao đó mình mua sale nên có mấy nghìn th nên coi như hên_xui v,0
son đẹp mịn mướt okila,2
son đẹp nha mn chất mịn giao hàng khá nhanh nên mua ạ,2
mình cảm_thấy son mịn không bị màu sẽ không giống hình hoàn_toàn và còn tùy vào nền môi mỗi người nha nên mua dùng thử nha mn,2
son xinh tương_xứng giá tiền mềm mịn lắm nha có mùi socola mình thấy k hắc đâu,2
em này lì nhưng khá là bột nha khi tô lên tay có_vẻ là em khá dễ dùng nhưng lên môi thì có_thể thấy em này sẽ bị nhả ra một_chút vì có silicon không bay_hơi tô lòng môi không đc tô ful môi thì màu này sẽ bị già quá nếu kh makeup nói_chung với giá này thì kh đòi_hỏi gì hơn,0
xịn thiệt sự màu son chất son đẹp khỏi bàn mua quài vẫn ko muốn đổi loại son khác,2
công_dụng màu son tây kết_cấu son không lì nhiều độ bền_màu nhanh trôi màu son đẹp nhưng ăn_uống rất dễ trôi,1
son lên môi rất mịn mịn như nhung ấy thơm nx mà màu xinh dễ dùng lại rẻ còn chính hãng nx nên yên_tâm_giao hàng cx nhanh đóng gọi cẩn_thận chỉnh chu,2
son mướt chất đẹp như son đắt tiền tùy da môi các bạn nhưng mà màu rất ưng vỏ đẹp xinh lắm 9,2
son lên màu xinh lắm luôn nha chất son mềm mịn mua được 2 màu ưng dễ_sợ luôn,2
son đẹp mình mua tặng sinh_nhật bạn nên khum biết chất son ra_sao nhưng mua theo bác hằng nên oki lắm nha,1
son kem mịn siêu xịn xò luon nka 3 màu đẹp rất đáng tiền anh shiper đz wa chời,2
son đẹp màu xinh son lên mềm môi nhưg dễ trôi thơm giá nv à ốn ạ,2
son đẹp vỏ ngoài đáng yêu lì mịn đáng đồng_tiền bát gạo nhưng k thơm,2
hehe xịn xò lắm aạ xinh mà tại mình chụp kh đẹp lắm thui màu son lên cũng đẹp lắm lúc chọn màu 502 mình cũng hơi sợ sẽ kh hợp nma đọc fb thấy tốt nên đã qđinh mua và kh phải hối_hận luôn ạ hehe màu kiểu mlb xinh_xắn tự_nhiên chất son cũng mềm mềm mịn mịn xịn lắm 10 đỉm,2
son không lì lên màu xấu khó đánh các bạn không nên mua,0
giao hàng siêu nhanh dù là hàng quốc_tế màu đẹp mịn mà thơm lắm na,2
son bột quá hic tô nhạt cũng khá xinh giao hàng nhanh_chóng shiper nhiệt_tình đóng_gói cẩn_thận mỗi tội son bay_màu nhanh quá,0
son khó tán màu xinh hơi mùi nhựa á nhưng hợp giá tiền nên ok giao hơi lâu,0
xinh xỉu lên xỉu xuống í check được mã màu đẹp với không bị khô môi lắm đâu sparkles,2
chất son mịn mượt k bị khô môi và có mùi thơm nhẹ_nhàng dùng khá thích,2
công_dụng lên màu đẹp kết_cấu tốt chất son mượt độ bền_màu lâu trôi giá rẻ hàng tốt sài rất thích,2
công_dụng son lên màu đẹp kết_cấu khá li_độ bền_màu khá dep d giao hàng nhanh đóng gói hàng cẩn_thận chất_lượng sẽ ủng_hộ nữa ạ,1
h a mang tc nhận xu son màu đẹp 2 màu đều rất hịn thơm mùi sô_cô_la mà đánh lên thì nhẹ ko bết hay nặng môi xịn OK_hand_light_skin_tone,2
công_dụng son môi kết_cấu đóng_gói bao_bì đẹp son lên màu đẹp độ bền_màu son lên màu đẹp đánh son để khô bám lâu,1
môi khô thì ko nên dùng nó k đẹp thứ hai là khi tô lên môi hơi bột tý mùi thì hắc quá nó k đc thơm cái mùi của nó kiểu như bị hóa_chất kiểu gì ấy màu lên thì đẹp cũng đều chút tạm được mà dùng nhìu k bik có sao k chắc lâu_lâu dùng để mix màu thì đc,0
son đóng_gói kỹ bên ngoài thì xinh_xắn chất thì mềm mịn siêu ưng chỉ là hơi mau trôi xíu thôi,2
son đẹp mịn sài chất siu thích,2
màu son không hợp da mình cho lắm mình tông da cũng khá trắng son siêu lì tưởng son nhẹ nhẹ dạng nước mà nó tệp hẳn vào da ngay_lập_tức,0
màu sơn đẹp lắm nha cũng không lì và giữ màu lâu ăn sẽ trôi nhưng được_cái kg bị khô môi đâu mua 2 cây 9 k quá rẻ luôn nước_ngoài nên ship về hơi lâu,2
đánh mịn lên đúng màu mùi siu thơm giá lại rẻ siu ưng luôn,2
mua cây thứ 2 của shop chất và màu vẫn ok nhưng mình thấy vẫn thích màu 25 hơn,2
mình thấy màu giống hình mà makeup lên xinh lắm đó chất son thì miễn bàn trước giờ rất thích chất son của merzy lâu trôi lớp base k bị hồng sến,2
chất son khá ổn mới test thử 2 cây thì lên màu chuẩn nha mùi nên mình khá thích red_heart,2
màu đẹp chất son mướt lì mỗi tội oder nhầm vỏ cũ mọi thứ đều perfect trừ cọ tán quá chán luôn,2
giao hàng nhanh son vỏ đẹp lên màu đẹp mịn rất okio với giá này,2
công_dụng depjd kết_cấu ok độ bền_màu ok mascara rấc lè xinh luông son mua thỏi t2 ruìu,2
màu 92 rất đẹp nha chất son lỏng nhg đánh lên môi sẽ lì luôn ko bị dính đâu cảm_giác đánh như ko đánh ấy ship trong vòng 1 tuần lúc lấy cọ son ra hơi kẹt thôi còn đâu mình nghĩ ok hundred_points,1
son đẹp hơi khô tí nhưng mà với giá như vạy thì xứng_đáng rồi growing_heart giao hàng hơi lâu chắc do vận_chuyển nên hộp son hơi bị méo ảnh vid mang tính_chất lấy xu,2
giao hàng nhanh chất son cũng ok mịn nhưng mình ko thích màu này một_tí huhu smiling_face_with_hearts,2
công_dụng son môi kết_cấu kem lì độ bền_màu tốt lên màu chuẩn lắm mng ơi không bị sỉn men răng hay kén da đâu da ngăm hay da_trắng đều dùng được đáng đồng_tiền ghê lun mình được tặng thêm gương lì_xì cute lắm mng nên thoa một lớp son_dưỡng trước khi dùng nhe nên mua nha mng,1
hàng quốc_tế nên giao hơi lâu đóng_gói siêu cẩn_thận chắc_chắn luôn son màu đẹp mịn rất thích smiling_face_with_heart eyes,2
son lên màu rất đẹp chất cx đẹp mùi k thơm lắm nhưng vs số tiền đó thì rất được luôn,2
độ bền_màu nice công_dụng nice kết_cấu nice son thơm màu đẹp xỉu giá rẻ cực thích mấy mẫu son nội_địa trung,2
công_dụng son nà kết_cấu đẹp xinh nà chất_lượng sản_phẩm tuyệt zời ạ,2
chất son mịn màu son lên đều săn đc sale nên giá rất mềm được tặng thêm 1 cây con nhỏ,2
hm chất son mình kh thích lắm màu cũng hơi oke thôi nha,0
son khi thử lên trên t rất mướt nhưng khi dùng trên môi thì không đi nhưng tiền nào của đấy thôi,0
màu đẹp nha mọi người mình đã mua 3 cây của hãng này rồi xài son mịn màu đẹp chỉ có là ăn_uống thì cũng mau bị trôi lắm á,2
ui son đẹp nhất từ trc tới giờ mình dùng son ko bị bột đánh lên mịn môi lắm,2
son lên môi mướt mịn thiết_kế kh đẹp lắm nhưng xài khá ổn nên mua,2
màu son đẹp lắm ạ mềm mịn thơm nữa mọi người nên mua nha beaming_face_with_smiling_eyes,2
màu 301 đẹp chất son mịn thơm như mùi kẹo màu 203 tô lên kiểu hồng cánh sen mọi ng cẩn_thận nha,2
son giao hơi lâu nma kh sao chất_thơm son mướt xinh sẽ quay lại ủng_hộ tiếp,2
son xịn lắm lun thỏi này thỏi thứ 1090 rùi á mềm mượt thơm mauyuỳu đẹp nên mua,2
thỏi rất là đẹp nè đóng_gói rất xịn luôn chưa dùng nen cũng kb sao nhưng mà chất so rất ok nha m g ơi,2
son chất đẹp khá lì có lớp màu nhẹ sau khi trôi,2
công_dụng son bôi lên môi khá đẹp có mùi dễ_chịu chất son êm lắm nha dễ tán kết_cấu ổn độ bền_màu chưa đánh_giá được giá cũng rẻ chất_lượng ổn khâu chuẩn_bị hàng của shop khá lâu phải nhắn_tin shop mới đi hàng cho khách mong_shop có_thể cải_thiện,2
xinh lắm luôn ạ trông màu đẹp cute muốn xỉu lại còn mịn và lì nữa,2
mình thích 302 nhưng mà tán khó vì nó quá lì_lì như màu_nước ấy màu 403 tán dễ cũng đẹp nữa giao đủ và đúng hàng nhưng mà có 2 4 gam thôi hơi bé và nhẹ hơn tưởng_tượng,0
đóng gói sản_phẩm đẹp và chắc màu quá xinh chất mịn giao hàng nhanh,2
son chất mịn k bị nặng môi bên ngoài vỏ son cũng khá ưng nha mọi người nên mua nhé,2
săn sale 24 k cho 1 thỏi son quá ưng_ý chất son mịn đánh lên môi chuẩn màu,2
màu đẹp mướt lắm luôn,2
trời ơi săn được sale quá_ư rẻ luôn ý mà shop gói rất cẩn_thận trông thỏi son sang xịn mịn luôn mình mua tặng bạn nên chưa thử được chất son,1
son thơm màu xinh vỏ cũng sang xịn mịn giá cũng rẻ hahahaha,2
son của nhà bia thì khỏi nói rồi thích dã_man mình có cả chục thỏi các ver khác nhau son đắt tiền mình cũng có nhiều nhưng dùng thấy ưng mỗi chất của nhà bia đã thế còn mua son còn đc tặng bao lì_xì với cái gương xinh xỉu,2
cây son đẹp chất son ok giá quá rẻ sẽ ủng_hộ thêm màu lên môi chuẩn,2
màu xinh nhá màu này đánh nhạt cũng xinh mua tặng bạn nên ko chụp hình lại đc nói_chung ok ko có gì chê son chất kem ko khô môi bị cái hay dây ra thành ly cốc nhanh bay_màu,2
công_dụng msaf mình thấy màu khá đẹp với tôn da á ban_đầu mh thích kiểu hơi nâu đất cam cam mà cái này hơi nghiêng màu gạch ý nhưng cũng ok bôi lên_da tay thì thấy màu chuẩn hơn môi các b muốn lên đúng màu chắc phải dùng ít che khuyết_điểm lên môi á chất mịn ok nha,2
son lên màu đẹp chất son rất mịn xinhjhb,2
màu ở ngoài đậm hơn trong video nha mn chất son khá ok mùi son ko quá nồng chấp_nhận đc giá_thành ổn_áp đối vs sv hs mua nha mua nha,2
son xinh không bị khô môi giao hàng siêu nhanh shope mal nên chắc_chắn uy_tín,1
son chất đẹp gói hàng cẩn_thận dễ_thương m còn nhận được thiệp giáng_sinh màu đẹp siêu ưng ạ,2
chất son mịn thơm màu xinh lắm ạ vỏ son cũng siêu xinh luôn ạ mua về dùng thử mà ưng hết nấc,2
công_dụng đẹp kết_cấu đẹp thơm độ bền_màu son khá lì kh khô môi son test ra_tay thì rõ ánh cam lắm nma lên môi thì xinh xĩu luôn ra cam đất có điều t kh thích mùi son lắm chắc do quen dùng son thơm như merzy với bg r k khá đáng thử,2
công_dụng đẹp nha gói hàng cẩn_thận kết_cấu ok độ bền_màu ok nên mua nha mn vừa rẻ vừa đẹp ok lắm,2
chất son bột bột không thíhc lắm nma giá rẻ nên cx k đòi_hỏi nhiều màu ôk,0
chất son mịn có điều mùi ko thơm lắm hơ nồng nơi chung cũng đc đánh_giá cho shop 4 sao,2
ulatr từ cách gói hàng đến chất son cứ phải gọi là đỉnh eẹ,2
màu lên đẹp chất son okila giao hàng khá nhanh,2
nhận hàng cực ki ưng luôn shop giao đúng màu đúng mẫu lại còn tặng thêm mặt_nạ nữa chất son k thua gì mấy loại giá 1 x 2 x luôn sẽ ủng hô lâu da i,2
dùng chán rất bột luôn mình sẽ ko bao_giờ mua lại sp của focalure vì chất_lượng quá tệ,0
công_dụng dep kết_cấu dep độ bền_màu 10 chất_lượng sản_phẩm tuyệt_vời đóng_gói sản_phẩm đẹp và chắc_chắn rất đáng tiền,2
cầm ko nặng_tay ko có mùi gì nma lên môi rất mềm và nhẹ nhoa ko dính bết rì lun cả 2 màu đều đẹp,2
kết_cấu chất son perfect diary luôn làm mình thích màu đẹp,2
mua lần đầu mong rằng chất son vẫn giống những shop trước mình mua,1
công_dụng làm đẹp kết_cấu chưa test độ bền_màu chưa test bao_bì sp đẹp đóng_gói cẩn_thận giao hàng đúng dự_kiến 5 sao cho sự tin_tưởng mal,1
công_dụng djsj kết_cấu 1 cay son_độ bền_màu nhanh troi son khá nhanh trôi mặc_dù mình tô lâu r nhưng chỉ chạm tay vào là dính son luôn k hài_lòng ở điểm đó,1
son xinh hơi khó tán nhưng với giá này là quá ổn rồi mọi người nên mua,0
son mỏng nhẹ rất đẹp nhưng trôi nhanh ko lì như thông_tin sp để giao hàng rất mua sale giá hời nên ko sao,2
màu đẹp lắm luôn nên mua ạ_shop đóng_gói cẩn_thận chất son mịn đẹp lì,2
lần đầu_tiên mua ở đây mà ưng lắm luôn được tặng gương bé bé xinh_xinh nữa vì mua cho bạn nên chưa biết đánh_giá chất son thế_nào nhưng shop gói hàng mình ưng_ý lắm hộp cũng không móp chỗ nào luôn red_heart,1
công_dụng son môi kết_cấu đẹp chất son mỏng nhẹ giao hàng nhanh son màu rất đẹp nên mua nha mọi người,2
mình thấy chất son k ổn lắm hjc mua shopemal yên_tâm hơn gói hàng chắc_chắn cực,0
giao hàng hơi lâu đóng_gói sp được nmà mở được cái hộp son ở ngoài hơi mệt son mịn lắm lên màu đẹp rất ưng two_hearts,2
màu son khác_hình sơn rất bột tô lên môi bị lộ vân môi giao hàng siêu chậm được mỗi cái là mình mua đc với giá sale với giá này thì ko đòi_hỏi nhiều,0
giao hàng nhanh son cũng đẹp í son ra đẹp lắm hơi khô tí nhưng son lì face_with_tears_of_joy,0
với giá hơn 4 chục thì chất son đúng mịn như nhung mùi thơm lòng cảm_ơn shop màu 202 203 có_vẻ hợp_lý nên mình chọn thumbs_up,2
màu 301 xinh xỉu growing_heart bên trái cơ_mà hơi khô nha mùi sicula thơm nhẹ nhẹ pleading_face màu kiểu cam nâu đất nha,0
màu khá đẹp mình chưa test lên môi nên không rõ chất màu 939 đẹp từ vỏ đến màu nhé,1
độ bền_màu được tầm 5 6 h ý hàng giao hơi lâu vì do dịch chất cũng khá oki với giá này được son như z là ok r,2
son màu đẹp chất rất mịn nha,2
son ok sài ổn màu lên đẹp son mướt mềm nhưng ko lì lắm rẻ nên ko đòi_hỏi j,2
cảm_giác son rất ít mình nhận được son thấy có một khoảng trắng ở son,0
son màu rất đẹp lên môi đúng chuẩn màu son mịn và lâu trôi nữa đẹp,2
đóng gói chắc_chắn son cầm chăc tay màu xinh chat son lỏng bám khá chắc,1
công_dụng son kết_cấu vừa tay độ bền_màu nhanh trôi son chất nhung có mùi socola chocolate_bar màu xinh hình_ảnh mang tính_chất minh_họa,1
công_dụng son kết_cấu lỏng tầm 30 s lì lại lên môi_độ bền_màu độ bền tầm 4 tiếng còn lại lớp tint màu xinh lắm mn ơi nhưng đánh đậm thì hơi già nên đánh nhẹ thoi màu ở ngoài trầm hơn hình một_chút,1
nhận hàng hơi lâu nhưng bù lại đồ xinh xỉu son chuẩn màu nhưng lì lắm nha mng với hơi khó tán,0
son lên màu đẹp lắm ạ mịn môi nhưng nhanh trôi phù_hợp với giá,2
2 màu đều lên đẹp chất son k bị đặc quá như mấy phiên_bản trc riêng bản_thân mk thấy màu 25 dễ dùng nhất,1
son xinh lắm lun chất mềm nhẹ như ko đánh luôn nha lần sau sẽ qlai uho_shop tiếp,2
hàng vô_cùng chất_lượng màu son đẹp mịn nên mua thử nha mn xinh xỉu,2
công_dụng ổn kết_cấu đẹp độ bền_màu lâu ok,2
màu đẹp lên khá giống ảnh son khá đặc vỏ khá xịn ship nhanh,1
giao hàng hơi lâu phấn phủ phấn mắt và mascara ổn chất son hơi lỏng,0
sản_phẩm rất đẹp son lên mùi rất thơm ko bị khô môi nha mn son chính hãng nha mn ai ch có nên tậu 1 em đi ạ mình biết shop qua fb rất uy tính thank_shop,2
dùng bia nhiều r nma có_vẻ chất son của bia đợt mới ra vẫn ok nhất so với các phiên_bản sau có điều hơi buồn son nhận về lần này bị mất 1 đốt tay là k có son chất son okila mùi thơm nma màu này hơi dừ với mình mùa dịch đặt_hàng từ 2 nay 25 nhận đc r đvc nhanh phết,2
công_dụng ok độ bền_màu ok màu son 908 khá đẹp lên môi mềm mịn giao hàng từ nước_ngoài nên lâu bọc hàng đóng_gói rất cẩn_thận mọi người nên thử màu_sắc sản_phẩm 901 904 905 906 907 908 909 910 920 92,2
màu rất đẹp giống trong hình chất son thì hơi bột nhưng với giá này là ok lắm rồi,0
công_dụng lam dep moi kết_cấu tronf độ bền_màu 10 đẹp vãi thơm mùi huhu ncl ưng,1
ok rất thích smiling_face_with_tear mình có xài qua một set a rồi mà hết mất màu 01 nên mua bù hic mùi thơm chất mịn không bị khô môi smiling_face_with_hearts rất ưng,2
giao hàng nhanh son chất mềm mịn lên màu chuẩn mùi thơm,2
son siêu xinh_đẹp mịn thơm rất ổn luôn giao nhanh hơn dự_kiến,2
test lên tay là màu cam nhưng lên môi lại là màu khác chất son hơi bột nói_chung tiền như_vậy cũng là ổn r,0
son rẻ quá mua về ko dám đập lên mồm nhưng thử tí trên môi thì thấy chất son cũng ok ko biết để lâu sẽ như nào màu 402 đẹp nhưng 505 ko đúng màu ý đừng mua nha mng son có in thành_phần trên bao_bì khá rõ_ràng với đẹp hehe,2
son lên màu hơi đậm so vs mình tưởng_tượng chất son lỳ đặc_trưng của bia và cái mùi đặc_trưng dù mình ko thích lắm giá_cả đáng tiền,1
theo mình thì chất son khá khó tán răng nhìn trắng hơn thiệt mình muốn mua màu tươi xíu mà màu có_vẻ hơi trầm ánh cam nha,0
săn sale nên giá khá ổn nhưng bôi hơi bị khô môi k đc mịn lắm,0
son mịn đẹp lên màu chuẩn hình_ảnh chỉ mang tính_chất nhận xu,2
chất_lượng sản_phẩm rất tốt chất son mềm mịn không kém gì mấy với mấy loại son hàn luôn á trời tuy là hàng nước_ngoài nhưng mà giao siu nhanh luôn á nói_chung là rất thích growing_heart,2
son đẹp giao nhanh đóng gói cẩn thân chất son rất mịn,2
đóng hàng kỹ_lưỡng son màu đẹp lên mịn_mà không bị vón dùng rất là thích,2
công_dụng hàng hơi vón cứ bị sao í tiền nào của lấy í nên là mn suy_nghĩ nên mua không nhé cguws nó quạnh khô,0
công_dụng đẹp tốt kết_cấu ok độ bền_màu tốt mình đặt để đem tặng giáng_sinh mà sinh lâu qá nên thành quà năm mới luôn màu đẹp bên nhg mà bị bết và mùi hơi ghê ảnh ở dưới không phải của mẫu này nha màu đấy mình mua mình tặng nên k chụp đc,0
giao hàng nhanh chất son mịn son thơm thơm nhưng thấy màu 203 không lì dễ trôi chất son mịn,2
bạn nào kiểu sexy đi date tối thì oánh màu này bao xinh luôn son thơm lắm ko hề khô môi ngheng,2
son đẹp lắm ặ mềm mịn lắm bao_bì xịn nữa giao hàng hơi lâu nhưng do hàng quốc_tế nên hog sao,2
công_dụng hồng môi kết cấu độ bền_màu mềm mướt lắm ấy mình thấy đánh 1 lớp son_dưỡng lên trước xong đánh son dễ tán hơn á ship hơi lâu nhưng mà bù lại anh ship cưng xỉu luôn á trời,2
son rất rất xinh luôn nha smiling_face_with_hearts nắp nhung sờ sướng_tay dã_man smiling_cat_with_heart eyes chất son xịn đẹp hơn mình tưởng giá okela sẽ ủng_hộ dài_dài anh shiper đẹp_trai kissing_cat,2
kết_cấu mịn độ bền_màu nhanh troi không bám màu son không hề lì nha đánh lên môi khá nhẹ và mịn nhưng mà lau 1 cái là hết_sạch luôn,2
giao hàng lâu quá gói hàng đầy_đủ son này mình dùng mấy cây rồi dễ đánh nhưng cũng dễ trôi vẫn thích vì ko gây khô môi,2
xịn mềm môi lắm luôn 3,2
màu khá xinh mềm mịn mượt môi lên môi mình hơi ngả tím xíu xíu nhma cũng tùy sắc_tố với môi khác nhau á mn,2
son lên màu xinh nha chỉ là mình thấy son hơi nhớt nhưng tí là bìnu thường à đựic_shop tặng thêm dưỡng mô red_heart,1
màu đẹp nhưng chất son dởm bôi lên không đều được màu chỗ đậm chỗ nhạt không nên mua son_shop này nha mng,0
công_dụng đánh lên môi rất đẹp và tuyệt_vời kết_cấu gọn_gàng dễ mang đi ra ngoài độ bền_màu đẹp,1
mua 2 lần rồi ưng giá rẻ chất son ổn nhưng nhanh trôi màu tươi hơn trong ảnh của shop,2
màu son xinh mùi thơm nhẹ dễ tán,2
giao hàng đúng tiêu_chuẩn đóng_gói kỹ càng son lên màu chuẩn mà hơi khô môi xíu,0
giao hành khá lâu son đẹp mua 3 lần rồi son êm mướt màu ok không lì lắm,2
chất son đặc bạn nào môi khô là lộ rõ rãnh môi và màu lên k đều màu này đánh lòng môi hoặc mix vs màu khác sẽ đẹp hơn lên ful môi nhìn hơi dừ,0
màu mình mua xinh xỉu luôn chất son mềm nhẹ như nhung ấy k làm khô môi thích_hợp để dùng vào mùa đông,2
